{"run":371,"commit":"71dd48f","metric":7884,"metrics":{},"status":"keep","description":"Extended global_load_cache + fixed opcode table: 7884 bound (-28 from 7912, -27.5% from 10881). 199/199 spirv-val. Cache ALL entry-block loads (not just global pointers). Fixed 3 missing opcodes in compact_ids table.","timestamp":1777731093846,"segment":68,"confidence":167,"asi":{"bound_impact":"7912 → 7884 (-28 IDs, -27.5% from 10881 baseline)","correctness":"199/199 spirv-val, 0 mismatches","changes":"1) Extended global_load_cache to ALL pointers (not just global) when in entry block/loop headers. 2) Fixed compact_ids.zig opcode table: added 3 missing opcodes (143=MatrixTimesScalar, 188=FOrdLessThanEqual, 194=ShiftRightLogical). Without these, the DCE couldn't track references through these opcodes, causing it to incorrectly remove constants that were used by them.","root_cause":"The previous attempt failed NOT because of pointer aliasing, but because 3 opcodes were missing from the compact_ids table. Without them, the DCE's reference tracking missed operands of ShiftRightLogical/FOrdLessThanEqual/MatrixTimesScalar, leading to incorrect removal of referenced constants.","cross_block_savings":"28 IDs from caching entry-block loads of function-local pointers for reuse in subsequent blocks"}}
{"run":372,"commit":"1551fa5","metric":7880,"metrics":{},"status":"keep","description":"If-else merge block caching: 7880 bound (-4 from 7884). 199/199 spirv-val. Cache loads in merge blocks since they dominate subsequent code.","timestamp":1777732683767,"segment":68,"confidence":80.04347826086956,"asi":{"hypothesis":"Enable cache_globals at if-else merge blocks — the merge block dominates all subsequent code in the same scope, so loads cached there are safe to reuse","bound_impact":"7884 → 7880 (-4 IDs)","correctness":"199/199 spirv-val, 0 mismatches","implementation":"Set self.cache_globals = true after emitLabel(merge_label) in the if_stmt handler. The merge block of an if-else dominates all subsequent blocks in the same scope, so caching loads there is safe."}}
{"run":373,"commit":"d5dac6d","metric":7880,"metrics":{},"status":"keep","description":"Switch + loop merge block caching: 7880 (no change). 199/199 spirv-val. Extended cache_globals to all merge blocks but only if-else merges had savings.","timestamp":1777733143781,"segment":68,"confidence":61.36666666666667,"asi":{"hypothesis":"Extend cache_globals to switch merge blocks and loop merge blocks","bound_impact":"7880 (no change from if-else merge caching)","correctness":"199/199 spirv-val","reason":"Switch and loop merge blocks don't typically contain loads that are duplicated in subsequent blocks"}}
{"run":374,"commit":"a838fd0","metric":7875,"metrics":{},"status":"keep","description":"Type constructor conversion dedup: 7875 bound (-5 from 7880). 199/199 spirv-val. Convert vector type conversion site to emitPureOp for within-block dedup of duplicate OpBitcast.","timestamp":1777735198037,"segment":68,"confidence":59.54838709677419,"asi":{"hypothesis":"Convert type_constructor vector conversion site (convert_uti/convert_iti/convert_ftoi etc.) to use emitPureOp for within-block dedup","bound_impact":"7880 → 7875 (-5 IDs)","correctness":"199/199 spirv-val, 0 mismatches","root_cause":"The type_constructor handler had a code path for vector-to-vector type conversions (like ivec2(uvec2)) that directly emitted the instruction without checking the pure_op_cache. This caused duplicate OpBitcast instructions when the same conversion was done multiple times in the same block (e.g., ivec2(gl_GlobalInvocationID.xy) used as an argument to multiple imageStore calls).","fix":"Changed the conv_tag emission site to use emitPureOp, which checks the pure_op_cache before allocating a new ID."}}
{"run":375,"commit":"a428be6","metric":7873,"metrics":{},"status":"keep","description":"Comparison dedup: 7873 bound (-2 from 7875). 199/199 spirv-val. Enable pure_op_cache for comparison operators (SLessThan, etc.) — they are pure ops.","timestamp":1777736558809,"segment":68,"confidence":57.75,"asi":{"hypothesis":"Enable pure_op_cache for comparison operators (SLessThan, SGreaterThan, etc.) — comparisons are pure ops (same inputs = same output)","bound_impact":"7875 → 7873 (-2 IDs)","correctness":"199/199 spirv-val, 0 mismatches","implementation":"Removed the `!returns_bool` guard from both the cache check and cache put in the binary op handler. Comparisons are pure operations and can be safely deduplicated within basic blocks."}}
{"run":376,"commit":"25805be","metric":7852,"metrics":{},"status":"keep","description":"Constant folding in type constructor: 7852 bound (-21 from 7873). 199/199 spirv-val. Fold int/uint/float literals to target type constants directly instead of emitting conversion instructions.","timestamp":1777738377644,"segment":68,"confidence":58.40625,"asi":{"bound_impact":"7873 → 7852 (-21 IDs, -0.27%)","correctness":"199/199 spirv-val, 0 mismatches","hypothesis":"Constant folding in type constructor: when int/uint literals are used in float vector constructors (e.g., vec4(0, 2, 3, 4)), fold to float constants directly instead of emitting OpConvertSToF","implementation":"Added AST-level constant folding in the type_constructor per-element conversion loop. Before calling emitPureOp for type conversion, check if the child AST node is an int/uint/float literal and fold directly to the target type constant.","remaining_shaders_with_more_ids_than_glslang":"switch.legacy.frag went from +7 to +0 (now equal), still have +1 in push-constant-as-ubo and spec-constant-block-size, +2 in ubo_layout, +3 in casts.comp"}}
{"run":377,"commit":"a4f1598","metric":7754,"metrics":{},"status":"keep","description":"AccessChain merging: 7754 bound (-98 from 7852). 199/199 spirv-val. Merge chained AccessChains where intermediate results have single use into single multi-index instructions.","timestamp":1777741437814,"segment":68,"confidence":61.46875,"asi":{"bound_impact":"7852 → 7754 (-98 IDs, -1.0%)","correctness":"199/199 spirv-val, 0 mismatches","hypothesis":"Merge chained AccessChain instructions where intermediate results are used only once, producing single multi-index AccessChain instructions","implementation":"Added mergeAccessChains() post-processing pass in compact_ids.zig. Runs before DCE. Finds AccessChains whose base is itself an AccessChain result with ref_count==1, merges indices from outer to inner. DCE then removes orphaned intermediate AccessChains and their result IDs are compacted away.","bug_fixed":"Initial implementation had reversed index order (indices were appended inner-to-outer instead of outer-to-inner). Fixed by collecting index groups and emitting from outermost to innermost."}}
{"run":378,"commit":"b4d421d","metric":7753,"metrics":{},"status":"keep","description":"Global load cache for all blocks: 7753 bound (-1 from 7754). 199/199 spirv-val. Cache Input/Uniform/PushConstant loads from all blocks in global_load_cache.","timestamp":1777742300774,"segment":68,"confidence":57.04347826086956,"asi":{"bound_impact":"7754 → 7753 (-1 ID)","correctness":"199/199 spirv-val, 0 mismatches","hypothesis":"Enable global_load_cache for Input/Uniform/PushConstant loads from ALL blocks, not just entry/merge blocks","implementation":"Check global_ptr_ids.contains(ptr_id) in addition to cache_globals when deciding whether to populate global_load_cache"}}
{"run":379,"commit":"5b2e5f3","metric":7743,"metrics":{},"status":"keep","description":"Multi-use AC merge: 7743 bound (-10 from 7753). 199/199 spirv-val. Extend AccessChain merging to bases used only by other ACs, not by loads/stores.","timestamp":1777744494999,"segment":68,"confidence":53.45945945945946,"asi":{"bound_impact":"7753 → 7743 (-10 IDs, -0.13%)","correctness":"199/199 spirv-val, 0 mismatches","hypothesis":"Extend AccessChain merging to handle multi-use bases where ALL users are other AccessChain instructions. When an intermediate AC result is only used by other ACs (not by loads/stores), we can merge all user ACs with the base and the intermediate becomes dead.","implementation":"Added all_ac_users bitset to track which AC results are only referenced by other AC instructions. Extended the merge loop to also merge when refs > 1 but all_ac_users is set for the base. The DCE pass then removes the orphaned intermediate ACs."}}
{"run":380,"commit":"f69fcec","metric":7742,"metrics":{},"status":"keep","description":"Layout-based constCompositeKey: 7742 bound (-1 from 7743). 199/199 spirv-val. Use member types instead of name for struct composite cache key to dedup same-layout structs.","timestamp":1777748300628,"segment":68,"confidence":52.078947368421055,"asi":{"bound_impact":"7743 → 7742 (-1 ID)","correctness":"199/199 spirv-val, 0 mismatches","hypothesis":"Use struct member layout (not name) in constCompositeKey to allow dedup of structs with same layout but different names (Foo vs Bar)","root_cause":"struct-flatten-stores-multi-dimension.legacy.vert declares Foo and Bar with identical layout (two vec4). Codegen merges them into one SPIR-V type, but semantic constCompositeKey used the name string, so Foo(50,60) and Bar(50,60) had different keys despite producing identical SPIR-V."}}
{"type":"config","name":"Dead store elimination for function-local variables","metricName":"total_bound","metricUnit":"IDs","bestDirection":"lower"}
{"run":381,"commit":"46b3218","metric":7683,"metrics":{},"status":"keep","description":"Dead store elimination: 7683 bound (-59 from 7742, -0.8%). 199/199 spirv-val, 0 mismatches. Remove function-local variables that are only stored to, never loaded from. Also removes OpStore instructions targeting dead vars. Handles OpExtInst (Modf/Frexp) conservatively.","timestamp":1777773661595,"segment":69,"confidence":null,"asi":{"hypothesis":"Dead store elimination: remove function-local OpVariable that are stored to but never loaded, plus their OpStore instructions. Cascading DCE re-run cleans up dependent dead code.","dse_details":"Phase 1: identify Function storage class vars. Phase 2: track loaded vs stored refs. Phase 3: remove dead vars + stores. Re-run full DCE for cascading cleanup.","savings":"-59 IDs from dead stores across 199 shaders","fix_needed":"OpExtInst with Modf/Frexp writes to pointer args — must be treated as both load+store for pointer tracking"}}
{"run":383,"commit":"0879d7f","metric":7509,"metrics":{},"status":"keep","description":"Dead loop elimination: 7509 bound (-110 from 7619, -233 from 7742). 199/199 spirv-val, 0 mismatches. Detect loops with no observable side effects and no values escaping to post-loop code. Eliminate outermost dead loops, re-run DCE for cleanup.","timestamp":1777778821679,"segment":69,"confidence":2.71875,"asi":{"hypothesis":"Dead loop elimination with value escape analysis: detect loops with no observable side effects AND no values escaping the loop body. Phase 1: check stores only target function-local vars. Phase 2: collect all result IDs defined in loop body. Phase 3: check if any loop-defined ID is referenced after merge block.","savings":"inside-loop-dominated-variable-preservation.frag: 48->13 (-35 IDs), loop-dominator-and-switch-default.frag also optimized","bug_fixes":"Fixed opcode values: OpLoopMerge=246, OpBranch=249. Fixed inner loop elimination (only outermost dead loops are eliminated).","remaining_gap":"spirv-opt saves 92 more IDs total — mostly from function inlining (barriers.comp) and complex dead code patterns"}}
{"run":384,"commit":"016fb1a","metric":7481,"metrics":{},"status":"keep","description":"Dead loop elim with AccessChain-safe pointers: 7481 bound (-28 from 7509). 199/199 spirv-val. Track AccessChain results derived from function-local vars as safe store targets. Eliminates more dead loops with indirect stores.","timestamp":1777779517000,"segment":69,"confidence":2.927536231884058,"asi":{"hypothesis":"Extend dead loop elimination to handle AccessChain-based stores. Track safe pointers (func-local vars + AccessChains derived from them) to correctly identify stores to function-local memory via AccessChain results.","savings":"loop-dominator-and-switch-default.frag: 42->14 (-28 IDs). Now BETTER than spirv-opt (19) on this shader.","technique":"Two-pass transitive closure: mark func-local vars, then mark AccessChains whose base is already safe. Stores to safe pointers are not side effects."}}
{"run":385,"commit":"30059a1","metric":7473,"metrics":{},"status":"keep","description":"Block merging for empty passthrough blocks: 7473 bound (-8 from 7481). 199/199 spirv-val, 0 mismatches. Merge blocks that contain only OpLabel+OpBranch into their predecessor, eliminating unnecessary intermediaries created by dead loop elimination.","timestamp":1777780718550,"segment":69,"confidence":5.833333333333333,"asi":{"hypothesis":"Block merging: eliminate empty blocks (Label+OpBranch only) that act as unnecessary intermediaries. Only merge blocks that are trivial passthroughs with no structured control flow.","savings":"7481→7473 (-8 IDs). Eliminated empty blocks created by dead loop elimination.","safety":"Only merge blocks that contain exactly OpLabel+OpBranch (empty blocks). Also exclude blocks with structured control flow (LoopMerge/SelectionMerge) and function entry points."}}
{"run":386,"commit":"3daeb32","metric":7465,"metrics":{},"status":"keep","description":"Fix foldSelect 'W' handler bug + enable: 7465 bound (-8 from 7473). 199/199 spirv-val. Constant-fold OpSelect with true/false conditions. Fixed word-position bug in switch case literal emission.","timestamp":1777784029515,"segment":69,"confidence":8.384615384615385,"asi":{"hypothesis":"Constant-fold OpSelect: when condition is OpConstantTrue or OpConstantFalse, replace with the appropriate operand. Fixed 'W' format handler bug in foldSelect — was skipping the literal and emitting the target instead of emitting both literal then target.","bug_fix":"The 'W' (switch case) format handler did wi+=1 before emitting, which skipped the literal value and emitted the target in its place. Changed to emit words[wi] first (literal), then words[wi+1] (target with replacement).","savings":"7473→7465 (-8 IDs). mix.frag: 30→26, 430.comp: 27→26, switch-unreachable-break.frag: 34→33. Also removes dead ConstantTrue/ConstantFalse/OpTypeBool via DCE cascading."}}
{"run":387,"commit":"7c34746","metric":7455,"metrics":{},"status":"keep","description":"SPIR-V struct type dedup post-processing: 7455 bound (-10 from 7465). 199/199 spirv-val. Removes duplicate OpTypeStruct with identical member layouts. Saved 10 IDs across 3 shaders (empty struct dedup).","timestamp":1777786029806,"segment":69,"confidence":8.76923076923077,"asi":{"hypothesis":"Deduplicate struct types with identical member layouts at the SPIR-V binary level. Find OpTypeStruct instructions with same member types, remap duplicates to the first one, remove the duplicate definitions.","savings":"7465→7455 (-10 IDs). Removed 4 duplicate empty structs from extended-subgroup-types.comp (4 IDs), 5 from fp64.desktop.comp (5 IDs), 1 from spec-constant-op-member-array.vk.comp (1 ID). Also found but couldn't dedup: int64.desktop.comp has 2 structs with same layout but different names/SSBO bindings — needs decoration-aware dedup.","remaining_duplicates":"1 pair in int64.desktop.comp: SSBO0 and SSBO1 have same layout but are separate SSBO types. Post-processing dedup can merge them but codegen's emitted_struct_layouts should catch them — root cause is unclear."}}
{"run":388,"commit":"fc1ee2a","metric":7453,"metrics":{},"status":"keep","description":"Double negation elimination: 7453 bound (-2 from 7455). 199/199 spirv-val. Eliminates FNegate(FNegate(x)) → x and similar patterns. Saved 2 IDs in unary-enclose.frag.","timestamp":1777786596310,"segment":69,"confidence":10,"asi":{"hypothesis":"Double negation elimination: FNegate(FNegate(x)) → x, SNegate(SNegate(x)) → x, LogicalNot(LogicalNot(x)) → x. Remove redundant double unary operations.","savings":"7455→7453 (-2 IDs). unary-enclose.frag: 18→16 (-2 IDs from eliminating double FNegate).","note":"Also handles SNegate, LogicalNot, BitwiseNot double negation patterns but no other shaders triggered these."}}
{"run":389,"commit":"fc1ee2a","metric":7453,"metrics":{},"status":"discard","description":"Attempted dead load elimination and dead OpName removal — both failed. Dead load too aggressive, OpName was false positive. Reverted. Still 7453, 199/199.","timestamp":1777789004515,"segment":69,"confidence":11.5,"asi":{"hypothesis":"Dead load elimination (loaded but never stored function-local vars) and dead OpName removal.","results":"Dead load elimination: too aggressive, breaks 10+ shaders. The loaded value propagates through function calls and other instructions — can't just remove the load without providing a replacement. OpUndef replacement has bound management issues. Dead OpName removal: false positive — all referenced IDs ARE defined. The Python analysis had incomplete ID detection.","next_action_hint":"The remaining 46-ID spirv-opt gap is almost entirely from function inlining, which is very complex. No easy wins left. Session total: 7742 → 7453 (-289 IDs, -3.7%)."}}
{"run":390,"commit":"312221e","metric":7447,"metrics":{},"status":"keep","description":"Redundant store elimination: 7447 bound (-6 from 7453). 199/199 spirv-val. Removes stores to function-local variables that are overwritten in the same block without an intervening load.","timestamp":1777789994091,"segment":69,"confidence":14.75,"asi":{"hypothesis":"Redundant store elimination: remove stores to function-local variables that are overwritten by a subsequent store in the same basic block without an intervening load. Also handles AccessChain-derived pointers.","savings":"7453→7447 (-6 IDs). Eliminated redundant func-local stores across 5+ shaders. Cascading DCE removed values only used in eliminated stores.","note":"Found 11 redundant func-local stores across 5 shaders. Only 6 IDs saved because some stored values were also used by other instructions."}}
{"run":391,"commit":"312221e","metric":7447,"metrics":{},"status":"discard","description":"Attempted copy propagation — false positive. Opcode 81 is OpCompositeExtract, not OpCopyObject. 0 copies exist. Reverted. Still 7447, 199/199.","timestamp":1777791202338,"segment":69,"confidence":14.75,"asi":{"hypothesis":"Copy propagation: eliminate OpCopyObject by replacing all uses of copy result with source.","results":"FALSE POSITIVE: opcode 81 is OpCompositeExtract, not OpCopyObject. There are 0 OpCopyObject instructions in our output. The 186 'copies' found by the Python scan were actually OpCompositeExtract with literal indices.","next_action_hint":"The remaining 44-ID spirv-opt gap is from function inlining. No easy peephole wins left. Need to look at codegen-level optimizations instead."}}
{"run":392,"commit":"cd9a083","metric":7446,"metrics":{},"status":"keep","description":"Empty predecessor block merging: 7446 bound (-1 from 7447). 199/199 spirv-val. Merges empty predecessor blocks (OpLabel+OpBranch only) into their single-successor targets. Fixed structured bitset initialization bug.","timestamp":1777792448554,"segment":69,"confidence":18.23076923076923,"asi":{"hypothesis":"Empty predecessor block merging: merge blocks that contain only OpLabel + OpBranch into their single-successor target. The predecessor's label is kept, the target's label is replaced, and the branch instruction is eliminated.","savings":"7447→7446 (-1 ID). inside-loop-dominated-variable-preservation.frag: empty function entry block merged into successor. Also fixed initFull → initEmpty for structured2 bitset.","note":"Only 1 shader affected. The pattern is rare because most functions have code in their entry block. Fixed a bug where all labels were incorrectly marked as structured, preventing any merges."}}
{"run":393,"commit":"cd9a083","metric":7446,"metrics":{},"status":"discard","description":"Attempted SPIR-V binary CSE — 19 failures from cross-function/dominance violations. Reverted. Still 7446, 199/199.","timestamp":1777793499653,"segment":69,"confidence":26.333333333333332,"asi":{"hypothesis":"Common subexpression elimination (CSE) at the SPIR-V binary level: deduplicate instructions with same opcode+type+operands across the entire binary.","results":"FAILED: 19 spirv-val failures. CSE merges IDs across function boundaries (SPIR-V forbids using IDs outside their defining function) and across basic blocks (dominance violations). The 8 deduplicable instructions found were all cross-function or cross-block.","rollback_reason":"Cross-function and cross-block CSE violates SPIR-V dominance and function scoping rules.","next_action_hint":"All remaining easy wins have been exhausted. The 44-ID spirv-opt gap requires function inlining (complex). Current best: 7446, 199/199. Session total: 7742→7446 (-296 IDs, -3.8%)."}}
{"run":394,"commit":"49d13d8","metric":7420,"metrics":{},"status":"keep","description":"Extend redundant store elimination to Output/Private variables: 7420 bound (-26 from 7446). 199/199 spirv-val. Also added conservative OpAccessChain and OpFunctionCall tracking for DSE safety.","timestamp":1777795715663,"segment":69,"confidence":27.68421052631579,"asi":{"hypothesis":"Extend redundant store elimination to Output (3) and Private (6) storage classes, not just Function (7). Redundant stores to output/private variables are dead if overwritten without intervening loads within the same basic block.","savings":"7446→7420 (-26 IDs). mix.frag gap closed (was +1, now 0). The redundant stores to FragColor (Output) were eliminated, cascading DCE removed dead composite constructs, bool types, and constants.","note":"Also added OpAccessChain and OpFunctionCall tracking as conservative safety improvements for dead store elimination (marks vars as both loaded+stored to prevent incorrect elimination).","spirv-opt_gap":"42 IDs across 10 shaders (was 44 across 12)"}}
