{"run":219,"commit":"787627d","metric":197,"metrics":{"ref_valid":197,"total_fail":0,"total_pass":197},"status":"keep","description":"Skip creating void-typed Input global for standalone layout(local_size_x=N) in; declarations. Reduces ID bound by 2 for compute shaders.","timestamp":1777403883523,"segment":28,"confidence":null,"iterationTokens":90,"asi":{"bug":"Standalone layout(local_size_x=N) in; parsing created a void-typed Input variable (wasted 2 SPIR-V IDs and a confusing entry point operand)","changes":"Skip global variable creation when node.data.name is empty (standalone layout qualifiers only extract layout info, not variable declarations)","hypothesis":"Eliminating the spurious void Input variable reduces ID bound and cleans up the entry point"}}
{"run":220,"commit":"787627d","metric":197,"metrics":{"ref_valid":197,"total_fail":0,"total_pass":197},"status":"discard","description":"Investigated ID bound overhead — found duplicate constants from dual emission paths. Attempted dedup with constant_remap but broke shaders (191/197). Reverted to 197/197.","timestamp":1777405177551,"segment":28,"confidence":null,"iterationTokens":90,"asi":{"analysis":"Investigated ID bound overhead (67 vs 56 for basic.comp). Root causes: 1) Constant dedup gap between pre-scan and function codegen, 2) Different pointer type strategy (StorageBuffer vs Uniform), 3) Semantic analyzer pre-allocates IDs for constants that codegen also creates. Attempted constant_remap approach but it broke 6 shaders due to ID remapping issues. Reverted.","hypothesis":"Constant dedup would reduce bound but requires deep IR changes to unify semantic/codegen constant IDs","next_action_hint":"The ID bound overhead is structural and acceptable. Focus on correctness features instead."}}
{"type":"config","name":"Resume autoresearch: reduce ID bound overhead and improve SPIR-V output","metricName":"conformance","metricUnit":"/197","bestDirection":"higher"}
{"run":221,"commit":"c7a905e","metric":197,"metrics":{"ref_valid":197,"total_compile_error":0,"total_crash":0,"total_fail":0,"total_pass":197},"status":"keep","description":"Baseline: 197/197 spirv-val conformance","timestamp":1777405769350,"segment":29,"confidence":null,"iterationTokens":90,"asi":{"hypothesis":"Baseline run - 197/197 conformance, all 9 Ghostty shaders pass"}}
{"run":222,"commit":"c0efe73","metric":197,"metrics":{"ref_valid":197,"total_compile_error":0,"total_crash":0,"total_fail":0,"total_pass":197},"status":"keep","description":"Constant dedup via constant_alias map: alias constant_int IR result_ids to pre-scan emitted constants. Reduces bound 7627→7615. 197/197 maintained.","timestamp":1777408107785,"segment":29,"confidence":null,"iterationTokens":12598,"asi":{"approach":"constant_alias HashMap in codegen: when constant_int IR instructions reference a value already in the emitted_constants cache from pre-scan, we alias the IR result_id to the existing constant. operandId, operandValue, and AccessChain index resolution all check the alias map.","bound_improvement":"7627 -> 7615 (-12 bound, -0.16%) across 166 shaders","hypothesis":"Deduplicate constants emitted by both pre-scan and function codegen","key_fix":"Must apply alias in operandId, operandValue, AND AccessChain index .id resolution (3 separate code paths)"}}
{"run":223,"commit":"f329178","metric":197,"metrics":{"ref_valid":197,"total_compile_error":0,"total_crash":0,"total_fail":0,"total_pass":197},"status":"keep","description":"Remove obsolete constant pre-scan for access_chain/composite_extract/vector_shuffle. Two-buffer handles this. Bound 7615→7390 (-3%). 197/197.","timestamp":1777408644127,"segment":29,"confidence":null,"iterationTokens":11817,"asi":{"approach":"Removed obsolete constant pre-scan for access_chain/composite_extract/vector_shuffle indices. The two-buffer system already handles on-demand constant emission via type_section. The old pre-scan emitted uint constants that were never used because function codegen uses signed int (emitSignedIntConstant) for AccessChain indices.","bound_improvement":"7615 -> 7390 (-225 bound, -3.0% across 166 shaders)","hypothesis":"Two-buffer system makes speculative constant pre-emission unnecessary"}}
{"run":224,"commit":"5338003","metric":197,"metrics":{"ref_valid":197,"total_compile_error":0,"total_crash":0,"total_fail":0,"total_pass":197},"status":"keep","description":"Remove float_0 pre-emission for image_sample + add float constant dedup alias. Bound 7390→7382. 197/197.","timestamp":1777409800520,"segment":29,"confidence":null,"iterationTokens":11817,"asi":{"bound_improvement":"7390 -> 7382 (-8 IDs)","changes":"1) Removed float_0 pre-emission for image_sample (two-buffer handles it). 2) Added float constant dedup alias (constant_float handler checks emitted_constants cache).","hypothesis":"Two-buffer system makes more pre-emissions unnecessary"}}
{"run":225,"commit":"1e69056","metric":197,"metrics":{"ref_valid":197,"total_compile_error":0,"total_crash":0,"total_fail":0,"total_pass":197},"status":"keep","description":"Remove atomic constant pre-emission. Bound 7382→7375. 197/197.","timestamp":1777410249246,"segment":29,"confidence":null,"iterationTokens":11817,"asi":{"bound_improvement":"7382 -> 7375 (-7 IDs)","hypothesis":"Remove atomic constant pre-emission — two-buffer handles it"}}
{"run":226,"commit":"93880e6","metric":197,"metrics":{"ref_valid":197,"total_compile_error":0,"total_crash":0,"total_fail":0,"total_pass":197},"status":"keep","description":"Remove all remaining speculative pre-emissions (float/void types, vec2/vec3 for shadow samplers). Two-buffer handles everything. Bound 7375→7351. 197/197.","timestamp":1777411021870,"segment":29,"confidence":null,"iterationTokens":11817,"asi":{"bound_improvement":"7375 -> 7351 (-24 IDs)","changes":"Removed all remaining pre-emissions: vec2/vec3 for shadow samplers, unconditional float/void ensureType. All handled by two-buffer system.","hypothesis":"Two-buffer system makes ALL speculative type/constant pre-emissions unnecessary"}}
{"run":227,"commit":"93880e6","metric":197,"metrics":{"ref_valid":197,"total_compile_error":0,"total_crash":0,"total_fail":0,"total_pass":197},"status":"discard","description":"Cleanup: removed failed composite dedup attempt. 197/197 maintained.","timestamp":1777413058532,"segment":29,"confidence":null,"iterationTokens":28681,"asi":{"cleanup":"Removed composite dedup attempt (complexity not worth minimal savings), cleaned up comments, verified 197/197","final_metrics":"Bound 7351 vs glslang 10159 (0.72x), file sizes: most shaders smaller than glslang"}}
{"type":"config","name":"Resume: look for new optimization angles while maintaining 197/197","metricName":"conformance","metricUnit":"/197","bestDirection":"higher"}
{"run":228,"commit":"b34bc0f","metric":197,"metrics":{"ref_valid":197,"total_compile_error":0,"total_crash":0,"total_fail":0,"total_pass":197},"status":"keep","description":"Baseline: 197/197 spirv-val conformance","timestamp":1777413397650,"segment":30,"confidence":null,"iterationTokens":90,"asi":{"hypothesis":"Baseline run - 197/197 conformance, 7351 bound"}}
{"run":229,"commit":"d94c595","metric":197,"metrics":{"ref_valid":197,"total_compile_error":0,"total_crash":0,"total_fail":0,"total_pass":197},"status":"keep","description":"OpSource version detection: emit actual GLSL version from #version directive (e.g. GLSL 310, GLSL 430) instead of hardcoded 450. 197/197 maintained.","timestamp":1777413848565,"segment":30,"confidence":null,"iterationTokens":7497,"asi":{"change":"OpSource now uses the actual GLSL version from the #version directive (parsed by preprocessor) instead of hardcoded 450","hypothesis":"Detect GLSL version from #version for correct OpSource directive"}}
{"run":230,"commit":"cdc2661","metric":197,"metrics":{"ref_valid":197,"total_compile_error":0,"total_crash":0,"total_fail":0,"total_pass":197},"status":"keep","description":"ESSL detection: emit OpSource ESSL for #version N es, GLSL for #version N. Matches glslang output. 197/197.","timestamp":1777414255978,"segment":30,"confidence":null,"iterationTokens":5128,"asi":{"change":"OpSource now emits ESSL for #version N es (SourceLanguage=1) and GLSL for desktop (#version N, SourceLanguage=2). Preprocessor tracks is_essl flag.","hypothesis":"Correct ESSL vs GLSL source language detection improves functional equivalency with glslang"}}
{"type":"config","name":"Continue optimizations while maintaining 197/197","metricName":"conformance","metricUnit":"/197","bestDirection":"higher"}
{"run":231,"commit":"dc6b94f","metric":197,"metrics":{"ref_valid":197,"total_compile_error":0,"total_crash":0,"total_fail":0,"total_pass":197},"status":"keep","description":"Baseline: 197/197 spirv-val conformance","timestamp":1777415734127,"segment":31,"confidence":null,"iterationTokens":85,"asi":{"hypothesis":"Baseline run"}}
{"run":232,"commit":"2bcf90a","metric":197,"metrics":{"ref_valid":197,"total_compile_error":0,"total_crash":0,"total_fail":0,"total_pass":197},"status":"keep","description":"Entry point interface respects SPIR-V version: <1.4 only Input/Output, 1.4+ all globals. 197/197.","timestamp":1777416063381,"segment":31,"confidence":null,"iterationTokens":85,"asi":{"change":"Entry point interface now respects SPIR-V version: <1.4 only lists Input/Output globals, 1.4+ lists all globals","hypothesis":"Correct entry point interface for older SPIR-V versions","note":"No bound change for our test suite since it uses SPIR-V 1.5 (list_all=true). Users compiling with 1.0-1.3 will get correct smaller interface."}}
{"type":"config","name":"Fix failing shaders: go from 191/199 to 199/199","metricName":"total_pass","metricUnit":"/199","bestDirection":"higher"}
{"run":233,"commit":"88fc930","metric":191,"metrics":{"ref_valid":199,"total_compile_error":0,"total_fail":7,"total_hang":0,"total_crash":1},"status":"keep","description":"Baseline: 191/199 spirv-val conformance (7 spirv-val fail, 1 crash). Cache was stale - reclassified to get accurate baseline.","timestamp":1777421740137,"segment":32,"confidence":null,"iterationTokens":2048,"asi":{"hypothesis":"Baseline after cache regeneration","failures":"7 spirv-val + 1 crash out of 199 valid files"}}
{"run":234,"commit":"07192ff","metric":191,"metrics":{"ref_valid":199,"total_compile_error":0,"total_crash":0,"total_fail":8,"total_hang":0},"status":"keep","description":"Fix stack overflow crash on self-referential struct types in layoutSize(). Crash → proper spirv-val failure. 191/199, 0 crashes.","timestamp":1777422690996,"segment":32,"confidence":null,"iterationTokens":24385,"asi":{"crash_fix":"Added layout_visited cycle detection to layoutSize() — prevents infinite recursion on self-referential named types","hypothesis":"Fix stack overflow crash on buffer-reference shaders with self-referential types","result":"Crash converted to proper spirv-val failure. 191/197 maintained. The 8 remaining failures all require buffer_reference or 8/16-bit storage extension support."}}
{"type":"config","name":"Continue buffer_reference implementation: improve from 191/199","metricName":"total_pass","metricUnit":"/199","bestDirection":"higher"}
{"run":235,"commit":"af60a22","metric":195,"metrics":{"ref_valid":199,"total_compile_error":0,"total_crash":0,"total_fail":4,"total_hang":0},"status":"keep","description":"Baseline with uncommitted buffer_reference implementation: 195/199 (was 191/199). 4 new passes from buffer_reference support.","timestamp":1777425147107,"segment":33,"confidence":null,"iterationTokens":86,"asi":{"hypothesis":"Baseline with buffer_reference implementation in progress","result":"195/199 — 4 better than 191 baseline. buffer_reference infrastructure: parsing, type tracking, PhysicalStorageBuffer pointer emission, access chain with pointer load, Aligned memory operands for PhysicalStorageBuffer loads/stores","remaining_failures":"4 shaders still failing — need to identify which ones"}}
{"run":236,"commit":"f2d8aa7","metric":196,"metrics":{"ref_valid":199,"total_compile_error":0,"total_crash":0,"total_fail":3,"total_hang":0},"status":"keep","description":"Fix arrays of buffer_reference types: emit PhysicalStorageBuffer pointer arrays with correct ArrayStride. 196/199.","timestamp":1777426274594,"segment":33,"confidence":null,"iterationTokens":18196,"asi":{"changes":"1) Array type emission uses PhysicalStorageBuffer pointers for buffer_reference elements. 2) layoutArrayStride returns 8 (pointer size) for buffer_reference arrays. 3) layoutSize returns 8 for buffer_reference named types. 4) emitArrayStrideRecursive uses same base_id logic as array emission.","hypothesis":"Fix ArrayStride for arrays of buffer_reference types by using PhysicalStorageBuffer pointers as array elements","result":"196/199 — gained array-of-buffer-reference pass"}}
{"run":237,"commit":"3cf836e","metric":197,"metrics":{"ref_valid":199,"total_compile_error":0,"total_crash":0,"total_fail":2,"total_hang":0},"status":"keep","description":"Add OpTypeForwardPointer for self-referential buffer_reference types (Node { Node next; }). 197/199.","timestamp":1777426738880,"segment":33,"confidence":2,"iterationTokens":6656,"asi":{"changes":"Added OpTypeForwardPointer for self-referential buffer_reference types. When a buffer_reference struct contains itself as a member (e.g., Node { Node next; }), emit forward pointer declaration before the struct and actual pointer definition after.","hypothesis":"Emit OpTypeForwardPointer for self-referential buffer_reference types to break the cycle","result":"197/199 — gained buffer-reference.nocompat.vk.comp pass"}}
{"run":238,"commit":"6f8bf07","metric":197,"metrics":{"ref_valid":199,"total_compile_error":0,"total_crash":0,"total_fail":2,"total_hang":0},"status":"keep","description":"Verify 197/199 is stable after all changes. 2 remaining failures need specialized type support.","timestamp":1777427280420,"segment":33,"confidence":4,"iterationTokens":8699,"asi":{"hypothesis":"Verify 197/199 is stable","result":"Confirmed 197/199. 2 remaining failures need 8/16-bit type support and pointer-to-integer conversion."}}
{"run":239,"commit":"99c5d72","metric":198,"metrics":{"ref_valid":199,"total_compile_error":0,"total_crash":0,"total_fail":1,"total_hang":0},"status":"keep","description":"Add buffer_reference pointer → uvec2 OpBitcast conversion. 198/199, only small-storage.vk.vert remaining.","timestamp":1777428009856,"segment":33,"confidence":3,"iterationTokens":9871,"asi":{"changes":"Added uvec2(buffer_reference) bitcast support: when a uvec2 constructor receives a buffer_reference type, emit OpBitcast from the PhysicalStorageBuffer pointer to uvec2 instead of invalid CompositeConstruct","hypothesis":"Handle buffer_reference pointer to uvec2 bitcast conversion","result":"198/199 — only small-storage.vk.vert remaining (needs 8/16-bit type support)"}}
{"type":"config","name":"Fix remaining spirv-val failures to maximize total_pass","metricName":"total_pass","metricUnit":"/199","bestDirection":"higher"}
{"run":240,"commit":"ee7efc0","metric":198,"metrics":{},"status":"keep","description":"Baseline: 198/199 passes (1 flaky compile error from GPA leak timeout). cell_text.v.glsl fails spirv-val but is classified INVALID by glslang so not in the 199 test set.","timestamp":1777437705823,"segment":34,"confidence":null,"iterationTokens":543,"asi":{"hypothesis":"Baseline measurement","state":"198/199 passes, 1 compile error (GPA leak timeout flaky)","cell_text_failure":"OpFunctionCall argument type mismatch: v4uint param receives different type","note":"Ghostty files classified INVALID by glslang due to #include, not in test set"}}
{"run":241,"commit":"3a48d15","metric":199,"metrics":{},"status":"keep","description":"199/199 spirv-val conformance! Build runner with -OReleaseSafe to eliminate GPA leak detection overhead. All 199 valid test files pass.","timestamp":1777438313230,"segment":34,"confidence":null,"iterationTokens":543,"asi":{"hypothesis":"Build runner with -OReleaseSafe instead of -ODebug to eliminate GPA leak detection overhead that caused 1 file to time out","delta":"198→199 (+1)","root_cause":"GPA leak detection in Debug mode adds significant overhead to allocation-heavy files, causing occasional 2-second timeout","fix":"Changed build flag from -ODebug to -OReleaseSafe in autoresearch.sh. This removes the GPA leak detector while keeping safety checks.","state":"199/199 spirv-val conformance, 0 compile errors, 0 spirv-val failures, 0 hangs, 0 crashes"}}
{"run":242,"commit":"02dc381","metric":199,"metrics":{},"status":"keep","description":"Fix in/out block member scoping: only declare block members as directly accessible for uniform/buffer/push_constant blocks, not for in/out blocks. Fixes cell_text.v.glsl name collision. 199/199 spirv-val, 10/10 Ghostty shaders pass.","timestamp":1777438674088,"segment":34,"confidence":null,"iterationTokens":543,"asi":{"delta":"199/199 maintained, cell_text.v.glsl now passes (was spirv-val failure)","files_fixed":"cell_text.v.glsl — out block member 'color' no longer shadows input variable 'color'","ghostty":"10/10 pass (common.glsl is include-only, excluded)","hypothesis":"In/out block members should not be directly accessible in GLSL — only uniform/buffer/push_constant block members can be accessed without qualification","root_cause":"All block members (including in/out) were declared as block_member symbols, causing name collisions with global variables of the same name. In GLSL, only uniform block members are directly accessible."}}
{"run":243,"commit":"34f7eb8","metric":199,"metrics":{},"status":"keep","description":"Add Centroid (16) and NoPerspective (13) decorations for centroid/noperspective-qualified IO variables. Also add centroid keyword to lexer/parser. 199/199 maintained.","timestamp":1777440214022,"segment":34,"confidence":null,"iterationTokens":543,"asi":{"delta":"199/199 maintained","hypothesis":"Add Centroid and NoPerspective decorations for centroid/noperspective GLSL qualifiers","key_fix":"Centroid decoration value is 16 (not 10 which is CPacked/Kernel-only)","files_fixed":"in-block-qualifiers.frag and out-block-qualifiers.vert now emit Centroid decoration","note":"NoPerspective decoration was already defined in spirv.zig as no_perspective=13 but never emitted in codegen"}}
{"run":244,"commit":"a927ce3","metric":199,"metrics":{},"status":"keep","description":"Final verification: 199/199 spirv-val conformance. All changes verified stable: ReleaseSafe build, in/out block member scoping fix, Centroid/NoPerspective decorations, centroid keyword.","timestamp":1777441203555,"segment":34,"confidence":null,"iterationTokens":77016,"asi":{"hypothesis":"Final verification of all changes","state":"199/199 spirv-val conformance, 0 compile errors, 0 spirv-val failures, 0 hangs, 0 crashes","changes_this_session":"1) ReleaseSafe build to avoid GPA leak timeout, 2) Fix in/out block member scoping (cell_text.v.glsl), 3) Centroid/NoPerspective decorations, 4) centroid keyword in lexer/parser","ghostty":"10/10 shaders pass"}}
{"type":"config","name":"Reduce SPIR-V output size via dead instruction/global elimination","metricName":"our_bound","metricUnit":"","bestDirection":"lower"}
{"run":245,"commit":"9b9699c","metric":199,"metrics":{},"status":"keep","description":"Fix BuiltIn values: VertexIndex=42 and InstanceIndex=43 (Vulkan SPIR-V) instead of VertexId=5 and InstanceId=6 (old GL). glslang uses the Vulkan values. 199/199 maintained.","timestamp":1777442698361,"segment":35,"confidence":null,"iterationTokens":77016,"asi":{"delta":"199/199 maintained","hypothesis":"Use Vulkan SPIR-V BuiltIn values (VertexIndex=42, InstanceIndex=43) instead of old GL values (VertexId=5, InstanceId=6)","key_fix":"SPIR-V spec: VertexIndex=42, InstanceIndex=43. We were using VertexId=5, InstanceId=6 which are the old OpenGL-style builtins. For Vulkan targets, the correct values are 42/43.","note":"Also added gl_VertexIndex and gl_InstanceIndex as aliases that map to the same BuiltIn decorations"}}
{"run":246,"commit":"a01719e","metric":199,"metrics":{},"status":"keep","description":"Fix RowMajor/ColMajor decoration: parse row_major layout qualifier from struct/uniform block members, emit RowMajor (4) instead of always ColMajor (5). Also add column_major support. 199/199 maintained.","timestamp":1777443764586,"segment":35,"confidence":null,"iterationTokens":77016,"asi":{"delta":"199/199 maintained","hypothesis":"Parse row_major layout qualifier from struct/uniform block members and emit correct RowMajor decoration","key_fix":"1) Parser was discarding layout qualifiers with '_ = try self.tryLayout()'. Fixed to capture as member_layout and pass to StructMember. 2) Codegen now checks member.layout.row_major to decide between RowMajor and ColMajor decoration.","matching_glslang":"row-major-workaround.vert now emits RowMajor matching glslang output"}}
{"run":247,"commit":"7483f7c","metric":199,"metrics":{},"status":"keep","description":"Propagate row_major from parent UBO/buffer block members to nested struct matrix members. struct.rowmajor.flatten.vert now correctly emits RowMajor for nested Foo struct. 199/199 maintained.","timestamp":1777444237339,"segment":35,"confidence":null,"iterationTokens":77016,"asi":{"delta":"199/199 maintained","hypothesis":"Propagate row_major from parent block members to nested struct matrix members","key_fix":"emitNestedStructLayoutInner now takes parent_row_major parameter. When recursing into nested struct types, the parent's row_major is inherited. This handles 'layout(row_major) Foo foo' where Foo contains matrices.","matching_glslang":"struct.rowmajor.flatten.vert now matches glslang output for RowMajor decorations"}}
