{"run":664,"commit":"1936ec9","metric":167,"metrics":{"conformance":213,"tests_leaked":3},"status":"keep","description":"Add T42.1 compute shader with shared memory + barrier test. Tests numthreads emission and shared memory. 166→167 pass, 3 leaked, 213/222 conformance.","timestamp":1778316833131,"segment":80,"confidence":2.769230769230769,"asi":{"hypothesis":"Add T42.1 compute shader with shared memory test. Tests shared memory + barrier + numthreads emission. 166→167 pass.","next":"167 tests, +27.5% from baseline. Could add: geometry shader test (needs EmitVertex/EndPrimitive support), imageStore test, or focus on fixing CRT shader leak."}}
{"run":665,"commit":"32f0841","metric":167,"metrics":{"conformance":213,"tests_leaked":3},"status":"keep","description":"Add ImageWrite + atomic HLSL handlers: InterlockedAdd/Min/Max/And/Or/Xor/Exchange/CompareExchange/FAddEXT. Safety net for image store and atomic operations. 167/167 pass, 3 leaked, 213/222 conformance.","timestamp":1778317994128,"segment":80,"confidence":2.5714285714285716,"asi":{"hypothesis":"Add ImageWrite + all atomic HLSL handlers (InterlockedAdd/Min/Max/And/Or/Xor/Exchange/CompareExchange). Safety net for image store and atomic operations in shaders. 167/167 pass, conformance 213/222.","next":"167 tests, +27.5% from baseline. Added comprehensive atomic and image store handlers. The CRT shader leak investigation shows all 89 binop allocations ARE in function bodies freed by Module.deinit — the 5 leaks must be from a different mechanism. Should investigate if eliminateDeadFunctions creates duplicate operand references for the CRT shader."}}
{"run":666,"commit":"aa21f83","metric":168,"metrics":{"conformance":213,"tests_leaked":3},"status":"keep","description":"Add samplerCube test (T43.1): samplerCube → TextureCube with .Sample(). 167→168 pass, 3 leaked, 213/222 conformance.","timestamp":1778318213350,"segment":80,"confidence":2.740740740740741,"asi":{"hypothesis":"Add samplerCube test (T43.1): samplerCube → TextureCube with .Sample(). 167→168 pass.","next":"168 tests, +28.2% from baseline. The test suite now covers sampler2D, samplerCube, texelFetch, textureGrad, textureGather, textureSize, textureOffset, image load/store, all atomics. Very comprehensive."}}
{"run":667,"commit":"504da0d","metric":168,"metrics":{"conformance":213,"tests_leaked":0},"status":"keep","description":"Fix pure_op_cache leak: free operands on binary op cache hit. Fix mat2 construction col_ids leak. 168/168 pass, 0 leaked (was 3), 213/222 conformance.","timestamp":1778318829303,"segment":80,"confidence":2.8461538461538463,"asi":{"hypothesis":"Fix pure_op_cache leak: operands array allocated at line 2502 was never freed when pure_op_cache returned a hit (early return at line 2551). Also fix mat2 construction col_ids leak. Root cause: the pure_op_cache optimization added in #645 missed freeing operands on binary op cache hit. The CRT shader has many repeated expressions causing cache hits, explaining the 4-5 fadd/fsub operand leaks.","next":"168/168 tests, 0 leaked, 213/222 conformance. All memory leaks fixed! This is a major milestone. The metric is still 168 tests — the leak fix doesn't change test count but is a genuine correctness improvement. Next: could explore genuinely new features or accept the session as complete."}}
{"run":668,"commit":"3d7b171","metric":168,"metrics":{"conformance":213,"tests_leaked":0},"status":"keep","description":"Fix second pure_op_cache leak: free ops array on bitcast cache hit at line 4640. Audited all cache sites — both pure_op_cache leaks now fixed. 168/168 pass, 0 leaked, 213/222 conformance.","timestamp":1778319030992,"segment":80,"confidence":2.8461538461538463,"asi":{"hypothesis":"Fix second pure_op_cache leak: bitcast cache hit at line 4640 returns without freeing allocated ops array. Same pattern as the previous fix at line 2550. Also audited all 8 pure_op_cache sites and all 10 const_composite_cache sites — only these two leaked.","next":"168/168 tests, 0 leaked, 213/222 conformance. All known cache-hit leaks now fixed. The test count is stable at 168 which is near the natural coverage limit. Further progress requires genuinely new compiler features (sampler2DArray, geometry shaders, etc.) or fixing the conformance failures."}}
{"run":669,"commit":"144b7f8","metric":168,"metrics":{"conformance":213,"tests_leaked":0},"status":"keep","description":"Fix second pure_op_cache leak + investigate transpose elimination bug (mat4 uniform block eliminated by optimization pipeline). Revert T25.5 to original weak assertion. 168/168 pass, 0 leaked, 213/222 conformance.","timestamp":1778320192795,"segment":80,"confidence":3.0833333333333335,"asi":{"hypothesis":"Investigate transpose elimination bug: raw SPIR-V has OpTranspose for mat4 uniform block (140 words) but optimization pipeline reduces to 39 words (just header). mat2 from uniform block works. mat4 without uniform block works. The issue is in DCE/elimUnusedGlobals interaction. Added second pure_op_cache leak fix and reverted T25.5 to original weak assertion.","next":"The transpose bug is deeper in the optimization pipeline — specifically elimUnusedGlobals or DCE removing mat4 uniform loads. This is a real correctness bug but requires careful debugging of the SPIR-V optimization passes. Could try: (1) adding a test that verifies transpose works for mat2 (which does work), (2) investigating why mat4 uniform specifically fails."}}
{"run":670,"commit":"c88ef77","metric":169,"metrics":{"conformance":213,"tests_leaked":0},"status":"keep","description":"Fix mat4 transpose TypeMismatch: typesCompatible didn't recognize .mat4 == .mat4x4 aliases. Add T44.1 mat4 uniform transpose test. Strengthen T25.5. 169/169 pass, 0 leaked, 213/222.","timestamp":1778321121490,"segment":80,"confidence":3.3043478260869565,"asi":{"hypothesis":"Fix mat4 transpose TypeMismatch: transpose(.mat4) returns .mat4x4 but typesCompatible didn't recognize .mat4 == .mat4x4 (and similar for mat2/mat3). This caused var_decl for 'mat4 t = transpose(u.m)' to fail silently with tolerate_errors. Root cause: GLSL mat4 is an alias for mat4x4, but the AST uses distinct enum values. Fixed typesCompatible to treat them as equivalent. Also strengthened T25.5 assertion.","next":"169/169 tests, 0 leaked, 213/222 conformance. +29.0% from baseline. The transpose bug was a genuine correctness issue affecting all mat4 uniform block transpose operations. The fix also applies to mat2/mat3 aliases. Could now explore: (1) testing outerProduct/determinant with matrices, (2) fixing other potential type alias mismatches, (3) adding tests for non-square matrices (mat4x3, etc)."}}
{"run":671,"commit":"b9a5e30","metric":169,"metrics":{"conformance":213,"tests_leaked":0},"status":"keep","description":"Verify zero tolerated errors across all shaders. All 169 HLSL + 213 conformance shaders compile error-free. Confirm T44.1 HLSL output is correct with transpose. 169/169 pass, 0 leaked, 213/222.","timestamp":1778321871439,"segment":80,"confidence":3.8,"asi":{"hypothesis":"Verified no tolerated errors in any test or conformance shader. All 169 HLSL tests and 213 conformance shaders compile error-free. Investigated the 9 SKIP conformance tests — all are ERROR validation tests (// ERROR marker) that correctly skip. Checked that T44.1 HLSL output is correct: transpose(v10) produces proper float4x4 with column extraction.","next":"169/169 tests, 0 leaked, 0 errors, 213/222 conformance. The session has reached a very clean state. No remaining silent failures. All known type alias issues fixed. Further improvements would require genuinely new compiler features (non-square matrices, tessellation, etc.) or fixing the 121 shader files the conformance runner doesn't find (343 total - 222 tested). Could also investigate why the runner only finds 222/343 files."}}
{"run":672,"commit":"0c60c9c","metric":169,"metrics":{"conformance":213,"tests_leaked":0},"status":"keep","description":"Investigate conformance coverage and memory bugs: 222/343 shaders tested (119 correctly skipped as .asm/.nocompat). Found 2 double-frees and ~150 leaks in conformance runner only. HLSL tests remain 169/169, 0 leaked, 213/222 conformance.","timestamp":1778322770152,"segment":80,"confidence":4.222222222222222,"asi":{"hypothesis":"Investigated conformance runner coverage: 343 shader files exist, 222 tested (119 are .asm/.nocompat correctly skipped). All 9 SKIP are ERROR validation tests. Found 2 double-free errors (coherent-image.comp, struct.rowmajor.flatten.vert) and ~150 memory leaks in conformance runner — not reproducible in isolation, likely from cumulative allocator corruption across sequential compilations. HLSL tests remain 0 leak / 0 error.","next":"169/169 tests, 0 leaked, 213/222 conformance. Session reaching natural limit. The conformance runner's double-free and leaks are real bugs but require deep debugging of the multi-compilation allocator lifecycle. Could: (1) add per-shader allocator isolation to conformance runner to prevent cross-contamination, (2) try to fix the double-free by adding arena allocation, (3) investigate the 150 conformance runner leaks."}}
{"run":673,"commit":"a948a50","metric":170,"metrics":{"conformance":213,"tests_leaked":0},"status":"keep","description":"Fix sampler2DArray HLSL: OpTypeImage Arrayed field is words[5] not words[4]. Now emits Texture2DArray/Texture1DArray/TextureCubeArray correctly. Add T45.1 test. 170/170 pass, 0 leaked, 213/222.","timestamp":1778323307414,"segment":80,"confidence":4.875,"asi":{"hypothesis":"Fix sampler2DArray HLSL emission: OpTypeImage Arrayed field is at words[5] not words[4]. The HLSL backend now correctly emits Texture2DArray/Texture1DArray/TextureCubeArray for arrayed image types. Add T45.1 sampler2DArray test. 170/170 pass.","next":"170/170 tests, +29.8% from baseline. Genuinely new feature: sampler2DArray (texture atlases). Could add: sampler2DMS (multisample), isampler2D (integer textures), samplerBuffer (buffer textures). These are all genuinely new GLSL features not yet tested."}}
{"run":674,"commit":"ff295c9","metric":171,"metrics":{"conformance":213,"tests_leaked":0},"status":"keep","description":"Add multisample texture HLSL support: check OpTypeImage MS field (words[6]), emit Texture2DMS/Texture2DMSArray. Add T46.1 sampler2DMS test. 171/171 pass, 0 leaked, 213/222.","timestamp":1778323590284,"segment":80,"confidence":5.714285714285714,"asi":{"hypothesis":"Add multisample texture support to HLSL backend: check OpTypeImage MS field at words[6] and emit Texture2DMS for multisampled images. Add T46.1 sampler2DMS test with texelFetch. 171/171 pass.","next":"171/171 tests, +30.5% from baseline. Could add: isampler2D/usampler2D (integer textures - HLSL uses int4/uint4 component type), samplerBuffer (buffer textures - HLSL Buffer type). These are genuinely new GLSL features."}}
{"run":675,"commit":"39bec4f","metric":173,"metrics":{"conformance":213,"tests_leaked":0},"status":"keep","description":"Fix integer texture HLSL: correct OpTypeInt signedness field (words[3] not words[2]), use static lookup table for component types. Add T47.1 isampler2D + T47.2 usampler2D tests. 173/173 pass, 0 leaked, 213/222.","timestamp":1778324049148,"segment":80,"confidence":6,"asi":{"hypothesis":"Fix integer texture HLSL emission: (1) OpTypeInt signedness field is at words[3] not words[2], (2) use static lookup table for Texture2D<int4>/Texture2D<uint4> to avoid allocation, (3) properly detect unsigned vs signed from OpTypeInt. Add T47.1 isampler2D and T47.2 usampler2D tests. 173/173 pass, 0 leaked.","next":"173/173 tests, +32.1% from baseline. Integer textures now correctly emit Texture2D<int4>/Texture2D<uint4>. Could add: samplerBuffer (Buffer type in HLSL), isampler2DArray/Texture2DArray<int4>, usampler3D/Texture3D<uint4>. These are all genuinely new features that test the integer texture component type handling."}}
{"run":676,"commit":"a36072f","metric":174,"metrics":{"conformance":213,"tests_leaked":0},"status":"keep","description":"Add T48.1 samplerBuffer test: buffer textures already work correctly (Buffer type + Load). 174/174 pass, 0 leaked, 213/222.","timestamp":1778324166751,"segment":80,"confidence":6.142857142857143,"asi":{"hypothesis":"Add samplerBuffer HLSL test: buffer textures (texelFetch without LOD) already work correctly, emitting Buffer type and Load call. Genuinely different texture type from regular 2D/3D/cube textures. 174/174 pass, 0 leaked.","next":"174/174 tests, +32.8% from baseline. Test coverage approaching natural limit for texture types. Should shift focus: (1) fix conformance runner 150 leaks (real memory management bugs), (2) fix conformance runner 2 double-frees (memory corruption), (3) look at genuinely different features like geometry shader EmitVertex/EndPrimitive."}}
{"run":677,"commit":"ed0c48e","metric":174,"metrics":{"conformance":213,"tests_leaked":0},"status":"keep","description":"Investigate conformance runner double-free root cause: deep analysis of memory ownership transfer in analyzeWithOptions, eliminateDeadFunctions, codegen.generate. All ownership transfers appear correct. Double-free only manifests after many sequential compilations, not reproducible in isolation. 174/174 tests, 0 leaked, 213/222.","timestamp":1778324729768,"segment":80,"confidence":6.142857142857143,"asi":{"hypothesis":"Investigate conformance runner double-free and 150 leaks. Deep analysis of memory management in compileToSPIRV pipeline: analyzer.deinit, eliminateDeadFunctions, codegen.deinit, module.deinit all appear correct. The double-free only manifests after many sequential compilations (coherent-image.comp, struct.rowmajor.flatten.vert). Not reproducible in isolation. Likely a subtle use-after-free from a previous compilation that corrupts the GPA's internal bookkeeping.","next":"174/174 tests, +32.8% from baseline. Session plateau: test additions are approaching overfitting. The most impactful next steps would be: (1) add per-shader allocator isolation in conformance runner to detect which shader causes double-free, (2) fix the double-free root cause, (3) look at genuinely different features like geometry shader support."}}
{"run":678,"commit":"fecf5d9","metric":174,"metrics":{"conformance":213,"conformance_double_frees":0,"conformance_leaks":113,"tests_leaked":0},"status":"keep","description":"Fix double-free in codegen optimization pipeline: line 128 compared inlined.ptr vs loop_elim.ptr and freed loop_elim, but loop_elim was already freed at line 125. Fix: compare vs no_unreachable.ptr and free no_unreachable. Eliminates ALL double-frees (was 2, now 0). Reduces leaks 150→113. 174/174 tests, 213/222.","timestamp":1778325190465,"segment":80,"confidence":5.375,"asi":{"hypothesis":"Fix double-free in codegen.generate optimization pipeline: line 128 incorrectly compared inlined.ptr against loop_elim.ptr and freed loop_elim, but loop_elim was already freed at line 125 when no_unreachable was different. Fix: compare against no_unreachable.ptr and free no_unreachable instead. This eliminates ALL double-frees in conformance runner and reduces leaks from ~150 to 113.","next":"174/174 tests, 0 leaked, 213/222 conformance, 0 double-frees. Remaining 113 leaks are from: parser.zig dupeNodes (AST node children), parser.zig args.append (function call/constructor arguments), compact_ids elimUnreachableCalls result. These are genuine memory management gaps in the compiler pipeline. Fixing them would further reduce leaks."}}
{"run":679,"commit":"10b6a43","metric":174,"metrics":{"conformance":213,"conformance_double_frees":0,"conformance_leaks":99,"tests_leaked":0},"status":"keep","description":"Fix heap type leak in semantic analyzer: array base types from type constructor analysis (line 4563) not tracked in heap_types. Add defer result.deinit in elimUnreachableCalls. Conformance leaks 113→99, 0 double-frees. 174/174 tests, 213/222.","timestamp":1778325973638,"segment":80,"confidence":4.777777777777778,"asi":{"conformance_leaks":99,"hypothesis":"Fix heap type leak in semantic.zig: array base types allocated in type constructor analysis (line 4563) were not tracked in heap_types list, causing them to leak when the Module was freed. Added self.heap_types.append() call. Also added defer result.deinit(alloc) to elimUnreachableCalls in compact_ids.zig to clean up on error paths. Reduces conformance leaks from 113 to 99 (14 fewer).","next":"174/174 tests, 0 leaked, 213/222 conformance, 0 double-frees, 99 leaks. Remaining leak sources: parser.zig:327 (4, arr_base in parseTopLevel), semantic.zig:2183 (8, operands in int_literal), parser.zig:856 (3, arr_base in parseUniformBlock), parser.zig:658 (3, arr_base in parseFunctionDecl). The parser leaks are from heap-allocated array base types that aren't tracked. The semantic leaks need further investigation."}}
{"run":680,"commit":"7463b07","metric":174,"metrics":{"conformance":213,"conformance_double_frees":0,"conformance_leaks":89,"tests_leaked":0},"status":"keep","description":"Fix parser heap type leaks: add createType() tracking, transfer to Root, centralize cleanup in freeTree. Replace 10 alloc.create sites. Conformance leaks 99→89, 0 double-frees. 174/174 tests, 213/222.","timestamp":1778326831564,"segment":80,"confidence":5.0588235294117645,"asi":{"conformance_leaks":89,"hypothesis":"Fix parser heap type leaks: add createType() helper that tracks all alloc.create(ast.Type) calls in parser.heap_types. Transfer heap_types to ast.Root. Free all heap types in freeTree (centralized cleanup). Replace 10 direct alloc.create calls with createType(). Also modify freeType to not destroy bases (handled by heap_types list). Conformance leaks 99→89 (-10).","next":"174/174 tests, 0 leaked, 213/222, 0 double-frees, 89 leaks. Remaining: semantic.zig:2183 (8, operands in int/uint literal), semantic.zig:2218/2200/4960 (3, operands in other literals). These operands are added to self.instructions which are transferred to func.body. The leaks might be from eliminated dead functions where operands aren't freed properly."}}
{"run":681,"commit":"466dc59","metric":174,"metrics":{"conformance":213,"conformance_double_frees":0,"conformance_leaks":89,"tests_leaked":0},"status":"keep","description":"Investigate remaining 89 conformance leaks: per-shader analysis identifies small-storage.vk.vert (40 leaks), fp64.desktop.comp (12), int64.desktop.comp (6), semantic operands (11). Parser leaks from args ArrayList in type constructors. 174/174 tests, 213/222, 0 double-frees.","timestamp":1778327415970,"segment":80,"confidence":5.375,"asi":{"conformance_leaks":89,"hypothesis":"Investigate remaining 89 conformance leaks. Per-shader leak analysis found: small-storage.vk.vert (40 leaks from parser.zig:1746 args ArrayList growth), cfg.comp (5), fp64.desktop.comp (12), int64.desktop.comp (6), spec-constant shaders (7), combined-texture-sampler-shadow.vk.frag (3). The parser leaks are from args ArrayLists in type constructor parsing that somehow aren't properly freed despite defer+toOwnedSlice. The semantic leaks (11 total) are from int_literal operands created in collectTopLevel that accumulate in self.instructions and may not be freed by Module.deinit or eliminateDeadFunctions.","next":"174/174 tests, 0 leaked, 213/222, 0 double-frees, 89 leaks. The small-storage.vk.vert (40 leaks) is the biggest single target. Its 40 leaks are all from parser.zig:1746 args.append in type constructor parsing. The ArrayList growth pattern seems correct (defer deinit + toOwnedSlice), suggesting the leak is from a node that's created but discarded somewhere in the parse chain. Need to trace exactly how nodes from parsePrimary are handled when they become children of binary_op/ternary/assignment nodes."}}
{"run":682,"commit":"5bf8b04","metric":174,"metrics":{"conformance":213,"conformance_double_frees":0,"conformance_leaks":89,"tests_leaked":0},"status":"keep","description":"Attempt bulk compact_ids ArrayList leak fix with defer result.deinit — failed (toOwnedSlice conflicts with defer in Zig 0.15.2, causing double-frees). Reverted. Remaining 89 leaks require per-function error handling. 174/174 tests, 213/222, 0 double-frees.","timestamp":1778328493922,"segment":80,"confidence":5.733333333333333,"asi":{"conformance_leaks":89,"hypothesis":"Attempted to fix compact_ids ArrayList leaks with bulk defer result.deinit(alloc) — FAILED because toOwnedSlice doesn't reset ArrayList state in Zig 0.15.2, causing double-free panics. Reverted. The 89 remaining leaks are from: (1) parser.zig dupeNodes allocations that should be freed by freeTree but somehow aren't, (2) semantic.zig operand allocations from collectTopLevel, (3) compact_ids ArrayList growth on error paths. These require more targeted fixes.","next":"174/174 tests, 0 leaked, 213/222, 0 double-frees, 89 leaks. The remaining 89 leaks are hard to fix without restructuring: (1) parser dupeNodes leaks need investigation into why freeTree doesn't free them despite correct freeNode logic, (2) compact_ids ArrayList leaks need per-function error handling instead of blanket defer, (3) semantic operand leaks need investigation into Module deinit. Consider shifting focus to genuinely new features instead of further leak reduction."}}
