{"run":188,"commit":"6b38230","metric":20563,"metrics":{},"status":"keep","description":"Conditional constant/atomic pre-emit: 197/197 maintained, same aggregate bound (20563) since most shaders use these types.\"","timestamp":1777350389067,"segment":21,"confidence":12.11723163841808,"iterationTokens":3197,"asi":{"hypothesis":"Conditional constant emission for atomics/float/uint","our_bound":20563,"our_vars":879,"ref_bound":10159}}
{"run":189,"commit":"19bfe08","metric":19810,"metrics":{},"status":"keep","description":"Conditional vec type pre-emit + fix atomic tag names: 197/197, bound 20563→19810 (-3.7%). Pre-emit vec2/vec3/vec4 only when texture/image ops are present.\"","timestamp":1777351737416,"segment":21,"confidence":12.393094289508632,"iterationTokens":11681,"asi":{"both_valid":166,"has_atomics_fix":true,"hypothesis":"Conditional vec type pre-emit based on texture op usage","our_bound":19810,"our_vars":879,"ref_bound":10159,"ref_vars":1010}}
{"run":190,"commit":"a5c9efd","metric":19145,"metrics":{},"status":"keep","description":"Precise capability + conditional type/constant pre-emit: 197/197, bound 19810→19145 (-3.4%). Only emit capabilities/types/constants actually needed.\"","timestamp":1777354618165,"segment":21,"confidence":9.21807284462886,"iterationTokens":11681,"asi":{"both_valid":166,"hypothesis":"Precise capability emission + conditional type/constant pre-emit","our_bound":19145,"our_vars":879,"ref_bound":10159,"ref_vars":1010,"changes":["ImageQuery only for image_query_* instructions","Image1D only for sampler1d globals","SampledBuffer/ImageBuffer only for sampler_buffer globals","ImageMSArray only for ms_array sampler/image types","StorageImageMultisample only for image2d_ms/image2d_ms_array globals","Removed unconditional bool/vec2/vec3/vec4 pre-emit","Conditional vec2/vec3 only for dref shadow samples","Conditional float_0 only for image_sample instructions","Removed unconditional float_0/float_1/uint constants"]}}
{"run":191,"commit":"4f6c0e9","metric":10015,"metrics":{},"status":"keep","description":"Remove IR ID waste from function builtins: 197/197, bound 19145→10015 (-47.7%). Essentially at glslang parity (10015 vs 10159). front-facing=22 exact match!\"","timestamp":1777355634418,"segment":21,"confidence":13.50776836158192,"iterationTokens":12574,"asi":{"both_valid":166,"hypothesis":"Remove IR ID allocation from function builtins — they don't need SPIR-V IDs","our_bound":10015,"our_vars":879,"ref_bound":10159,"ref_vars":1010,"front-facing_bound":"22=22 exact parity","breakthrough":"Function builtins (50+) each wasted an allocId() despite codegen never using them"}}
{"run":192,"commit":"09ee5e2","metric":10044,"metrics":{},"status":"keep","description":"Fix image query ops for all sampler types: 197/197, textureSize returns correct type, cube sampler OpImage extraction. Image queries 1→6 (glslang=28).\"","timestamp":1777359867230,"segment":21,"confidence":13.498235709244884,"iterationTokens":34119,"asi":{"both_valid":166,"hypothesis":"Fix textureSize/textureQueryLevels/textureSamples for all sampler types","our_bound":10044,"our_vars":884,"ref_bound":10159,"ref_vars":1010,"changes":["textureSize: correct size_ty for all sampler types, return size_ty instead of hardcoded ivec2","textureQueryLevels: extract image from all sampler types via isCombinedSampler()","textureSamples/imageSamples: extract image from all sampler types","Added isCombinedSampler() to ast.zig to distinguish sampler vs image types","Added sampled_image_cube_inner_id for cube sampler OpImage extraction","textureSize extract_image check covers shadow sampler types"],"image_query_ops":"1→6 (was 1, now 6, glslang=28)"}}
{"type":"config","name":"SPIR-V output size optimization vs glslangValidator","metricName":"our_bound","metricUnit":"","bestDirection":"lower"}
{"run":193,"commit":"34718b4","metric":9755,"metrics":{},"status":"keep","description":"Add constant dedup in semantic analysis: our_bound 10042→9755 (-2.9%). 197/197 conformance maintained. Deduplicates int/uint/float/bool literals via const_cache HashMap.","timestamp":1777367628580,"segment":22,"confidence":null,"iterationTokens":34766,"asi":{"hypothesis":"Deduplicate constants in semantic analysis to reduce SPIR-V bound","delta":"our_bound 10042→9755 (-287, -2.9%)","both_valid":166,"ref_bound":10159,"our_vars":884,"ref_vars":1010,"conformance":"197/197","technique":"Added const_cache HashMap to Analyzer. int_literal/uint_literal/float_literal/bool_literal handlers check cache first. getConstInt/getConstFloat helper methods for use in splat code."}}
{"run":194,"commit":"1a5783a","metric":9752,"metrics":{},"status":"keep","description":"Extend constant dedup to splat and increment constants. 9755→9752 (-3 IDs). 197/197 maintained.","timestamp":1777368238420,"segment":22,"confidence":null,"iterationTokens":34766,"asi":{"delta":"our_bound 9755→9752 (-3)","hypothesis":"Extend constant dedup to splat zero/one and increment/decrement constant 1"}}
{"run":195,"commit":"64b7b00","metric":9325,"metrics":{},"status":"keep","description":"Only pre-emit pointer types for storage classes that have globals: our_bound 9752→9325 (-4.4%). 197/197 maintained.","timestamp":1777368866247,"segment":22,"confidence":143.33333333333334,"iterationTokens":34766,"asi":{"delta":"our_bound 9752→9325 (-427, -4.4%)","hypothesis":"Only pre-emit pointer types for storage classes that actually have globals, instead of all 6 classes for every access_chain","ref_bound":10159,"our_vars":884,"ref_vars":1010,"conformance":"197/197","root_cause":"Pre-scan emitted 6 pointer types (function, uniform, output, input, private, push_constant) for EVERY access_chain instruction. Most shaders only use 1-2 of these. Now only emits for storage classes that have corresponding globals."}}
{"run":196,"commit":"9a89b47","metric":8905,"metrics":{},"status":"keep","description":"SSA variable optimization: skip OpVariable/OpStore for initialized scalar/vector/matrix locals. our_bound 9325→8905 (-4.5%), our_vars 884→642 (-27%). 197/197 maintained.","timestamp":1777370402106,"segment":22,"confidence":3.953488372093023,"iterationTokens":34766,"asi":{"conformance":"197/197","delta":"our_bound 9325→8905 (-420, -4.5%), our_vars 884→642 (-242, -27%)","hypothesis ":"SSA variable optimization: skip OpVariable/OpStore for initialized scalar/vector/matrix locals","our_vars":642,"ref_vars":1010,"ref_bound":10159,"technique":"When var_decl has initializer and type is simple (scalar/vector/matrix), don't emit OpVariable+OpStore. Instead record init_value in Symbol. On read, return init_value directly. On write (analyzeLValue), materialize OpVariable retroactively with init_value stored. Only SSA-ify simple types; struct/array types always get OpVariable for access chain support."}}
{"run":197,"commit":"2c8a2e7","metric":8671,"metrics":{},"status":"keep","description":"Don't allocate separate IR ID for SSA vars — reuse init_value ID. our_bound 8905→8671 (-2.6%). 197/197 maintained.","timestamp":1777371398249,"segment":22,"confidence":2.53864168618267,"iterationTokens":34766,"asi":{"conformance":"197/197","delta":"our_bound 8905→8671 (-234, -2.6%)","hypothesis":"For SSA vars, reuse init_id as ir_id instead of allocating a separate unused ID. On materialization, allocate fresh ID for OpVariable.","ref_bound":10159,"our_vars":642,"ref_vars":1010}}
{"run":198,"commit":"2469ab7","metric":8619,"metrics":{},"status":"keep","description":"Only emit referenced named types. our_bound 8671→8619 (-0.6%). 197/197 maintained.","timestamp":1777372743472,"segment":22,"confidence":2.4170212765957446,"iterationTokens":34766,"asi":{"conformance":"197/197","delta":"our_bound 8671→8619 (-52, -0.6%)","hypothesis":"Only emit named types that are actually referenced by globals or instructions, not all types in module.types","ref_bound":10159,"our_vars":642,"ref_vars":1010}}
{"run":199,"commit":"21df20a","metric":8367,"metrics":{},"status":"keep","description":"Dedup storage classes for access_chain pre-scan. our_bound 8619→8367 (-2.9%). 197/197 maintained.","timestamp":1777373858793,"segment":22,"confidence":3.3047619047619046,"iterationTokens":34766,"asi":{"conformance":"197/197","delta":"our_bound 8619→8367 (-252, -2.9%)","hypothesis":"Dedup storage classes for access_chain pre-scan so we only call ensurePointerType once per unique storage class instead of once per global","ref_bound":10159,"our_vars":642,"ref_vars":1010}}
{"run":200,"commit":"6c0fe6f","metric":7863,"metrics":{},"status":"keep","description":"Two-buffer codegen: emit types on-demand during functions. our_bound 8367→7863 (-6.0%). 197/197 maintained.","timestamp":1777376525632,"segment":22,"confidence":3.9498956158663883,"iterationTokens":34766,"asi":{"conformance":"197/197","delta":"our_bound 8367→7863 (-504, -6.0%)","hypothesis":"Two-buffer codegen: emit types on-demand during function codegen via separate type_section buffer, splice before functions in final assembly","ref_bound":10159,"our_vars":642,"ref_vars":1010,"technique":"1) Added type_section ArrayList and in_functions flag. 2) Changed ensureType/ensurePointerType/emitIntConstant/emitFloatConstant to use emitTypeWord which routes to type_section during function codegen. 3) Removed access_chain pre-scan pointer type emission. 4) After function codegen, splice type_section before function code. 5) This eliminates all unused pointer types that were pre-emitted for ALL storage classes."}}
{"run":201,"commit":"ed731ca","metric":7842,"metrics":{},"status":"keep","description":"Remove local_variable pointer type pre-scan. our_bound 7863→7842. 197/197 maintained.","timestamp":1777377006254,"segment":22,"confidence":2.9250764525993884,"iterationTokens":34766,"asi":{"conformance":"197/197","delta":"our_bound 7863→7842 (-21)","hypothesis":"Remove local_variable pre-scan since two-buffer handles it"}}
{"run":202,"commit":"5805a46","metric":7685,"metrics":{},"status":"keep","description":"Remove struct member pointer type pre-scan. our_bound 7842→7685 (-2.0%). 197/197 maintained.","timestamp":1777377496272,"segment":22,"confidence":2.831737346101231,"iterationTokens":34766,"asi":{"conformance":"197/197","delta":"our_bound 7842→7685 (-157, -2.0%)","hypothesis":"Remove struct member pointer type pre-scan since two-buffer handles on-demand emission"}}
{"run":203,"commit":"3ee5141","metric":7544,"metrics":{},"status":"keep","description":"Remove eager ensureType for all instructions in pre-scan. our_bound 7685→7544 (-1.8%). 197/197 maintained.","timestamp":1777378149815,"segment":22,"confidence":2.9246031746031744,"iterationTokens":34766,"asi":{"conformance":"197/197","delta":"our_bound 7685→7544 (-141, -1.8%)","hypothesis":"Remove eager ensureType for all instructions in pre-scan since two-buffer handles on-demand"}}
{"run":204,"commit":"75ebe53","metric":7535,"metrics":{},"status":"keep","description":"Remove function type pre-scan. our_bound 7544→7535 (-9). 197/197 maintained.","timestamp":1777378635192,"segment":22,"confidence":3.0431802604523646,"iterationTokens":34766,"asi":{"conformance":"197/197","delta":"our_bound 7544→7535 (-9)","hypothesis":"Remove function return/param type pre-scan"}}
{"run":205,"commit":"a76c513","metric":7527,"metrics":{},"status":"keep","description":"Move constant emission from pre-scan to on-demand via two-buffer. our_bound 7535→7527. 197/197 maintained.","timestamp":1777379857333,"segment":22,"confidence":3.2668621700879767,"iterationTokens":34766,"asi":{"conformance":"197/197","delta":"our_bound 7535→7527 (-8)","hypothesis":"Move constant emission to on-demand via two-buffer, remove pre-scan"}}
{"run":206,"commit":"7e12e20","metric":7520,"metrics":{},"status":"keep","description":"Add dead code elimination: skip statements after return. our_bound 7527→7520. 197/197 maintained.","timestamp":1777381519923,"segment":22,"confidence":3.883579496090356,"iterationTokens":34766,"asi":{"conformance":"197/197","delta":"our_bound 7527→7520 (-7)","hypothesis":"Add dead code elimination: has_returned flag skips statements after return in analyzeStatement"}}
{"type":"config","name":"Optimize SPIR-V bound output size","metricName":"our_bound","metricUnit":"","bestDirection":"lower"}
{"run":207,"commit":"8e072f1","metric":7448,"metrics":{},"status":"keep","description":"Use native OpOuterProduct instead of manual decomposition. our_bound 7520→7448 (-1.0%). 197/197.","timestamp":1777382816776,"segment":23,"confidence":null,"iterationTokens":34766,"asi":{"conformance":"197/197","delta":"our_bound 7520→7448 (-72, -1.0%)","hypothesis":"Replace manual outerProduct decomposition (Extract+VTS+Construct) with native OpOuterProduct","outer_product_comp":"161→107, ref=105"}}
{"run":208,"commit":"efde238","metric":7446,"metrics":{},"status":"keep","description":"Fix builtin var duplication: declare in global scope. our_bound 7448→7446. 197/197.","timestamp":1777385347975,"segment":23,"confidence":null,"iterationTokens":34766,"asi":{"conformance":"197/197","delta":"our_bound 7448→7446 (-2)","hypothesis":"Fix ensureBuiltinVar to declare in global scope (index 0) instead of current function scope, preventing duplicate global emission","bug":"Builtins referenced from multiple functions created duplicate globals with separate IDs"}}
{"type":"config","name":"Optimize SPIR-V bound — session 4","metricName":"our_bound","metricUnit":"","bestDirection":"lower"}
{"type":"config","name":"Achieve functional equivalency with glslang","metricName":"equiv_gaps","metricUnit":"gaps","bestDirection":"lower"}
{"run":209,"commit":"4f739ca","metric":1,"metrics":{},"status":"keep","description":"Fix function overload, bool conversion, int vector conversion. Ghostty 1/10→9/10. 197/197 maintained.","timestamp":1777391358065,"segment":25,"confidence":null,"iterationTokens":34766,"asi":{"conformance":"197/197","ghostty_pass":"9/10","bugs_fixed":["function overload return_type","bool_to_float/int/uint conversion","int_vector to float_vector conversion","pack/unpack builtin prefix matching"],"hypothesis":"Fix overload resolution + type conversion bugs for Ghostty shaders"}}
{"type":"config","name":"UBO/SSBO layout decorations (Block, Offset, ColMajor, MatrixStride, ArrayStride)","metricName":"conformance","metricUnit":"/197","bestDirection":"higher"}
{"run":210,"commit":"0d8a2ff","metric":197,"metrics":{"total_pass":197,"total_fail":0,"ref_valid":197},"status":"keep","description":"UBO/SSBO layout decorations: Block + Offset + ColMajor + MatrixStride + ArrayStride for all nesting levels. StorageBuffer class for SSBOs. Recursive nested struct layout. std140 size computation for named types. Dedup guards for struct layout and array stride.","timestamp":1777396526813,"segment":26,"confidence":null,"iterationTokens":19991,"asi":{"hypothesis":"Adding proper std140 layout decorations for UBO/SSBO structs will enable functional equivalency with glslang without breaking spirv-val conformance","changes":"1) Added storage_buffer storage class (ir.zig) for SSBOs, 2) semantic.zig uses .storage_buffer for buffer blocks, 3) decoration_section buffer in codegen for deferred decoration emission, 4) emitNestedStructLayout recursive helper for Offset/ColMajor/MatrixStride/ArrayStride at all nesting levels, 5) emitArrayStrideRecursive for nested arrays, 6) std140Size for named types (recursive), 7) Dedup guards via emitted_struct_layout and emitted_array_stride sets","key_insight":"Decorations must be in annotation section (before types) but type IDs are only available after types are emitted. Solution: accumulate in decoration_section buffer, splice between emitDecorations and emitTypesAndConstants output"}}
{"run":211,"commit":"847c25a","metric":197,"metrics":{"total_pass":197,"total_fail":0,"ref_valid":197},"status":"keep","description":"Add default DescriptorSet=0 decoration for UBO/SSBO globals that have binding but no explicit set","timestamp":1777397360767,"segment":26,"confidence":null,"iterationTokens":19991,"asi":{"changes":"Modified emitDecorations to emit DescriptorSet 0 for uniform/storage_buffer globals with binding","hypothesis":"Adding default DescriptorSet=0 for UBO/SSBO globals with binding but no explicit set will match glslang output"}}
{"run":212,"commit":"64e1bb8","metric":197,"metrics":{"ref_valid":197,"total_fail":0,"total_pass":197},"status":"keep","description":"Parse standalone layout(local_size_x=N) in; declarations for compute shader LocalSize execution mode","timestamp":1777397764851,"segment":26,"confidence":null,"iterationTokens":11583,"asi":{"hypothesis":"Standalone layout qualifiers like 'layout(local_size_x = 1) in;' need special parser handling since they have no variable name","changes":"Added standalone layout qualifier handling in parseTopLevel: when qualifier is in/out and next token is semicolon, emit an in_decl/out_decl node with empty name and layout data"}}
{"run":213,"commit":"c5ae303","metric":197,"metrics":{"ref_valid":197,"total_fail":0,"total_pass":197},"status":"keep","description":"Add OpSource GLSL 450 directive after OpEntryPoint, before debug section","timestamp":1777398308093,"segment":26,"confidence":null,"iterationTokens":11583,"asi":{"hypothesis":"Adding OpSource GLSL 450 and fixing LocalSize for compute shaders improves functional equivalency"}}
{"run":214,"commit":"ef085c4","metric":197,"metrics":{"ref_valid":197,"total_fail":0,"total_pass":197},"status":"keep","description":"Add OpName/OpMemberName for struct types: struct types now have proper names (e.g. UBO instead of _struct_15) and member names","timestamp":1777398929844,"segment":26,"confidence":null,"iterationTokens":15491,"asi":{"hypothesis":"Emitting OpName/OpMemberName for struct types improves readability and matches glslang output","changes":"1) Added name_section buffer for struct type names emitted during ensureType, 2) Spliced after emitNames and before emitDecorations in debug section, 3) Added emitNameSectionName/emitMemberName helpers, 4) encodeStringLiteral helper for buffered string emission"}}
{"run":215,"commit":"5c89122","metric":197,"metrics":{"ref_valid":197,"total_fail":0,"total_pass":197},"status":"keep","description":"Use signed int (OpTypeInt 32 1) for AccessChain struct member indices instead of unsigned, matching glslang output","timestamp":1777399860733,"segment":26,"confidence":null,"iterationTokens":16806,"asi":{"changes":"Added emitSignedIntConstant function and changed AccessChain indices to use signed int instead of unsigned, matching glslang output","hypothesis":"Using signed int for struct member indices in AccessChain matches glslang and improves driver compatibility"}}
{"type":"config","name":"Fix std430 layout: correct ArrayStride and offset computation for std430 buffers","metricName":"conformance","metricUnit":"/197","bestDirection":"higher"}
{"run":216,"commit":"890eaeb","metric":197,"metrics":{"ref_valid":197,"total_fail":0,"total_pass":197},"status":"keep","description":"Fix std430 layout: use correct alignment and stride rules for std430 buffers (ArrayStride 4 for float arrays, not 16). Pass is_std430 from global layout through offset computation.","timestamp":1777401398129,"segment":27,"confidence":null,"iterationTokens":90,"asi":{"bug":"std430 buffers used std140 layout rules, causing ArrayStride=16 for float arrays instead of correct ArrayStride=4. This could cause incorrect GPU memory access for std430 SSBOs","changes":"1) Replaced std140Alignment/std140Size/std140ArrayStride with unified layoutAlignment/layoutSize/layoutArrayStride that take is_std430 parameter, 2) std430 array alignment = element alignment (not 16), 3) std430 array stride = rounded element size (not rounded to 16), 4) Pass is_std430 from global.layout.std430 through emitNestedStructLayout and emitArrayStrideRecursive","hypothesis":"std430 buffers need different alignment/stride rules than std140 — this was a correctness bug, not just cosmetic"}}
{"run":217,"commit":"f8ccb74","metric":197,"metrics":{"ref_valid":197,"total_fail":0,"total_pass":197},"status":"keep","description":"Add NonWritable/NonReadable decorations for readonly/writeonly SSBOs. Track is_readonly/is_writeonly in Qualifier, emit correct decorations (24/25).","timestamp":1777402424868,"segment":27,"confidence":null,"iterationTokens":90,"asi":{"changes":"1) Added is_readonly/is_writeonly to ast.Qualifier packed struct, 2) Parser now tracks readonly/writeonly keywords in qualifier, 3) Added non_writable=24 and non_readable=25 to spirv.Decoration enum, 4) emitDecorations emits NonWritable for readonly SSBOs and NonReadable for writeonly SSBOs","hypothesis":"Emitting NonWritable/NonReadable decorations for readonly/writeonly buffer variables matches glslang output and provides optimization hints to GPU drivers"}}
{"run":218,"commit":"d016e2a","metric":197,"metrics":{"ref_valid":197,"total_fail":0,"total_pass":197},"status":"keep","description":"Add Flat decoration (14) for flat-qualified IO variables. Track is_flat in Qualifier.","timestamp":1777402823564,"segment":27,"confidence":null,"iterationTokens":90,"asi":{"changes":"1) Added is_flat to ast.Qualifier, 2) Parser tracks flat keyword, 3) Added flat=14 to spirv.Decoration, 4) emitDecorations emits Flat decoration for flat-qualified IO variables","hypothesis":"Emitting Flat decoration for flat-qualified interpolants matches glslang output"}}
{"type":"config","name":"Eliminate void input variable from standalone layout(local_size_x) in; parsing","metricName":"conformance","metricUnit":"/197","bestDirection":"higher"}
