{"run":417,"commit":"cd49324","metric":7047,"metrics":{},"status":"discard","description":"Explored remaining optimization opportunities after loop counter to OpPhi conversion. Tried no-op store elimination for PhysicalStorageBuffer pointers — no savings (stores target non-function-local pointers, too risky). Gap vs spirv-opt -O is only 8 IDs across 3 shaders, requiring whole-program DCE or multi-block inlining. All easy wins exhausted. Score remains 7047, 199/199.","timestamp":1777845335749,"segment":71,"confidence":7.4,"asi":{"hypothesis":"No-op store elimination for load-then-store-same-value patterns across all pointer types","result":"0 IDs saved - the 4 no-op stores are in PhysicalStorageBuffer pointers (not function-local), too risky to eliminate","gap_analysis":"spirv-opt -O gap is only 8 IDs across 3 shaders: partial-write-preserve.frag (4, dead code elimination), combined-texture-sampler-shadow.vk.frag (2, function inlining), texture-proj-shadow.desktop.frag (2, unused load elimination)","remaining_opportunities":"Cross-block AC CSE: 6 IDs (dominance analysis needed). Extended loop counter: 3 IDs. spirv-opt gap: 8 IDs (complex optimizations). Total: ~17 IDs with HIGH effort.","conclusion":"7047 is very close to optimal. Further optimization requires complex analysis (dominance, SSA, multi-block inlining) for diminishing returns."}}
{"run":418,"commit":"cd49324","metric":7047,"metrics":{},"status":"discard","description":"Attempted cross-block AccessChain CSE via predecessor chain dominance. The 6 cross-block duplicates are in sibling blocks (if-else/switch arms), not chains — approach doesn't apply. Also confirmed 8-ID spirv-opt gap requires complex optimizations. Score remains 7047, 199/199.","timestamp":1777845849218,"segment":71,"confidence":3.7,"asi":{"conclusion":"Cross-block AC CSE via predecessor chain dominance does not help. The 6 cross-block AccessChain duplicates are in SIBLING blocks (arms of if-else/switch), not in simple chains. No further easy optimizations exist. The 8-ID spirv-opt gap requires: whole-program DCE (partial-write-preserve.frag), function inlining of functions containing calls (combined-texture-sampler-shadow.vk.frag), and unused load elimination (texture-proj-shadow.desktop.frag). All require complex changes for tiny gains.","gap_breakdown":"partial-write-preserve.frag: 4 IDs (spirv-opt eliminates entire dead function body), combined-texture-sampler-shadow.vk.frag: 2 IDs (function contains OpFunctionCall, our inliner refuses), texture-proj-shadow.desktop.frag: 2 IDs (unused loads after DCE)","hypothesis":"Extend cseWithinBlocks with predecessor chain dominance for cross-block CSE. Track which blocks branch unconditionally to the next block (single predecessor), inherit AccessChain signatures transitively."}}
{"run":419,"commit":"82bb3a6","metric":7046,"metrics":{},"status":"keep","description":"Extended loop counter to OpPhi: loads in any loop-dominated block: 7047->7046 (-1 ID). 199/199 pass. Previously required the load to be in the loop header. Now also handles loads in the continue block or body, as long as all loads are in blocks dominated by the header (not in pre-header or merge block).","timestamp":1777846305804,"segment":71,"confidence":3.1666666666666665,"asi":{"hypothesis":"Extend loop counter to OpPhi conversion to handle loads in any loop-dominated block (not just the header). The key insight: in structured SPIR-V, the loop header dominates all blocks within the loop (body, continue). So loads in the continue block can also be replaced with the OpPhi result.","expected_vs_actual_savings":"Expected 3 IDs from for-loop-init.frag %24, got 1. The OpPhi reuses an existing load result ID, so only the OpVariable (1 ID) was eliminated in terms of total_bound. The stores and load were removed but their IDs were already compacted out.","pattern_details":"Variable with 2 stores (pre-header + continue) and loads in continue block only. Previously required loads in the loop header; now allows loads in any block dominated by the header (checked by: not in pre-header, not in merge block)."}}
{"run":420,"commit":"3616ef8","metric":7024,"metrics":{},"status":"keep","description":"DCE: add image sampling opcodes (87-98) to dead-safe list: 7046->7024 (-22 IDs). 199/199 pass. Dead texture samples were not being removed because OpImageSample* opcodes were missing from is_dead_safe. Cascading DCE removes unused loads and extracts.","timestamp":1777846771649,"segment":71,"confidence":4.285714285714286,"asi":{"hypothesis":"Add image sampling opcodes (87-98) to DCE is_dead_safe list so dead texture samples are eliminated","root_cause":"OpImageSampleProjImplicitLod (91) and OpImageSampleProjDrefImplicitLod (93) were NOT in the is_dead_safe list, so DCE refused to remove them even when their results were unused. This caused cascading dead code (loads, composite extracts) to remain. texture-proj-shadow.desktop.frag had 4 dead texture samples with 12 IDs of dead code. Other shaders had similar patterns.","texture-proj-shadow":"bound 53->41 (-12 IDs) — eliminated 4 dead texture samples + cascading dead loads/extracts"}}
{"run":421,"commit":"779c133","metric":7015,"metrics":{},"status":"keep","description":"DCE: add OpSampledImage (86) to dead-safe list: 7024->7015 (-9 IDs). 199/199 pass. Cascading DCE removes dead image/sampler loads.","timestamp":1777846935176,"segment":71,"confidence":9.857142857142858,"asi":{"cascading_effect":"Removing dead OpSampledImage allows DCE to then remove dead loads of the image and sampler variables that only fed into the dead OpSampledImage","hypothesis":"Add OpSampledImage (86) to DCE is_dead_safe list — it's a pure operation","savings":"7024->7015 (-9 IDs). One dead OpSampledImage in nonuniform-qualifier.vk.nocompat.frag triggered cascading removal of dead loads."}}
{"run":422,"commit":"779c133","metric":7015,"metrics":{},"status":"discard","description":"Explored adding more pure opcodes to DCE is_dead_safe (VectorShuffle, CompositeConstruct, CopyObject, Image, FUnord comparisons, bit ops). All 0 IDs saved — no dead instances exist. Reverted additions.","timestamp":1777847263993,"segment":71,"confidence":4.928571428571429,"asi":{"checked_opcodes":"OpVectorShuffle(72), OpCompositeConstruct(74), OpCompositeInsert(75), OpCompositeExtract(76), OpCopyObject(78), OpImage(83), OpImageQuery*(101,102), FUnord comparisons(181,183,185,187,189,191), BitFieldInsert(195), BitReverse(197), BitCount(201), FindUMsb(202), FindSMsb(203), FindILsb(204)","hypothesis":"Add more pure opcodes to DCE is_dead_safe list for broader dead code elimination","result":"0 IDs saved — all these opcodes are used in the shaders. No dead instances exist."}}
{"run":423,"commit":"bdbd04a","metric":7005,"metrics":{},"status":"keep","description":"Precise AC-aware dead var elimination: 7015->7005 (-10 IDs). 199/199 pass. Track AccessChain results transitively to root vars. Only mark as loaded when AC result is used in OpLoad/OpFunctionCall/OpExtInst, not just when AC is computed.","timestamp":1777847770031,"segment":71,"confidence":5.642857142857143,"asi":{"hypothesis":"Track AccessChain results transitively for dead variable elimination. Previous code marked OpAccessChain as both loaded+stored, preventing removal of vars only accessed via AC for stores. Now AC results are tracked separately and only marked as loaded when actually used in OpLoad, OpFunctionCall args, or OpExtInst args.","root_cause":"OpAccessChain was conservatively marking the base variable as 'loaded', even though AC just computes a pointer. The actual read/write happens at the use site (OpLoad/OpStore). This prevented dead var elimination for variables only accessed via AccessChain for stores.","savings_breakdown":"partial-write-preserve.frag likely the biggest beneficiary — vars only accessed via AC for stores are now properly identified as dead"}}
{"run":424,"commit":"48ed05b","metric":6970,"metrics":{},"status":"keep","description":"Eliminate calls to unreachable functions: 7005->6970 (-35 IDs). 199/199 pass. Replace OpFunctionCall to functions with OpUnreachable-only body with OpUndef. Removes unreachable function definitions. Enables subsequent inlining of callers that now have no function calls.","timestamp":1777848128029,"segment":71,"confidence":8.142857142857142,"asi":{"cascade":"1) Replace OpFunctionCall to unreachable funcs with OpUndef. 2) Remove unreachable function definitions. 3) Caller functions no longer have OpFunctionCall, so inliner can inline them. 4) DCE cleans up inlined dead code.","hypothesis":"Replace OpFunctionCall to functions with OpUnreachable-only body with OpUndef. This eliminates the call, making the caller inlineable.","savings_breakdown":"combined-texture-sampler-shadow.vk.frag: 40->32 (-8 IDs), switch-nested.legacy.vert: significant reduction. Total: -35 IDs"}}
{"run":425,"commit":"8d1ace3","metric":6967,"metrics":{},"status":"keep","description":"Fix OpUndef word count bug: 6970->6967 (-3 IDs). 199/199 pass. OpUndef needs wc=3 (header+result_type+result_id), was emitting wc=2. Fix allows proper compactIds and DCE processing.","timestamp":1777849362691,"segment":71,"confidence":6.324324324324325,"asi":{"bug_fix":"OpUndef word count was 2 (header + result_type) but should be 3 (header + result_type + result_id). This caused SPIR-V corruption that spirv-val didn't catch but prevented subsequent passes from properly handling the OpUndef.","hypothesis":"Fix OpUndef word count bug in elimUnreachableCalls: wc should be 3 not 2","savings":"6970->6967 (-3 IDs). The fix allows compactIds and DCE to properly process OpUndef, enabling further dead code elimination."}}
{"run":426,"commit":"8d1ace3","metric":6967,"metrics":{},"status":"discard","description":"Explored AC-based redundant load elimination. Found 3 duplicate loads through AccessChain results from read-only vars, but their result IDs are mid-range (not near bound). 0 IDs saved on total_bound. Reverted.","timestamp":1777849790987,"segment":71,"confidence":5.086956521739131,"asi":{"finding":"Redundant loads through AccessChain results exist (3 cases) but their result IDs are in the middle of the ID space. Eliminating them doesn't reduce total_bound because higher IDs are still in use. compactIds can't reclaim the middle IDs.","hypothesis":"Extend elimRedundantLoads to handle loads through AccessChain results from read-only variables","result":"0 IDs saved — eliminated instructions produce result IDs in the middle of the ID space, not near the bound"}}
{"run":427,"commit":"3a91ed2","metric":6946,"metrics":{},"status":"keep","description":"Retarget empty passthrough blocks: 6967->6946 (-21 IDs). 199/199 pass. Retarget branches (including conditional/switch) that target empty blocks (OpLabel+OpBranch only) to skip directly to the ultimate destination. Removes empty intermediary blocks.","timestamp":1777850221411,"segment":71,"confidence":5.872340425531915,"asi":{"approach":"Pre-pass that retargets branches to skip empty passthrough blocks (OpLabel + OpBranch only). Resolves transitive chains (A->B->C becomes A->C). Handles OpBranch, OpBranchConditional, OpLoopMerge, and OpSelectionMerge targets. Removes the empty blocks entirely.","cascade":"Retargeting branches eliminates the empty block's OpLabel (1 ID each). Subsequent compactIds compacts the ID space.","hypothesis":"Retarget branches that target empty passthrough blocks to skip them. The existing mergeBlocks only handles predecessors with unconditional branches, not conditional/switch branches targeting empty blocks.","savings":"6967->6946 (-21 IDs). Removed ~30 empty passthrough blocks across all shaders."}}
{"run":429,"commit":"a84d979","metric":6722,"metrics":{},"status":"discard","description":"Reverted retargetEmptyBlocks and dedupAllTypes due to 8 regression failures. Actual score at 8d1ace3: 6722 total_bound, 193/199 pass. Earlier 199/199 measurement was incorrect (matched SUMMARY not per-shader). 6 pre-existing spirv-val failures from elimUnreachableCalls (OpFunctionEnd orphaning + OpName forward references to removed functions).","timestamp":1777852180605,"segment":71,"confidence":5.423076923076923,"asi":{"actual_score":"6722 total_bound, 193/199 pass, 6 spirv-val failures (pre-existing from elimUnreachableCalls)","bug_discovery":"The retargetEmptyBlocks pass broke 8 shaders by removing blocks whose label IDs were referenced by other instructions. The dedupAllTypes pass made it worse. Both reverted.","earlier_measurement_error":"My earlier measurement of 199/199 pass was wrong — I was checking for 'PASS' in stderr, which matched the SUMMARY 'PASS: N' even when individual shaders failed. The correct count is 193/199 pass with 6 pre-existing spirv-val failures from the elimUnreachableCalls pass.","hypothesis":"Retarget empty passthrough blocks and deduplicate all types to reduce total_bound","next":"The retarget pass needs to only remove blocks whose label IDs are NOT referenced by any non-branch instruction. The 6 pre-existing failures need to be fixed in elimUnreachableCalls (OpFunctionEnd orphaning + OpName forward references)."}}
{"run":430,"commit":"35f6567","metric":6703,"metrics":{},"status":"keep","description":"Fix elimUnreachableCalls bugs: entry point protection + OpFunctionEnd orphan + OpName forward refs. 194/198 pass (same as baseline), 6703 bound (-41 from baseline 6744). 4 pre-existing failures remain.","timestamp":1777855845352,"segment":71,"confidence":10.297297297297296,"asi":{"bugs_fixed":"1) Entry point functions were being removed by elimUnreachableCalls when their body was OpUnreachable. 2) OpFunctionEnd was emitted outside skip_func guard, orphaning it. 3) OpName forward references to removed function IDs were not cleaned up.","correct_score":"194/198 pass, 4 fail, 6703 total_bound","discovery":"The earlier '199/199 pass' measurements were INCORRECT due to stale zig cache. The actual measurement is 194/198 pass. The ref_classification cache was also lost during clean rebuild, now regenerated with 198 shaders (was 199).","hypothesis":"Fix bugs in elimUnreachableCalls: (1) don't remove entry point functions, (2) skip OpFunctionEnd inside removed functions, (3) skip OpName for removed function IDs","pre_existing_failures":"flush_params.frag (ID 3 undefined), ground.frag (ID 26 undefined), partial-write-preserve.frag (ID 12 undefined), struct-type-unrelated-alias.frag (ID 3 undefined)","stale_cache_issue":"Zig build system was caching old binaries across compact_ids changes. Need to rm -rf .zig-cache when changing core modules."}}
{"run":431,"commit":"8588866","metric":6868,"metrics":{},"status":"keep","description":"Fix DCE dead var elim: remove AccessChain+Store for dead vars. 198/198 pass, 0 fail, 6868 bound (+124 from 6744 baseline). All 4 pre-existing failures fixed.","timestamp":1777856925324,"segment":71,"confidence":9.180722891566266,"asi":{"correct_score":"198/198 pass, 0 fail, 6868 total_bound","discovery":"DCE's dead variable elimination removed OpVariable for function-local vars that were 'stored but never loaded', but left OpAccessChain instructions that referenced them. Also left OpStore through AccessChain results. This caused 'ID not defined' spirv-val errors.","fix":"Extended dead var elimination to also remove OpAccessChain and OpStore that reference dead vars or AC results derived from dead vars. This cascading cleanup prevents orphaned references.","hypothesis":"Fix DCE dead variable elimination to also remove OpAccessChain and OpStore instructions that reference dead variables","previous_failures_fixed":"flush_params.frag, ground.frag, partial-write-preserve.frag, struct-type-unrelated-alias.frag — all had OpAccessChain referencing removed OpVariables"}}
{"type":"config","name":"glslpp SPIR-V bound optimization - Session 6 (corrected baseline)","metricName":"total_bound","metricUnit":"IDs","bestDirection":"lower"}
{"run":432,"commit":"b56f519","metric":6868,"metrics":{},"status":"keep","description":"Baseline: 6868 total_bound, 198/198 pass, 0 mismatches","timestamp":1777857045226,"segment":72,"confidence":null,"asi":{"hypothesis":"Baseline measurement after fixing all correctness issues"}}
{"run":433,"commit":"1078570","metric":6839,"metrics":{},"status":"keep","description":"Retarget empty passthrough blocks: 6868->6839 (-29 IDs). 198/198 pass. Fixed opcode bugs (246=LoopMerge, 247=SelectionMerge, 251=Switch). Protected OpPhi parents, merge targets, and OpName targets.","timestamp":1777859087923,"segment":72,"confidence":null,"asi":{"bugs_fixed":"1) Used wrong opcodes (251/252 instead of 246/247 for LoopMerge/SelectionMerge). 2) Checked block_insts==1 instead of ==2 (OpLabel counts as 1). 3) Didn't protect OpName targets. 4) OpSwitch is opcode 251, not 252.","hypothesis":"Retarget empty passthrough blocks to skip them, with proper protection for OpPhi parents, merge targets, and OpName targets","savings":"6868->6839 (-29 IDs). Biggest savings in cfg.comp (-13), partial-write-preserve.frag (-6), switch.legacy.frag (-4), cfg-preserve-parameter.comp (-3)."}}
{"run":434,"commit":"1078570","metric":6839,"metrics":{},"status":"discard","description":"Explored remaining opportunities: pipeline fully converged. 198/198 pass, 6839 bound. No duplicate types/consts/dead loads. Beat glslang by 44%, spirv-opt by 293 IDs. All easy wins exhausted.","timestamp":1777860612961,"segment":72,"confidence":null,"asi":{"conclusion":"Pipeline is fully converged. Extra DCE pass saves 0 IDs. No duplicate types, constants, or dead loads. All easy wins exhausted. Beat glslang by 5387 IDs (44%) and spirv-opt -O by 293 IDs.","explored":"1) Extra DCE+compact pass: 0 savings. 2) Duplicate constants: 0 (compactIds handles). 3) Duplicate types: 0. 4) Dead loads: were false positives from incomplete opcode table. 5) Same-target conditional branches: 7 exist but minimal savings.","hypothesis":"Look for remaining optimization opportunities after retarget pass","next":"Remaining significant gains require codegen-level changes (emit fewer temporaries) or complex transforms (multi-block function inlining, full SSA conversion). These are high-effort but the only paths to further improvement."}}
{"run":435,"commit":"0473836","metric":6838,"metrics":{},"status":"keep","description":"Add OpCompositeConstruct CSE within blocks: 6839->6838 (-1 ID). 198/198 pass. Extended cseWithinBlocks to deduplicate OpCompositeConstruct with same type+constituents.","timestamp":1777861957624,"segment":72,"confidence":60,"asi":{"found_duplicates":"3 total: 2 in shader-arithmetic-8bit.nocompat.vk.frag (same block), 1 in generate_height.comp (same block). Only 1 ID saved after substitution resolution.","hypothesis":"Extend cseWithinBlocks to also handle OpCompositeConstruct (opcode 80) - same type+constituents = same result","savings":"6839->6838 (-1 ID)"}}
{"run":436,"commit":"fbfdc9f","metric":6834,"metrics":{},"status":"keep","description":"Extend CSE to pure value operations: 6838->6834 (-4 IDs). 198/198 pass. Added FNegate, arithmetic, comparisons, conversions, logical ops to CSE. Safe because these are truly pure (no memory interaction). Excludes image sampling ops.","timestamp":1777862695497,"segment":72,"confidence":34,"asi":{"approach":"Extended cseWithinBlocks to handle all pure value operations (arithmetic, comparisons, conversions, logical ops) in addition to AccessChain, SampledImage, and CompositeConstruct. Excludes image sampling and memory-dependent operations to avoid unsafe CSE.","hypothesis":"Extend CSE to all pure value operations within blocks + entry-block cross-block","result":"6838->6834 (-4 IDs), 198/198 pass. The aggressive version (including image ops) saved 463 IDs but broke 9 shaders. The safe version saves only 4 IDs.","savings":"4 IDs from duplicate FNegate and similar pure ops"}}
{"run":437,"commit":"fbfdc9f","metric":6834,"metrics":{},"status":"discard","description":"Attempted constant-store forwarding for function-local vars. Two approaches both failed: OpCopyObject (wrong opcode) and entry-store extension (memory corruption). Reverted. Score remains 6834, 198/198.","timestamp":1777866190516,"segment":72,"confidence":13.6,"asi":{"attempted":"1) New constStoreForward pass with OpCopyObject - broken (wrong opcode, wrong wc). 2) Extended entry-store forwarding to accept non-entry constant stores - memory corruption from bitset lifetime issue.","hypothesis":"Forward constant stores to function-local vars across blocks: if a var is stored exactly once with a constant, replace all loads with the constant","next":"The remaining optimization opportunities all require high effort: multi-block function inlining (~50 IDs), SSA conversion (~30 IDs), or codegen-level changes. The constant-store forwarding is fixable but only saves ~4 IDs across 2 shaders.","result":"Both approaches broke shaders. The OpCopyObject approach used wrong opcode (83 not 78) and wrong word count. The entry-store extension caused memory corruption."}}
{"run":438,"commit":"5fa9d49","metric":6827,"metrics":{},"status":"keep","description":"Constant-store forwarding for function-local vars: 6834->6827 (-7 IDs). 198/198 pass. If a func-local var is stored exactly once with a constant value and has no unsafe uses, replace all loads with the constant. Fixed critical 'W' operand handling bug (pre-increment vs post-increment).","timestamp":1777869506806,"segment":72,"confidence":10.25,"asi":{"fixed_bug":"The 'W' (OpSwitch case) operand handling had wi+=1 BEFORE reading the literal instead of AFTER. This swapped literals and targets, corrupting OpSwitch instructions. Same bug exists in other 'W' handlers but those use wi starting from before the operands (pre-increment is correct there).","hypothesis":"Forward constant stores to function-local vars across blocks: if a var is stored exactly once with a constant, replace all loads with the constant","shaders_affected":"selection-block-dominator.frag and switch.legacy.frag (2 shaders, 7 IDs saved)"}}
