{"run":816,"commit":"90703bb","metric":696,"metrics":{"conformance":213,"conformance_double_frees":0,"conformance_leaks":0,"tests_leaked":0},"status":"keep","description":"Add 5 tests: outerProduct, matrixCompMult, inverse mat4, compute conditional, complex math. 696/696 HLSL.","timestamp":1778411835761,"segment":80,"confidence":3.7666666666666666,"asi":{"findings":"Added 5 tests: T537 (outerProduct vec3xvec3 to mat3), T538 (matrixCompMult component-wise), T539 (inverse mat4), T540 (compute conditional SSBO write), T541 (complex expression with sin/cos/tan/pow/sqrt/log/exp). All 696/696 pass, 213/222 conformance.","hypothesis":"Add tests for outerProduct, matrixCompMult, inverse mat4, compute conditional write, complex math expressions","next_action":"696 tests. Push and continue with more coverage."}}
{"run":817,"commit":"d652f77","metric":701,"metrics":{"conformance":213,"conformance_double_frees":0,"conformance_leaks":0,"tests_leaked":0},"status":"keep","description":"Add 5 tests: struct sampler, array param, chained mix, gl_FrontFacing, struct return. 701/701 HLSL.","timestamp":1778412028655,"segment":80,"confidence":3.774834437086093,"asi":{"findings":"Added 5 tests: T542 (struct with sampler member), T543 (array parameter to function), T544 (vec4 chained mix/lerp), T545 (gl_FrontFacing), T546 (struct return from function with constructor). All 701/701 pass, 213/222 conformance.","hypothesis":"Add tests for struct with sampler, array params, chained mix, gl_FrontFacing, struct return","next_action":"701 tests. Consider: multiple uniform blocks, texture size query, or nested control flow."}}
{"run":818,"commit":"83e8c93","metric":706,"metrics":{"conformance":213,"conformance_double_frees":0,"conformance_leaks":0,"tests_leaked":0},"status":"keep","description":"Add 5 tests: textureSize, 3 uniform blocks, nested if-else logical, multi-output vertex, bitonic sort. 706/706 HLSL.","timestamp":1778412177276,"segment":80,"confidence":3.758169934640523,"asi":{"findings":"Added 5 tests: T547 (textureSize query for sampler2D), T548 (3 uniform blocks Camera/Object/Light), T549 (nested if-else with && || operators), T550 (vertex with 3 output varyings), T551 (compute bitonic sort with shared memory + barrier). All 706/706 pass, 213/222 conformance.","hypothesis":"Add tests for textureSize, multiple uniform blocks, nested if-else with logical ops, multi-output vertex, bitonic sort compute","next_action":"706 tests. Consider: gl_SampleID, gl_SamplePosition, or more complex rendering patterns."}}
{"run":819,"commit":"c6d23b7","metric":711,"metrics":{"conformance":213,"conformance_double_frees":0,"conformance_leaks":0,"tests_leaked":0},"status":"keep","description":"Add 5 tests: gl_SampleID/SamplePosition, mat2 rotation, 3 textures, rounding funcs, wave compute. 711/711 HLSL.","timestamp":1778412325016,"segment":80,"confidence":3.7419354838709675,"asi":{"findings":"Added 5 tests: T552 (gl_SampleID + gl_SamplePosition), T553 (mat2 2D rotation matrix), T554 (3 sampler2D with different bindings), T555 (abs/sign/ceil/floor/round/trunc), T556 (compute wave simulation with neighbor reads). All 711/711 pass, 213/222 conformance.","hypothesis":"Add tests for multisample builtins, rotation matrix, multiple textures, rounding functions, wave compute","next_action":"711 tests. Consider: frag depth layout, sample shading, or more advanced rendering."}}
{"run":820,"commit":"3c2c999","metric":716,"metrics":{"conformance":213,"conformance_double_frees":0,"conformance_leaks":0,"tests_leaked":0},"status":"keep","description":"Add 5 tests: depth_greater layout, sample shading, precision qualifiers, vec extract/insert, PBR lighting. 716/716 HLSL.","timestamp":1778412523891,"segment":80,"confidence":3.762057877813505,"asi":{"findings":"Added 5 tests: T557 (layout depth_greater on gl_FragDepth), T558 (sample_rate_shading qualifier), T559 (mediump/highp mat4/vec4), T560 (vector component extract/insert patterns), T561 (simplified PBR lighting with GGX distribution). All 716/716 pass, 213/222 conformance.","hypothesis":"Add tests for depth layout qualifiers, sample shading, precision qualifiers, vector component ops, PBR lighting","next_action":"716 tests. Consider: subgroup operations, ray queries, or more compute patterns."}}
{"run":821,"commit":"1b9a088","metric":721,"metrics":{"conformance":213,"conformance_double_frees":0,"conformance_leaks":0,"tests_leaked":0},"status":"keep","description":"Add 5 tests: subgroup basic/arithmetic, tiled matrix multiply, discard side effects, texture bias+LOD. 721/721 HLSL.","timestamp":1778412703779,"segment":80,"confidence":3.782051282051282,"asi":{"findings":"Added 5 tests: T562 (subgroupElect basic), T563 (subgroupAdd arithmetic), T564 (compute tiled matrix multiply with 2D shared memory), T565 (conditional discard with side effects), T566 (texture with bias + textureLod). All 721/721 pass, 213/222 conformance.","hypothesis":"Add tests for subgroup basic/arithmetic, tiled matrix multiply compute, discard with side effects, texture bias+LOD","next_action":"721 tests. Consider: subgroup ballot, quad operations, or more advanced compute patterns."}}
{"run":822,"commit":"30a0809","metric":726,"metrics":{"conformance":213,"conformance_double_frees":0,"conformance_leaks":0,"tests_leaked":0},"status":"keep","description":"Add 5 tests: subgroup ballot/shuffle, quad ops, compute histogram, bilinear interp, PCF shadow. 726/726 HLSL.","timestamp":1778412898619,"segment":80,"confidence":3.7658227848101267,"asi":{"findings":"Added 5 tests: T567 (subgroup ballot + shuffle), T568 (quad swap horizontal/vertical), T569 (compute histogram with atomicAdd), T570 (bilinear interpolation helper function), T571 (PCF shadow comparison 3x3 kernel). All 726/726 pass, 213/222 conformance.","hypothesis":"Add tests for subgroup ballot/shuffle, quad ops, compute histogram, bilinear interp, PCF shadow","next_action":"726 tests. Consider: ray tracing queries, mesh shading, or more complex rendering."}}
{"run":823,"commit":"29ed446","metric":731,"metrics":{"conformance":213,"conformance_double_frees":0,"conformance_leaks":0,"tests_leaked":0},"status":"keep","description":"Add 5 tests: compute bloom, cascaded shadows, Gaussian blur, deferred G-buffer+lighting. 731/731 HLSL.","timestamp":1778413014681,"segment":80,"confidence":3.75,"asi":{"findings":"Added 5 tests: T572 (compute bloom bright extraction with image load/store), T573 (cascaded shadow maps with sampler2DArrayShadow), T574 (compute separable Gaussian blur horizontal pass), T575 (deferred G-buffer fill with 3 MRTs), T576 (deferred lighting pass reading from G-buffer textures). All 731/731 pass, 213/222 conformance.","hypothesis":"Add tests for compute bloom, cascaded shadows, Gaussian blur, deferred G-buffer fill and lighting","next_action":"731 tests. Consider: SSAO, temporal AA, or more advanced rendering."}}
{"run":824,"commit":"741ea47","metric":736,"metrics":{"conformance":213,"conformance_double_frees":0,"conformance_leaks":0,"tests_leaked":0},"status":"keep","description":"Add 5 tests: SSAO, N-body gravity, Reinhard tone mapping, atmospheric fog, radix sort. 736/736 HLSL.","timestamp":1778413201194,"segment":80,"confidence":3.769470404984424,"asi":{"findings":"Added 5 tests: T577 (SSAO with kernel sampling), T578 (compute N-body gravity simulation), T579 (extended Reinhard tone mapping with white point + gamma), T580 (atmospheric fog with exp function), T581 (compute radix sort prefix with shared memory + atomicAdd). All 736/736 pass, 213/222 conformance.","hypothesis":"Add tests for SSAO, N-body gravity, extended Reinhard, atmospheric fog, radix sort prefix","next_action":"736 tests. Consider: vertex skinning, parallax mapping, screen-space reflections, or more compute patterns."}}
{"run":825,"commit":"970809d","metric":741,"metrics":{"conformance":213,"conformance_double_frees":0,"conformance_leaks":0,"tests_leaked":0},"status":"keep","description":"Add 5 tests: vertex skinning, parallax mapping, FFT butterfly, chromatic aberration, particle system. 741/741 HLSL.","timestamp":1778413305181,"segment":80,"confidence":3.7888198757763973,"asi":{"findings":"Added 5 tests: T582 (vertex skinning with bone weights + matrix palette), T583 (parallax mapping with height texture), T584 (compute FFT butterfly stage with complex math), T585 (chromatic aberration post-process with per-channel UV offset), T586 (compute particle system with emission/death cycle). All 741/741 pass, 213/222 conformance.","hypothesis":"Add tests for vertex skinning, parallax mapping, FFT butterfly, chromatic aberration, particle emission","next_action":"741 tests. Consider: screen-space reflections, motion blur, morph targets, or more compute."}}
{"run":826,"commit":"e911a59","metric":746,"metrics":{"conformance":213,"conformance_double_frees":0,"conformance_leaks":0,"tests_leaked":0},"status":"keep","description":"Add 5 tests: SSR, motion blur, marching cubes, morph targets, FXAA. 746/746 HLSL.","timestamp":1778413477882,"segment":80,"confidence":3.773006134969325,"asi":{"findings":"Added 5 tests: T587 (SSR ray marching pattern), T588 (motion blur with velocity buffer), T589 (compute marching cubes with uniform buffer params), T590 (vertex morph target blending with push constants), T591 (FXAA edge detection with luminance sampling). All 746/746 pass, 213/222 conformance.","hypothesis":"Add tests for SSR, motion blur, marching cubes, morph targets, FXAA","next_action":"746 tests. Close to 750 milestone. Consider: bloom composite, DOF, or more edge cases."}}
{"run":827,"commit":"b2f69b5","metric":751,"metrics":{"conformance":213,"conformance_double_frees":0,"conformance_leaks":0,"tests_leaked":0},"status":"keep","description":"Add 5 tests: bloom composite, DOF bokeh, meshlet culling, tessellation control, tessellation eval. 751/751 HLSL.","timestamp":1778413656813,"segment":80,"confidence":3.757575757575758,"asi":{"findings":"Added 5 tests: T592 (bloom composite with 4 texture bindings), T593 (depth of field bokeh with CoC), T594 (compute meshlet culling with frustum check), T595 (tessellation control passthrough with tess levels), T596 (tessellation evaluation triangle interpolation). MILESTONE: 751/751 pass, 213/222 conformance.","hypothesis":"Add tests for bloom composite, DOF, meshlet culling, tessellation control/evaluation","next_action":"751 tests — MILESTONE! Consider: more edge cases, stress tests, or implementing missing features to improve conformance from 213/222."}}
{"run":828,"commit":"fa2fe3a","metric":751,"metrics":{"conformance":213,"conformance_double_frees":0,"conformance_leaks":0,"tests_leaked":0},"status":"keep","description":"Add SKIP logging to conformance runner; investigate 9 skipped shaders (all legitimate). 751/751 HLSL, 213/222 conformance.","timestamp":1778420955831,"segment":80,"confidence":3.7462235649546827,"asi":{"findings":"Investigated conformance: 213/222 with 9 skips (7 error-validation tests with // ERROR markers, 1 empty file, 1 include-only). Real conformance is 213/213 = 100% on compilable shaders. Attempted to strip ERROR comments to compile those tests but specExamples.frag produces invalid SPIR-V (multiple depth execution modes). Reverted to skip approach. Also added SKIP logging to runner for visibility.","hypothesis":"Investigate and improve conformance from 213/222","next_action":"Conformance is maxed at 213/213 compilable shaders. 9 skips are legitimate (error tests, empty, include-only). Focus on improving HLSL test coverage instead."}}
{"type":"config","name":"glslpp correctness and performance","metricName":"test_failures","metricUnit":"","bestDirection":"lower"}
{"run":829,"commit":"19446d2","metric":10,"metrics":{"build_ms":2051},"status":"keep","description":"Baseline: 10/76 reference tests fail (missing opcodes: CopyMemory, OpImage, ShiftRight/Left, Determinant, Reflect/Refract, ImageSampleProjImplicitLod)","timestamp":1778439224176,"segment":81,"confidence":null,"asi":{"hypothesis":"baseline measurement","missing_opcodes":"Op63(CopyMemory), Op100(OpImage), Op194(ShiftRightLogical), Op196(ShiftLeftLogical), Op91(ImageSampleProjImplicitLod)","missing_std450":"#33(Determinant in MSL), #71(Reflect in GLSL), #72(Refract in GLSL)","passing_tests":66,"failing_tests":10}}
{"run":830,"commit":"5c0af8d","metric":0,"metrics":{"build_ms":1149},"status":"keep","description":"Add all missing opcodes: CopyMemory, OpImage, ShiftRightLogical, ShiftLeftLogical, ImageSampleProjImplicitLod, std450 Determinant/Reflect/Refract. All 76 reference tests now pass.","timestamp":1778440126596,"segment":81,"confidence":null,"asi":{"build_ms":1149,"hypothesis":"Add missing opcodes: CopyMemory, OpImage, ShiftRightLogical, ShiftLeftLogical, ImageSampleProjImplicitLod, Determinant/Reflect/Refract std450","missing_opcodes_fixed":"Op63(CopyMemory), Op100(OpImage), Op194(ShiftRightLogical), Op196(ShiftLeftLogical), Op91(ImageSampleProjImplicitLod)","missing_std450_fixed":"#33(Determinant) in MSL, #71(Reflect) in GLSL/MSL, #72(Refract) in GLSL/MSL","passing_tests":76,"failing_tests":0}}
{"type":"config","name":"glslpp cross-compiler performance optimization","metricName":"total_ms","metricUnit":"ms","bestDirection":"lower"}
{"run":831,"commit":"a650341","metric":756,"metrics":{"test_failures":0},"status":"keep","description":"Baseline: CRT shader compilation 756ms median (5 runs), 0 test failures","timestamp":1778440313622,"segment":82,"confidence":null,"asi":{"build_cache_warm":true,"hypothesis":"baseline measurement for performance optimization phase","test_failures":0,"workload":"CRT shader: GLSL->SPIR-V->HLSL/GLSL/MSL via dump-crt tool, 5 iterations median"}}
{"run":832,"commit":"a650341","metric":54,"metrics":{"test_failures":0},"status":"discard","description":"Stack buffer for buildAccessExpr in GLSL+MSL backends — no measurable improvement within noise (35-57ms range)\"","timestamp":1778441660647,"segment":82,"confidence":null,"asi":{"hypothesis":"Replace buildAccessExpr ArrayList with 512-byte stack buffer to avoid heap allocation per AccessChain resolution","noise_range_ms":"35-57, very high variance due to file I/O","optimization_effect":"within noise, no measurable improvement","next_action_hint":"Profile with more stable benchmark — remove file I/O or use @embedFile. Consider that the 7ms per backend may be dominated by the SPIR-V parsing pass (building instruction slice + id_defs map), not the emit phase."}}
{"run":833,"commit":"232079c","metric":18,"metrics":{"test_failures":0},"status":"keep","description":"Re-baseline with stabilized metric: cross-compilation = 18ms (min of 11 runs), 0 failures","timestamp":1778441922839,"segment":82,"confidence":20.5,"asi":{"cross_compile_ms":18,"frontend_compile_ms":30,"hypothesis":"re-baseline with new metric: cross-compilation time only (SPIR-V → HLSL+GLSL+MSL)","metric_change":"Changed from 'zig build dump-crt wall time (756ms, dominated by build overhead)' to 'cross-compilation time measured by tool (15-18ms, min of 11 runs)'","test_failures":0}}
{"run":834,"commit":"53a74d2","metric":12,"metrics":{"test_failures":0},"status":"keep","description":"Replace id_defs HashMap with flat array in all 4 backend files — eliminates hash overhead for ~200 ID lookups per backend. 12-17ms (was 18ms baseline).","timestamp":1778442707009,"segment":82,"confidence":35.42857142857143,"asi":{"hypothesis":"Replace id_defs AutoHashMap with flat array indexed by SPIR-V ID (bound from header). Eliminates hash overhead on every getDef() call.","baseline_ms":18,"runs":"12, 16, 14, 17, 12","improvement":"~22% median, ~33% best","files_changed":"spirv_to_glsl.zig, spirv_to_msl.zig, spirv_to_hlsl.zig, spirv_cross_common.zig","mechanism":"SPIR-V IDs are dense 0..bound, so direct array indexing replaces hash lookup. Also removes HashMap allocation/deallocation overhead.","test_failures":0}}
{"run":835,"commit":"53a74d2","metric":12,"metrics":{"test_failures":0},"status":"discard","description":"Pre-size names/decs HashMaps — no measurable improvement (12-14ms, same as 12ms baseline)","timestamp":1778443159478,"segment":82,"confidence":124,"asi":{"hypothesis":"Pre-size names and decs HashMaps based on module.id_defs.len to eliminate resize/rehash during fill","result":"No measurable improvement — 12-14ms range, same as 12ms baseline","reason":"HashMap resize overhead was already negligible for ~200 entries (6-8 resizes at ~50ns each = ~400ns total, vs 12ms runtime)","next_action_hint":"Try eliminating allocations in the hot emit path. The resolvePointer/constantLiteral allocations (~50-100 per backend) are the remaining low-hanging fruit. Or try replacing names HashMap with a flat array like we did for id_defs."}}
{"run":836,"commit":"53a74d2","metric":12,"metrics":{"test_failures":0},"status":"discard","description":"Arena allocator for all backend allocations — no improvement (12-17ms, same as baseline)","timestamp":1778444263518,"segment":82,"confidence":248,"asi":{"hypothesis":"Use ArenaAllocator for all backend allocations (names, decs, emit) to eliminate individual free() overhead","result":"No improvement — 12-17ms range, same as 12ms baseline","reason":"ArenaAllocator adds bookkeeping overhead (tracking allocations) that offsets the savings from eliminating individual free() calls. For small allocations (~200 entries, ~4ms total), the overhead is a wash.","next_action_hint":"Try eliminating allocations entirely in the hot path. Write access expressions directly to the output buffer instead of allocating intermediate strings. Or try pre-computing the output size to avoid ArrayList resizes."}}
{"run":839,"commit":"0892799","metric":13,"metrics":{"test_failures":0},"status":"discard","description":"Parse cache for SPIR-V across backends — no improvement (12-13ms vs 11ms baseline, slightly worse due to cache overhead)","timestamp":1778447464489,"segment":82,"confidence":745,"asi":{"baseline_ms":11,"hypothesis":"Add parse cache to share parsed SPIR-V across backend calls. Cache keyed by words pointer+length, stores instructions+id_defs+metadata. Each backend checks cache before parsing.","runs_ms":"12, 13, 12","result":"No improvement — 12-13ms range vs 11ms baseline. Slightly WORSE.","reason":"Parse was only ~60us per backend (1% of time). The cache adds overhead from global variable access, struct initialization, and cache eviction logic that exceeds the savings from skipping 2 parse passes. The bottleneck is in collectNames (~80% of time), not parsing.","next_action_hint":"Accept 11ms as near-optimal. The profiling showed collectNames at 4ms but optimizations to it don't help within the min-of-11 noise floor. The real bottleneck may be HashMap resize/allocation overhead during name collection, but this is inherent to the current architecture."}}
{"run":840,"commit":"0892799","metric":12,"metrics":{"test_failures":0},"status":"discard","description":"Verify baseline stability after cleanup: 11-12ms confirmed (no regression from leaked cache code)","timestamp":1778447923488,"segment":82,"confidence":745,"asi":{"baseline_ms":11,"current_ms":12,"hypothesis":"Verify baseline is stable after cleanup of leaked parse cache changes","runs_ms":"12, 12, 12, 16, 12","result":"Baseline confirmed at 11-12ms range","conclusion":"11ms is the performance floor. 5 consecutive discard experiments (HashMap pre-sizing, arena allocator, bufPrint, output buffer pre-sizing, parse cache) confirm no further micro-optimizations are effective. The profiling showed collectNames at ~4ms but optimizations to it fall within noise floor of the min-of-11 metric. The only remaining significant improvement would be parallel compilation (caller-side threading), which is an architectural change not a library optimization."}}
{"run":841,"commit":"0892799","metric":12,"metrics":{"test_failures":0},"status":"discard","description":"Switch-based collectNames dispatch — no improvement (12-14ms vs 11ms baseline, cleaner code but same performance)","timestamp":1778448317686,"segment":82,"confidence":745,"asi":{"baseline_ms":11,"hypothesis":"Replace if-chain in collectNames with switch statement for O(1) opcode dispatch instead of O(N) sequential checks","result":"No improvement — 12-14ms range, same as 11ms baseline","reason":"Zig's optimizer likely already converts the if-chain to a jump table for enum comparisons. The switch is cleaner code but doesn't improve runtime.","next_action_hint":"Accept 11ms as the performance floor. 6 consecutive failed optimization attempts confirm diminishing returns. The only remaining improvement would be architectural: parallel compilation (caller-side) or a fundamentally different approach to name resolution."}}
{"run":842,"commit":"0892799","metric":11,"metrics":{"test_failures":0},"status":"discard","description":"Pre-size output ArrayList based on SPIR-V size — no improvement (11ms same as baseline)","timestamp":1778448637604,"segment":82,"confidence":745,"asi":{"baseline_ms":11,"hypothesis":"Pre-size output ArrayList to spirv_words.len*4 (~6.7KB) to avoid resize during emit. HLSL was starting at 256 bytes!","result":"No improvement — 11ms min, same as baseline","reason":"ArrayList resize involves ~1 realloc + memcpy of existing bytes (~4KB). At ~1μs, this is noise vs 11ms total.","next_action_hint":"7 consecutive discards. The 11ms floor is confirmed. Every remaining micro-optimization (HashMap sizing, arena, bufPrint, parse cache, switch dispatch, output sizing) falls within noise. Consider stopping or pivoting to a different optimization target."}}
{"type":"config","name":"glslpp cross-compiler performance (ReleaseFast)","metricName":"total_ms","metricUnit":"ms","bestDirection":"lower"}
