{"run":773,"commit":"1bfa4ff","metric":505,"metrics":{"conformance":213,"conformance_double_frees":0,"conformance_leaks":0,"tests_leaked":0},"status":"keep","description":"Implement bitCount, findLSB, findMSB GLSL builtins + 5 tests. OpBitCount (opcode 205), GLSLstd450 FindILsb/FindSMsb/FindUMsb. 505/505 HLSL, 213/222 conformance.","timestamp":1778390117790,"segment":80,"confidence":3.1965811965811968,"asi":{"findings":"Implemented 3 previously-unsupported GLSL builtins: (1) bitCount → OpBitCount (SPIR-V opcode 205, added to spirv.zig enum + ir.zig tag + codegen + HLSL cross-compiler as 'countbits'), (2) findLSB → GLSLstd450 FindILsb (73, HLSL 'firstbitlow'), (3) findMSB → GLSLstd450 FindSMsb/FindUMsb (74/75, HLSL 'firstbithigh' with signed/unsigned dispatch). Added 5 tests: T346 (bitCount int), T347 (bitCount uint), T348 (findLSB), T349 (findMSB signed), T350 (findMSB unsigned). Note: findMSB(uint) has a type mismatch — GLSL returns int but SPIR-V FindUMsb returns uint. Worked around with explicit uint() cast in test. 505/505 HLSL, 213/222 conformance.","hypothesis":"Implement currently-unsupported GLSL builtins: bitCount, findLSB, findMSB — expand the set of GLSL code the compiler can handle","next_action":"Fix findMSB(uint) type mismatch properly: findMSB should always return int, but the semantic analyzer uses arg type as result type. Need special-case result_ty for findMSB/findLSB to always be int/ivec. Also consider implementing bitfieldReverse (OpBitReverse, opcode 189), uaddCarry, usubBorrow."}}
{"run":774,"commit":"b916276","metric":510,"metrics":{"conformance":213,"conformance_double_frees":0,"conformance_leaks":0,"tests_leaked":0},"status":"keep","description":"Implement bitfieldReverse (OpBitReverse→reversebits) + 5 bit op tests. 510/510 HLSL, 213/222 conformance, 0 failures.","timestamp":1778390667965,"segment":80,"confidence":3.1715481171548117,"asi":{"findings":"Implemented bitfieldReverse GLSL builtin → SPIR-V OpBitReverse (opcode 204) → HLSL reversebits(). Added IR tag bit_reverse, spirv.zig enum, semantic.zig handler, codegen.zig emitter, spirv_to_hlsl.zig cross-compiler support. Also added tests for bitfieldExtract/bitfieldInsert on uint types (T354, T355) and a combined bit ops test (T353). Had a compilation error due to missing 'else if' clause in the chain — the edit accidentally consumed the 'mix' handler's else-if. Fixed by restoring the else-if chain. 510/510 HLSL, 213/222 conformance.","hypothesis":"Implement bitfieldReverse GLSL builtin and add comprehensive bit operation tests","next_action":"Consider implementing remaining GLSL integer builtins: uaddCarry, usubBorrow (return structs, complex). Or focus on improving HLSL output quality for existing features."}}
{"run":775,"commit":"e567a32","metric":511,"metrics":{"conformance":213,"conformance_double_frees":0,"conformance_leaks":0,"tests_leaked":0},"status":"keep","description":"Fix bitCount/findLSB/findMSB return type: always int for uint input. Remove T350 workaround. Add T356 regression test. 511/511 HLSL.","timestamp":1778391042130,"segment":80,"confidence":3.1147540983606556,"asi":{"findings":"Fixed findMSB/findLSB/bitCount type mismatch: these functions always return int (or ivecN) per GLSL spec, regardless of whether the input is uint or int. The semantic analyzer was using the argument type as the result type, causing findMSB(uint) to return uint instead of int. Fix: (1) Added result_ty override in the function call type inference to force int for these builtins when input is uint. (2) Fixed findMSB dispatch to use arg type (not result type) for FindSMsb/FindUMsb selection. (3) Removed the uint() workaround from T350 test. (4) Added T356 regression test that exercises bitCount+findLSB+findMSB on uint input with int result. 511/511 HLSL, 213/222 conformance.","hypothesis":"Fix findMSB/findLSB/bitCount type mismatch: these builtins must return int regardless of uint input, matching GLSL spec and glslang behavior","next_action":"The bit operation builtins are now correctly typed. Consider implementing remaining GLSL integer builtins or adding more real-world shader tests."}}
{"run":776,"commit":"25998b2","metric":516,"metrics":{"conformance":213,"conformance_double_frees":0,"conformance_leaks":0,"tests_leaked":0},"status":"keep","description":"Add 5 real-world shader tests: MRT, conditional discard, gl_PointSize, integer texture, compute histogram. 516/516 HLSL, 213/222 conformance.","timestamp":1778391515829,"segment":80,"confidence":3.1048387096774195,"asi":{"findings":"Added 5 real-world shader tests: T357 (multiple render targets with layout location 0/1), T358 (conditional discard in branch), T359 (gl_PointSize vertex output with gl_PerVertex block), T360 (integer texture usampler2D with texelFetch), T361 (compute histogram with shared memory + atomicAdd). T359 revealed that gl_PerVertex block output is emitted as 'gl_PerVertex._m0/_m1' instead of proper HLSL semantics — could be improved in the cross-compiler. 516/516 HLSL, 213/222 conformance.","hypothesis":"Add tests for commonly used but untested patterns: MRT, conditional discard, gl_PointSize, integer textures, compute histogram","next_action":"The gl_PerVertex block handling in the HLSL cross-compiler could be improved — member names should map to SV_Position/PSIZE instead of _m0/_m1. Consider implementing proper gl_PerVertex decomposition."}}
{"run":777,"commit":"6baa3cc","metric":516,"metrics":{"conformance":213,"conformance_double_frees":0,"conformance_leaks":0,"tests_leaked":0},"status":"keep","description":"Add foldNegateIntoAddSub pass: FAdd(x,-y)→FSub(x,y), FSub(x,-y)→FAdd(x,y). Eliminates unnecessary FNegate. 516/516 HLSL.","timestamp":1778392153536,"segment":80,"confidence":3.0555555555555554,"asi":{"findings":"Added foldNegateIntoAddSub optimization pass: converts FAdd(x, FNegate(y)) → FSub(x, y) and FSub(x, FNegate(y)) → FAdd(x, y). Runs after eliminateDoubleNegate and before algebraicSimpl in the pipeline. Includes DCE to remove dead FNegate instructions. OpFAdd=129, OpFSub=131, OpFNegate=127. Also handles the commuted case FAdd(-y, x) → FSub(x, y). 516/516 HLSL, 213/222 conformance.","hypothesis":"Add foldNegateIntoAddSub pass to fold FNegate into FAdd/FSub, eliminating unnecessary negation instructions","next_action":"The new pass integrates cleanly into the pipeline. Consider extending to handle SNegate with IAdd/ISub for integer cases, or adding a second round of the pass after constFold for cascading opportunities."}}
{"run":778,"commit":"adcc59a","metric":521,"metrics":{"conformance":213,"conformance_double_frees":0,"conformance_leaks":0,"tests_leaked":0},"status":"keep","description":"Add 5 optimization pipeline regression tests: negate folding, double negate, x-x=0, multi-stage pipeline, matrix multiply. 521/521 HLSL.","timestamp":1778392363868,"segment":80,"confidence":3.035019455252918,"asi":{"findings":"Added 5 regression tests for the optimization pipeline: T362 (foldNegateIntoAddSub: a+(-b)→a-b), T363 (eliminateDoubleNegate: -(-x)→x), T364 (algebraicSimpl x-x=0), T365 (multi-stage pipeline: constFold→foldSelect→foldConstBranches→elimUnreachableBlocks→simplifyTrivialPhi→DCE chain), T366 (matrix multiply chain with perspective division). All 521/521 pass, 213/222 conformance.","hypothesis":"Add regression tests for the optimization pipeline passes to ensure they work correctly on real shader patterns","next_action":"Consider adding tests that verify the optimizations actually reduce SPIR-V output (e.g., comparing instruction counts) rather than just checking compilation succeeds."}}
{"run":779,"commit":"c057d82","metric":526,"metrics":{"conformance":213,"conformance_double_frees":0,"conformance_leaks":0,"tests_leaked":0},"status":"keep","description":"Add 5 game engine shader tests: sampler3D, skeletal animation, ACES tone mapping, particle simulation, chromatic aberration. 526/526 HLSL.","timestamp":1778392678868,"segment":80,"confidence":3.015267175572519,"asi":{"findings":"Added 5 real-world game engine shader pattern tests: T367 (sampler3D volume texture, first 3D texture test, maps to Texture3D), T368 (skeletal animation with bone weights and 64-bone matrix array), T369 (ACES filmic tone mapping function with complex arithmetic), T370 (compute particle simulation with SSBO read/write), T371 (chromatic aberration post-process with directional texture samples). All 526/526 pass, 213/222 conformance.","hypothesis":"Add real-world game engine shader patterns: volume textures, skeletal animation, ACES tone mapping, particle simulation, chromatic aberration","next_action":"The compiler handles all common game engine patterns. Consider adding tessellation shader tests or exploring compute shader patterns like radix sort or image processing."}}
{"run":780,"commit":"b29b06b","metric":526,"metrics":{"conformance":213,"conformance_double_frees":0,"conformance_leaks":0,"tests_leaked":0},"status":"keep","description":"Extend foldNegateIntoAddSub to handle SNegate+IAdd/ISub. Now folds both float and integer negation into add/sub. 526/526 HLSL.","timestamp":1778395742726,"segment":80,"confidence":2.958801498127341,"asi":{"findings":"Extended foldNegateIntoAddSub to also handle SNegate (126) with IAdd (128)/ISub (130), not just FNegate with FAdd/FSub. The pass now handles: IAdd(x, SNegate(y)) → ISub(x, y), IAdd(SNegate(y), x) → ISub(x, y), ISub(x, SNegate(y)) → IAdd(x, y). Unified the float and int paths using a neg_map that tracks {operand, is_float} for each negate result, and matches the negate type to the arithmetic type. 526/526 HLSL, 213/222 conformance.","hypothesis":"Extend foldNegateIntoAddSub to handle SNegate with IAdd/ISub for integer negate folding","next_action":"The pass now handles both float and integer negation folding. Consider adding a test that exercises the integer path specifically, or adding a second round of the pass later in the pipeline after constFold exposes new opportunities."}}
{"run":781,"commit":"7e3dde3","metric":531,"metrics":{"conformance":213,"conformance_double_frees":0,"conformance_leaks":0,"tests_leaked":0},"status":"keep","description":"Add 5 tests: integer negate folding, Reinhard tone mapping, SSAO, push_constant. 531/531 HLSL, 213/222 conformance.","timestamp":1778397500627,"segment":80,"confidence":2.9411764705882355,"asi":{"findings":"Added 5 tests: T372 (integer negate folding: IAdd(x, SNegate(y))->ISub(x, y)), T373 (integer negate with subtraction: ISub(x, SNegate(y))->IAdd(x, y)), T374 (Reinhard tone mapping: hdr/(hdr+1)), T375 (SSAO sampling with constant array kernel, depth texture, noise texture, loop accumulation), T376 (push_constant uniform block with mat4+vec4). All 531/531 pass, 213/222 conformance. The push_constant layout qualifier is correctly handled.","hypothesis":"Add tests for integer negate folding paths and real-world rendering patterns (Reinhard, SSAO, push_constant)","next_action":"The compiler handles all tested patterns. Consider adding a second round of foldNegateIntoAddSub after constFold in the pipeline for cascading opportunities, or explore improving HLSL output for gl_PerVertex blocks."}}
{"run":782,"commit":"8470316","metric":531,"metrics":{"conformance":213,"conformance_double_frees":0,"conformance_leaks":0,"tests_leaked":0},"status":"keep","description":"Add second round of foldNegateIntoAddSub after second constFold for cascading opportunities. 531/531 HLSL.","timestamp":1778397689323,"segment":80,"confidence":2.898550724637681,"asi":{"findings":"Added second round of foldNegateIntoAddSub after the second constFold in the pipeline. This catches negate-into-add/sub opportunities that are exposed after store forwarding and constant folding run. The second round runs at line 248 of codegen.zig, between cf2 (second constFold) and foldConstCompositeExtract2. 531/531 HLSL, 213/222 conformance.","hypothesis":"Add second round of foldNegateIntoAddSub after constFold to catch cascading opportunities","next_action":"The pipeline now runs foldNegateIntoAddSub at two points. Consider whether other passes (algebraicSimpl, eliminateDoubleNegate) would also benefit from a second round."}}
{"run":783,"commit":"3875b7e","metric":531,"metrics":{"conformance":213,"conformance_double_frees":0,"conformance_leaks":0,"tests_leaked":0},"status":"keep","description":"Add second round of algebraicSimpl after second constFold for cascading simplifications. 531/531 HLSL, 213/222 conformance.","timestamp":1778398862166,"segment":80,"confidence":2.857142857142857,"asi":{"findings":"Added second round of algebraicSimpl after second constFold and foldNegateIntoAddSub in the pipeline. This catches new algebraic simplifications (x*0=0, x*1=x, x+0=x, x-x=0, bitwise identities, etc.) that are exposed after store forwarding and constant propagation create new constant operands. The second round runs at line 251 of codegen.zig. 531/531 HLSL, 213/222 conformance.","hypothesis":"Add second round of algebraicSimpl after second constFold to catch cascading algebraic simplification opportunities","next_action":"The pipeline now has two rounds of both algebraicSimpl and foldNegateIntoAddSub. Consider whether a second round of eliminateDoubleNegate would also be beneficial, or focus on adding more meaningful tests."}}
{"run":784,"commit":"67186c5","metric":536,"metrics":{"conformance":213,"conformance_double_frees":0,"conformance_leaks":0,"tests_leaked":0},"status":"keep","description":"Add 5 texture/shader tests: sampler1D, samplerBuffer, samplerCubeArray, dual-source blending, gl_FragCoord. 536/536 HLSL.","timestamp":1778399233176,"segment":80,"confidence":2.8421052631578947,"asi":{"findings":"Added 5 texture/shader tests: T377 (sampler1D → Texture1D, first 1D texture test), T378 (samplerBuffer texelFetch), T379 (samplerCubeArray texture lookup), T380 (dual source blending with layout index=1), T381 (gl_FragCoord screen-space coordinate normalization). All 536/536 pass, 213/222 conformance. sampler1D correctly maps to Texture1D in HLSL.","hypothesis":"Add tests for untested texture types (sampler1D, samplerBuffer, samplerCubeArray) and shader features (dual-source blending, gl_FragCoord)","next_action":"Good texture type coverage now. Consider adding tests for image load/store (image2D write), compute shader atomics on images, or exploring more complex control flow patterns."}}
{"run":785,"commit":"e557bd4","metric":541,"metrics":{"conformance":213,"conformance_double_frees":0,"conformance_leaks":0,"tests_leaked":0},"status":"keep","description":"Add 5 advanced rendering tests: image R/W, bilateral blur, procedural, deferred shading, Sobel edge detect. 541/541 HLSL.","timestamp":1778399369695,"segment":80,"confidence":2.8275862068965516,"asi":{"findings":"Added 5 advanced rendering tests: T382 (image2D read+write in compute), T383 (bilateral blur with nested loops, exp weighting, spatial+range kernel), T384 (shadertoy procedural with sin/cos/atan/length polar coordinates), T385 (deferred shading G-buffer decode with depth-to-position reconstruction, matrix multiply, NdotL lighting), T386 (compute Sobel edge detection with 8 texture samples, sqrt, SSBO write). All 541/541 pass, 213/222 conformance.","hypothesis":"Add advanced rendering pattern tests: image R/W, bilateral blur, procedural shading, deferred shading, Sobel edge detection","next_action":"Excellent coverage of real-world rendering patterns. Consider adding tests for: variance shadow maps, screen-space reflections, temporal anti-aliasing, or exploring more compute shader patterns."}}
{"run":786,"commit":"3d5d002","metric":546,"metrics":{"conformance":213,"conformance_double_frees":0,"conformance_leaks":0,"tests_leaked":0},"status":"keep","description":"Add 5 advanced tests: VSM, SSR, FXAA, radix sort, separable blur. 546/546 HLSL, 213/222 conformance.","timestamp":1778399490316,"segment":80,"confidence":2.912280701754386,"asi":{"findings":"Added 5 advanced rendering/compute tests: T387 (variance shadow map with Chebyshev inequality), T388 (screen-space reflections with ray marching loop), T389 (FXAA edge detection with luminance gradient), T390 (compute radix sort bucket counting with shared memory + atomicAdd), T391 (separable Gaussian blur with configurable direction uniform). All 546/546 pass, 213/222 conformance.","hypothesis":"Add advanced rendering and compute tests: VSM, SSR, FXAA, radix sort, separable blur","next_action":"Excellent coverage of real-world patterns. The compiler handles all tested game engine rendering techniques. Consider exploring more niche GLSL features or adding performance-oriented tests."}}
{"run":787,"commit":"32c90dd","metric":551,"metrics":{"conformance":213,"conformance_double_frees":0,"conformance_leaks":0,"tests_leaked":0},"status":"keep","description":"Add 5 edge case tests: nested struct, textureProj, int div/mod, swizzle chain, boolean logic. 551/551 HLSL.","timestamp":1778399680508,"segment":80,"confidence":3,"asi":{"findings":"Added 5 tests covering GLSL edge cases: T392 (nested struct uniform access with member chains obj.mat.roughness), T393 (textureProj for projected texturing), T394 (integer division/modulo with negate folding), T395 (vec4 swizzle chain optimization v.wxyz.zxyw.yxzw through pipeline), T396 (complex boolean logic with !, &&, ||, ternary). All 551/551 pass, 213/222 conformance.","hypothesis":"Add edge case tests for nested structs, texture projection, integer arithmetic, swizzle chains, and boolean logic","next_action":"551 tests with comprehensive coverage. Consider adding tests for: layout qualifiers (row_major, column_major), readonly/writeonly buffer restrictions, or more complex loop patterns (while with break, do-while with continue)."}}
{"run":788,"commit":"513824f","metric":556,"metrics":{"conformance":213,"conformance_double_frees":0,"conformance_leaks":0,"tests_leaked":0},"status":"keep","description":"Add 5 tests: while/break, do-while/continue, matrix ops, const array, function chain. 556/556 HLSL.","timestamp":1778399844805,"segment":80,"confidence":3.068592057761733,"asi":{"findings":"Added 5 more tests: T397 (while loop with break), T398 (do-while with continue), T399 (matrix scalar/add/multiply operations), T400 (const array initializer with indexing), T401 (chained function calls f→g→h). All 556/556 pass, 213/222 conformance.","hypothesis":"Add control flow and function chain tests: while/break, do-while/continue, matrix ops, const arrays, function chains","next_action":"556 tests. The compiler handles all GLSL control flow patterns (for, while, do-while, break, continue, switch). Consider testing more unusual patterns or focusing on optimization quality."}}
{"run":789,"commit":"cd8dac9","metric":561,"metrics":{"conformance":213,"conformance_double_frees":0,"conformance_leaks":0,"tests_leaked":0},"status":"keep","description":"Add 5 tests: row_major, readonly/writeonly buffers, uint bitmask, early return, mat3 construction. 561/561 HLSL.","timestamp":1778400085571,"segment":80,"confidence":3.0714285714285716,"asi":{"findings":"Added 5 tests: T402 (row_major layout qualifier on uniform buffer), T403 (readonly/writeonly buffer qualifiers in compute), T404 (uint bitwise shift+mask for RGBA unpacking), T405 (early return from nested if-else function), T406 (mat3 construction from 3 vec3 columns). All 561/561 pass, 213/222 conformance.","hypothesis":"Add tests for layout qualifiers, buffer access qualifiers, bitwise operations, early returns, and matrix construction","next_action":"561 tests with comprehensive coverage. The compiler handles row_major, readonly/writeonly, uint bitwise ops, early returns, and mat3 construction correctly."}}
{"run":790,"commit":"cf873df","metric":566,"metrics":{"conformance":213,"conformance_double_frees":0,"conformance_leaks":0,"tests_leaked":0},"status":"keep","description":"Add 5 tests: non-square matrices (mat4x3, mat3x2), vec*mat, layout offset, texture bias. 566/566 HLSL.","timestamp":1778400874800,"segment":80,"confidence":3.1636363636363636,"asi":{"findings":"Added 5 tests: T407 (mat4x3 * vec4 non-square matrix multiply), T408 (mat3x2 * vec3 non-square), T409 (vec4 * mat4 row-vector convention), T410 (layout offset qualifier on uniform block members), T411 (texture with bias parameter). All 566/566 pass, 213/222 conformance.","hypothesis":"Add tests for non-square matrices, vector-matrix multiply, layout offset, and texture bias","next_action":"566 tests. Non-square matrices and vector-matrix multiply work correctly. Consider testing mat2 operations, textureLodOffset, or complex nested loops with multiple break/continue paths."}}
{"run":791,"commit":"d9d950b","metric":571,"metrics":{"conformance":213,"conformance_double_frees":0,"conformance_leaks":0,"tests_leaked":0},"status":"keep","description":"Add 5 tests: mat2 ops, textureLodOffset, nested loops, switch/default, type conversions. 571/571 HLSL.","timestamp":1778401029303,"segment":80,"confidence":3.1884057971014492,"asi":{"findings":"Added 5 tests: T412 (mat2 construction and transpose), T413 (textureLodOffset with explicit LOD and texel offset), T414 (nested loop with both break and continue in inner/outer loops), T415 (switch with case/default/break), T416 (int->uint->float->int type conversion chain). All 571/571 pass, 213/222 conformance.","hypothesis":"Add tests for mat2 operations, textureLodOffset, nested loops with break+continue, switch/default, and type conversion chains","next_action":"571 tests. The compiler handles all tested GLSL patterns. Consider testing: textureGradOffset, sampler2DMS sample operations, or more compute patterns like reduce/scan."}}
