{"run":395,"commit":"827deaf","metric":7415,"metrics":{},"status":"keep","description":"Algebraic simplification: 7415 bound (-5 from 7420). 199/199 spirv-val. Eliminates identity operations: FAdd(x,0)→x, FSub(x,0)→x, FMul(x,1)→x, IAdd(x,0)→x, IMul(x,1)→x. Handles vector forms via ConstantComposite propagation.","timestamp":1777796580563,"segment":69,"confidence":22.333333333333332,"asi":{"hypothesis":"Algebraic simplification at SPIR-V binary level: eliminate identity operations like FAdd(x, 0) → x, FSub(x, 0) → x, FMul(x, 1) → x, IAdd(x, 0) → x, IMul(x, 1) → x. Handles scalar and vector forms via ConstantComposite propagation.","savings":"7420→7415 (-5 IDs). struct.flatten.vert gap: FAdd(x, vec4(0,0,0,0)) → x, then cascading DCE removes the zero constant composite.","spirv-opt_gap":"Now ~37 IDs across 10 shaders"}}
{"run":396,"commit":"827deaf","metric":7415,"metrics":{},"status":"discard","description":"Attempted uninitialized variable elimination — memory corruption from recursive DCE+DSE chain. Reverted. Still 7415, 199/199.","timestamp":1777797944381,"segment":69,"confidence":16.75,"asi":{"hypothesis":"Uninitialized variable elimination: remove function-local vars that are loaded but never stored to, when all loads feed only OpStore instructions.","results":"FAILED: memory corruption (invalid free) from complex ownership in recursive deadCodeElim→DSE chain. The use-analysis also had a bug matching literal operands as ID references (e.g., OpTypeVector element count 4 matching ID 4). Fixed the operand scanning but the memory management issue persisted.","rollback_reason":"Memory corruption from ownership issues in recursive DCE+DSE. Not worth the 3-ID savings in one shader.","next_action_hint":"The remaining gaps are mostly function inlining (37 IDs). Non-inlining gaps: loop-dominator +3 (uninit var), torture-loop +1 (cross-block store fwd), 8BitAccess +1 (dead store to Private). All require complex analysis."}}
{"run":397,"commit":"0eebd6c","metric":7402,"metrics":{},"status":"keep","description":"Cross-block entry-store forwarding + Private var DSE: 7402 bound (-13 from 7415). 199/199 spirv-val. Forward function-local vars stored once in entry block. Extend dead store elim to Private storage class.","timestamp":1777799203111,"segment":69,"confidence":14.05,"asi":{"hypothesis":"Two optimizations: (1) Extend dead store elim to Private (6) storage class variables. (2) Cross-block entry-store forwarding: for function-local vars stored exactly once in entry block with no AccessChain/CopyMemory/ExtInst/FunctionCall uses, replace all loads with the stored value.","savings":"7415→7402 (-13 IDs). torture-loop.comp: cross-block forwarding eliminated 2 function-local vars + 2 loads + 2 stores + 2 types (-2 IDs from forwarding, rest from cascading DCE). 8BitAccess.comp: Private var dead store elim removed store + OpSConvert + int type + int_2 constant.","spirv-opt_gap":"46 IDs across 8 shaders (was 48 across 10). Closed torture-loop.comp and 8BitAccess.comp gaps."}}
{"run":398,"commit":"0eebd6c","metric":7402,"metrics":{},"status":"discard","description":"Attempted standalone uninit var elimination — correct but 0 IDs saved. All uninit var loads feed non-trivial uses or Output stores. Still 7402, 199/199.","timestamp":1777801509665,"segment":69,"confidence":10.60377358490566,"asi":{"hypothesis":"Uninitialized variable elimination as standalone pass after compactIds, with getOpInfo-based safety checking for ID vs literal operands, and external-facing variable exclusion (Output/StorageBuffer).","results":"PASS: 199/199 spirv-val, 0 mismatches. But saves 0 IDs — all uninit var loads feed into non-store uses (arithmetic, function calls) or stores to Output/StorageBuffer variables. The only case where uninit feeds only stores is loop-dominator-and-switch-default.frag, but that store targets an Output variable.","note":"The uninit var elimination is correct but has no applicable cases. All remaining gaps (46 IDs) are from function inlining (43 IDs) or the uninit-var-to-Output pattern (3 IDs)."}}
{"run":399,"commit":"24429f9","metric":7363,"metrics":{},"status":"keep","description":"Trivial function inlining: 7363 bound (-39 from 7402). 199/199 spirv-val. Inline void functions with no params, single block, no control flow. Closed barriers.comp gap (+11).","timestamp":1777802671564,"segment":69,"confidence":11.851851851851851,"asi":{"hypothesis":"Trivial function inlining: inline void functions with no parameters, single basic block, no OpVariable/OpBranch/OpFunctionCall. Replace OpFunctionCall with function body, remove function definition and OpName.","savings":"7402→7363 (-39 IDs). barriers.comp: closed +11 gap by inlining 11 trivial barrier functions. Also inlined trivial functions in other shaders for additional savings.","spirv-opt_gap":"35 IDs across 7 shaders (was 46 across 8). Closed barriers.comp gap entirely."}}
{"run":400,"commit":"24429f9","metric":7363,"metrics":{},"status":"discard","description":"Attempted extended function inlining (params + return values) — 16 failures from result ID clashes. Reverted to simple void/no-params inlining. Still 7363, 199/199.","timestamp":1777803640816,"segment":69,"confidence":10.847457627118644,"asi":{"hypothesis":"Extend function inlining to handle functions with parameters and return values. Copy body with param→arg substitution via getOpInfo-based ID replacement.","results":"FAILED: 16 spirv-val failures. The inlined body has result IDs (intermediate computations) that clash with existing IDs in the caller. Need to rename ALL result IDs in the inlined body to fresh IDs.","rollback_reason":"Result ID clashes between inlined body and caller context. Need proper ID renaming (allocate fresh IDs for all inlined result IDs and update all references).","next_action_hint":"Function inlining with parameters requires: (1) allocate fresh IDs for all result IDs in the body, (2) build a rename map for all body-defined IDs, (3) apply both param→arg AND old_id→new_id replacements. This is a significant change. The simpler void/no-params inlining saved 39 IDs and is stable."}}
{"run":401,"commit":"039a76d","metric":7235,"metrics":{},"status":"keep","description":"Extended function inlining with ID renaming: 7235 bound (-128 from 7363). 199/199 spirv-val. Inline single-block functions with params and/or return values using fresh ID allocation for body result IDs.","timestamp":1777804894335,"segment":69,"confidence":14,"asi":{"hypothesis":"Extend function inlining to handle functions with parameters and return values using fresh ID allocation. Body result IDs are renamed to fresh IDs allocated from the bound to avoid clashes with caller context.","results":"7235 total_bound (-128 from 7363). 199/199 spirv-val, 0 mismatches. Savings across 14 shaders from inlining single-block functions with params and/or return values.","biggest_savings":"separate-sampler-texture-array +20, generate_height +14, ground.frag +13, separate-sampler-texture +13","spirv-opt_gap":"Still 35 IDs across 7 shaders — gap shaders have multi-block functions that need control flow inlining.","key_implementation":"Pre-scan body to find result IDs (fixed=2: word[pos+2], fixed=3: word[pos+1]). Allocate fresh IDs from bound. For non-void: map return value to call result. Apply replacement: type IDs preserved, result IDs renamed, operand IDs replaced."}}
{"run":402,"commit":"7a26264","metric":7212,"metrics":{},"status":"keep","description":"Empty-body function inlining + persistent substitution map: 7212 bound (-23 from 7235). 199/199 spirv-val. Inline void/empty-body functions. For non-void with external return values, apply call_result→return_value substitution to subsequent instructions.","timestamp":1777807823495,"segment":69,"confidence":14.952380952380953,"asi":{"biggest_savings":"separate-sampler-texture-array +20, generate_height +14, ground.frag +13, etc. Plus empty-body inlining for extended-subgroup-types (-5) and return-array (-5).","hypothesis":"Handle empty-body functions (body_start == body_end) by allowing them to be inlineable. For void functions, just remove the call. For non-void functions, add call_result → return_value to a persistent substitution map that applies to all subsequent instructions.","implementation":"Changed condition from body_end > body_start to body_end >= body_start. Added persistent sub_map that replaces call_result IDs with resolved return values in all instructions after the inline point. Uses getOpInfo-based applySub helper for correct ID vs literal handling.","next_action_hint":"Remaining 28-ID gap: 25 from multi-block function inlining (partial-write-preserve, read-from-row-major, cfg-preserve-parameter, combined-texture-sampler-shadow, flush_params), 3 from uninit-var-to-Output (loop-dominator). All require multi-block inlining with control flow handling."}}
{"run":403,"commit":"83efb81","metric":7156,"metrics":{},"status":"keep","description":"Iterative inlining with DCE+compact between passes: 7156 bound (-56 from 7212). 199/199 spirv-val. Fix loop break condition — always try next inline, only break when inline itself has no changes. Closed read-from-row-major-array gap (+7).","timestamp":1777808780939,"segment":69,"confidence":17,"asi":{"biggest_savings":"Iterative inlining closed read-from-row-major-array (+7 gap) and saved 56 IDs total across many shaders","gap_reduction":"35→21 IDs, 7→5 shaders. Closed: read-from-row-major-array (+7), extended-subgroup-types (+5). Remaining: partial-write-preserve (+6), cfg-preserve-parameter (+4), combined-texture-sampler-shadow (+4), flush_params (+4), loop-dominator-and-switch-default (+3)","hypothesis":"Iterative inlining with DCE+compactIds between passes. The previous loop broke too early (when DCE had no changes instead of when inline had no changes). The fix: always try the next inline, only break when inline itself has no changes.","implementation":"Changed loop condition from 'break when DCE has no changes' to 'break when next inline has no changes'. Up to 5 iterations. Each iteration: DCE → compactIds → inlineTrivialFuncs. This enables cascading inlining where inlining function A into B makes B inlineable for the next pass."}}
{"type":"config","name":"glslpp SPIR-V bound optimization - Session 4","metricName":"total_bound","metricUnit":"IDs","bestDirection":"lower"}
{"run":403,"commit":"9523fbd","metric":7156,"metrics":{},"status":"keep","description":"Baseline run: 7156 total_bound, 199/199 pass, 0 mismatches","timestamp":1777815030862,"segment":70,"confidence":null,"asi":{"hypothesis":"baseline measurement","total_bound":7156,"total_pass":199,"mismatches":0}}
{"run":404,"commit":"d41e652","metric":7121,"metrics":{},"status":"keep","description":"Inline single-block functions with OpVariable: 7156->7121 (-35 IDs). 199/199 pass, 0 mismatches. Changed 5 shaders.","timestamp":1777817974349,"segment":70,"confidence":null,"asi":{"hypothesis":"Allow inlining of single-block functions with OpVariable by separating has_var from has_call_or_cf, and add moveVarToEntry pass to fix SPIR-V variable ordering","total_bound":7121,"total_pass":199,"mismatches":0,"shaders_changed":"flush_params(-9), modf-pointer-function-analysis(-10), ocean(-4), partial-write-preserve(-8), return-array(-4)","savings":-35}}
{"run":405,"commit":"22c7bbd","metric":7108,"metrics":{},"status":"keep","description":"Redundant load elimination for read-only vars: 7121->7108 (-13 IDs). 199/199 pass, 0 mismatches. CSE loads of Input/UniformConstant/Uniform vars.","timestamp":1777822866254,"segment":70,"confidence":3.6923076923076925,"asi":{"hypothesis":"Eliminate redundant loads of read-only variables (Input, UniformConstant, Uniform). Track first load per var per function, substitute subsequent loads, then DCE.","savings":-13,"shaders_affected":"combined-texture-sampler.vk.frag (-21), ground.vert (-1), modf-pointer-function-analysis.frag (-1), ocean.vert (-1), separate-sampler-texture.vk.frag (-1), shader-arithmetic-8bit.nocompat.vk.frag (-1)","total_bound":7108,"total_pass":199,"mismatches":0}}
{"run":406,"commit":"a5287bb","metric":7093,"metrics":{},"status":"keep","description":"Fold CompositeExtract from CompositeConstruct: 7108->7093 (-15 IDs). 199/199 pass, 0 mismatches.","timestamp":1777823430887,"segment":70,"confidence":4.5,"asi":{"hypothesis":"Fold OpCompositeExtract from OpCompositeConstruct: extract(construct(a,b,...),N) = Nth component. Saves by eliminating extract instruction + cascading DCE.","savings":-15,"total_bound":7093,"total_pass":199,"mismatches":0}}
{"run":407,"commit":"fe859f5","metric":7089,"metrics":{},"status":"keep","description":"Fix OpUndef in getOpInfo + enable elimUninitVars: 7093->7089 (-4 IDs). Root cause: opcode 1 was missing from getOpInfo table, causing compactIds to skip OpUndef and create duplicate IDs.","timestamp":1777825954012,"segment":70,"confidence":4.466666666666667,"asi":{"hypothesis":"Add OpUndef to getOpInfo table + enable elimUninitVars. Root cause: OpUndef (opcode 1) was missing from the opcode table, causing compactIds to skip it and create duplicate IDs.","root_cause":"OpUndef (opcode 1) was not in getOpInfo switch, so compactIds skipped it entirely — not marking its result_id as used, not remapping it. After elimUninitVars introduced OpUndef instructions, the final compactIds would create duplicate IDs.","savings":-4,"total_bound":7089,"total_pass":199,"mismatches":0}}
{"run":408,"commit":"79ea4cb","metric":7087,"metrics":{},"status":"keep","description":"Add DCE after elimUninitVars: 7089->7087 (-2 IDs). Removes dead pointer types. 199/199 pass.","timestamp":1777826576332,"segment":70,"confidence":5.52,"asi":{"hypothesis":"Add DCE after elimUninitVars to clean up dead pointer types left by variable removal","savings":-2,"total_bound":7087,"total_pass":199,"mismatches":0}}
{"type":"config","name":"glslpp SPIR-V bound optimization - Session 5","metricName":"total_bound","metricUnit":"IDs","bestDirection":"lower"}
{"run":409,"commit":"366bf30","metric":7084,"metrics":{},"status":"keep","description":"AccessChain CSE within basic blocks: 7087->7084 (-3 IDs). 199/199 pass. Deduplicate OpAccessChain instructions with same (type, base, indices) within the same basic block. Fixed dominance violation by using per-block instead of per-function scope.","timestamp":1777830667260,"segment":71,"confidence":null,"asi":{"hypothesis":"CSE duplicate OpAccessChain within same basic block","savings":-3,"total_bound":7084,"total_pass":199,"bug_fixed":"Initial per-function scope caused dominance violations in multi-block functions (shader-debug-info-line-directives.line.gV.frag). Fixed by resetting dedup state on each OpLabel.","shaders_affected":"ground.vert, separate-sampler-texture-array.vk.frag, shader-debug-info-line-directives.line.gV.frag","remaining_opportunity":"Cross-block AccessChain CSE for constant-index chains into global vars (Uniform/Input/Output) — safe because the pointer value doesn't depend on control flow"}}
{"run":410,"commit":"20f0916","metric":7071,"metrics":{},"status":"keep","description":"Fix elimRedundantLoads storage class values: 7084->7071 (-13 IDs). 199/199 pass. UniformConstant=0 not 2, Input=1, Uniform=2 not 5. Was missing UniformConstant (sampler/texture loads).","timestamp":1777831347364,"segment":71,"confidence":null,"asi":{"bug_fixed":"elimRedundantLoads was checking wrong storage class values: 1 (Input), 2 (Uniform), 5 (CrossWorkgroup) instead of 0 (UniformConstant), 1 (Input), 2 (Uniform). SPIR-V storage class values: UniformConstant=0, Input=1, Uniform=2. The old code was including CrossWorkgroup (5) as read-only while MISSING UniformConstant (0) which is the most common read-only class for sampler/texture variables.","hypothesis":"Fix storage class values in elimRedundantLoads","savings":-13,"shaders_affected":"combined-texture-sampler.vk.frag (-5 loads), separate-sampler-texture-array, separate-sampler-texture, and others with UniformConstant variables","total_bound":7071,"total_pass":199}}
{"run":411,"commit":"c7fa6b0","metric":7061,"metrics":{},"status":"keep","description":"Add OpSampledImage CSE: 7071->7061 (-10 IDs). 199/199 pass. Also renamed cseAccessChains -> cseWithinBlocks since it now handles both AccessChain and SampledImage dedup within basic blocks + entry-block dominance for cross-block dedup.","timestamp":1777831803948,"segment":71,"confidence":2.3,"asi":{"hypothesis":"Add OpSampledImage CSE within blocks: deduplicate OpSampledImage with same (type, image, sampler)","savings":-10,"total_bound":7061,"total_pass":199,"shaders_affected":"separate-sampler-texture.vk.frag, separate-sampler-texture-array.vk.frag, combined-texture-sampler.vk.frag"}}
{"run":412,"commit":"c7fa6b0","metric":7061,"metrics":{},"status":"discard","description":"Attempted OpTypeArray dedup in dedupStructTypes: 0 IDs saved. Dedup works correctly but compactIds already handles dead type IDs. Reverting.","timestamp":1777834275110,"segment":71,"confidence":4.6,"asi":{"hypothesis":"Dedup OpTypeArray in dedupStructTypes pass","results":"OpTypeArray dedup works correctly but saves 0 IDs. The dead type IDs are already removed by compactIds in the later pipeline stage. The duplicates exist because the codegen creates multiple array types with the same element/length, but the existing compactIds pass already removes unused IDs.","next_action_hint":"Look for optimizations that reduce the number of INSTRUCTIONS, not just types. The bound is determined by max(ID), so we need to eliminate instructions that produce result IDs."}}
{"run":413,"commit":"c7fa6b0","metric":7061,"metrics":{},"status":"discard","description":"OpCopyObject elimination: works but 0 IDs saved on benchmark set. Affected shaders (transpose.legacy.vert) are excluded because glslang rejects them. Reverting.","timestamp":1777835163066,"segment":71,"confidence":null,"asi":{"hypothesis":"Eliminate OpCopyObject instructions","results":"OpCopyObject elimination works correctly (transpose.legacy.vert: 73->69, -4 IDs). BUT the shaders with OpCopyObject are NOT in the benchmark's 199 valid shader set because glslang rejects them (e.g. transpose.legacy.vert has layout errors). 0 IDs saved on the 199-shader benchmark.","next_action_hint":"Need to find optimizations that affect the 199 shaders in the benchmark set. The remaining gap requires multi-block function inlining (very complex). Consider looking at codegen-level improvements that reduce instruction count."}}
{"run":414,"commit":"c7fa6b0","metric":0,"metrics":{},"status":"discard","description":"Double pipeline iteration: causes timeouts, reverted. The full pipeline is too expensive to run twice within the 5-second benchmark timeout.","timestamp":1777836170047,"segment":71,"confidence":null,"asi":{"hypothesis ":"Run full optimization pipeline twice to catch cascading opportunities","results":"FAILED: Double pipeline causes timeouts. Some shaders take close to 5 seconds already, doubling the pipeline pushes them over the benchmark timeout.","next_action_hint":"Instead of running the full pipeline twice, try running just the cheap passes twice (DCE, compactIds, elimRedundantLoads, cseWithinBlocks) which are fast."}}
{"run":415,"commit":"c7fa6b0","metric":7061,"metrics":{},"status":"discard","description":"Second round of cheap passes: 0 IDs saved. Pipeline already fully converged. Reverting.","timestamp":1777836380960,"segment":71,"confidence":null,"asi":{"hypothesis":"Run cheap passes (elimRedundantLoads, cseWithinBlocks, foldCompositeExtract, DCE, compactIds) a second time to catch cascading opportunities","results":"0 IDs saved. The pipeline is already fully converged — the first pass catches everything.","next_action_hint":"The only remaining significant gains are from codegen-level changes (emit fewer instructions) or complex transforms like SSA conversion / multi-block inlining."}}
{"run":416,"commit":"cd49324","metric":7047,"metrics":{},"status":"keep","description":"Loop counter to OpPhi conversion: 7061->7047 (-14 IDs). 199/199 pass, 0 mismatches. Convert simple loop counter variables (OpVariable + load/store in loop pattern) to OpPhi (opcode 245). Added OpPhi to getOpInfo table (fixed=2, ops=\"I\") and DCE dead-safe list. Fixed critical bug where OpPhi addition to getOpInfo table merged with OpLoopMerge on same line, breaking ALL structured control flow processing.","timestamp":1777842967531,"segment":71,"confidence":null,"asi":{"hypothesis":"Convert simple loop counter variables (2 stores + 1 load in loop header pattern) to OpPhi, eliminating the variable, its loads, and its stores","savings_breakdown":"12 convertible counters found, expected 36 IDs savings, got 14. Difference likely from pipeline interactions (other passes already eliminated some redundant loads/stores).","bugs_fixed":["OpPhi opcode is 245, NOT 250 (250 is OpBranchConditional)","OpPhi word count is 7 for 2 incoming values (not 8)","Adding opcode 245 to getOpInfo table must be on its own line (not concatenated with 246)","codegen.zig double-free: was freeing 'inlined' twice instead of 'phi'","Must add OpPhi to DCE dead-safe list"],"files_added":"src/loop_counter_phi.zig - standalone pass"}}
