{"run":248,"commit":"291dc51","metric":199,"metrics":{},"status":"keep","description":"Fix struct alignment: compute max member alignment instead of hardcoded 16. Fixes offset calculations for nested structs in std430 buffers. Add cycle detection for self-referential buffer_reference types. 199/199 maintained.","timestamp":1777445050585,"segment":35,"confidence":null,"iterationTokens":77016,"asi":{"delta":"199/199 maintained (was 198 with 1 crash)","hypothesis ":"Compute struct alignment from max member alignment instead of hardcoded 16","key_fix":"1) layoutAlignment(.named) now computes max(member alignment) instead of returning 16. This gives correct std430 offsets for simple structs like {vec2; float}. 2) Added cycle detection via layout_visited set to prevent infinite recursion on self-referential buffer_reference types like Node { Node next; }.","crash_fixed":"buffer-reference.nocompat.vk.comp segfaulted due to infinite recursion in layoutAlignment for self-referential Node type"}}
{"run":249,"commit":"d2cc9f1","metric":199,"metrics":{},"status":"keep","description":"Account for row_major in matrix layout size/stride calculations. mat2x3 row_major std140 stride now correctly 48 (was 32). MatrixStride varies with row/col major in std430. Block-level row_major propagates to member decorations. 199/199 maintained.","timestamp":1777446705853,"segment":35,"confidence":null,"iterationTokens":77016,"asi":{"correctness_fix":"Matrix stride and size now account for row_major: mat2x3 row_major std140 = 3*16=48 bytes (was 2*16=32). Also block-level row_major propagates correctly to member decorations.","delta":"199/199 maintained","hypothesis":"Account for row_major in matrix layout size calculation. In row_major, matCxR has R vectors of size C instead of C vectors of size R.","key_fix":"1) Added default_row_major field to Codegen, set from block-level layout before emitNestedStructLayout. 2) layoutSize for non-square matrices uses matrixRowCount when row_major. 3) emitNestedStructLayout passes default_row_major as initial parent_row_major. 4) MatrixStride computed based on effective vector size (col_major=rows, row_major=cols) with std430 awareness.","known_issue":"Parser nests array dimensions in reverse order: 'mat var[3][4]' becomes array[4](array[3](mat)) instead of array[3](array[4](mat)). Only affects multi-dim array accesses with different indices on each dimension. Most test shaders use [0][0] so it doesn't manifest. Filed as separate fix needed."}}
{"run":250,"commit":"2e46686","metric":199,"metrics":{},"status":"keep","description":"Fix array dimension nesting order: 'type name[A][B]' now correctly produces array(A, array(B, base)) with first dimension as outermost. 199/199 maintained. read-from-row-major-array.vert now matches glslang exactly.","timestamp":1777447290274,"segment":35,"confidence":null,"iterationTokens":77016,"asi":{"correctness_fix":"Array dimension nesting order fixed: 'type name[A][B]' now produces array(A, array(B, base)) matching GLSL semantics. Previously was reversed: array(B, array(A, base)). This affected multi-dim array element access offsets and array strides.","delta":"199/199 maintained","hypothesis":"Fix array dimension nesting in parser so first dimension is outermost array, matching GLSL semantics and glslang output","key_fix":"4 locations in parser.zig (parseVarDecl, parseStructDecl, parseUniformBlock, parseLocalVarDecl) now collect all array dimensions first, then build the type from outermost to innermost by iterating in reverse order","match_glslang":"read-from-row-major-array.vert: ArrayStride, MatrixStride, RowMajor decorations now exactly match glslang output"}}
{"run":251,"commit":"1c67254","metric":199,"metrics":{},"status":"keep","description":"Emit OpMemberDecorate NonWritable/NonReadable on block struct member 0 for readonly/writeonly SSBO blocks, matching glslang. 199/199 maintained.","timestamp":1777448145858,"segment":35,"confidence":null,"iterationTokens":77016,"asi":{"correctness_fix":"Emit OpMemberDecorate NonWritable/NonReadable on block struct member 0 for readonly/writeonly SSBO blocks, in addition to the variable-level decoration. Matches glslang output pattern.","delta":"199/199 maintained","hypothesis":"Add member-level NonWritable/NonReadable decorations to match glslang","key_fix":"Moved member-level decoration emission to end of emitTypesAndConstants (after types are created), since emitted_named_types is empty during emitDecorations. Appended to decoration_section which gets spliced into the annotation section."}}
{"run":252,"commit":"01987ef","metric":199,"metrics":{},"status":"keep","description":"Add Coherent/Restrict/Volatile decoration support: parse coherent/restrict/volatile qualifiers from GLSL, emit OpDecorate on SSBO variables. 199/199 maintained.","timestamp":1777449529578,"segment":35,"confidence":null,"iterationTokens":77016,"asi":{"correctness_fix":"Added Coherent, Restrict, and Volatile decoration support: parse coherent/restrict/volatile qualifiers, emit OpDecorate Coherent/Restrict on SSBO variables. Note: spirv-dis doesn't display Coherent (decoration=0) but it's present in the binary and validated by spirv-val.","delta":"199/199 maintained","hypothesis":"Add Coherent and Restrict decorations to match glslang output for coherent/restrict SSBO qualifiers","key_fix":"1) Added is_coherent, is_restrict, is_volatile to ast.Qualifier packed struct. 2) Parser now handles kw_coherent/kw_restrict setting those fields. 3) Added Coherent=0, Restrict=19, Volatile=22 to spirv.Decoration enum. 4) Codegen emits these decorations on storage_buffer variables.","spirv_dis_issue":"spirv-dis doesn't display OpDecorate with decoration=0 (Coherent) — this is a known spirv-tools issue, not our bug. Verified via binary inspection that decoration=0 is emitted."}}
{"run":253,"commit":"740b8e1","metric":199,"metrics":{},"status":"keep","description":"Emit Coherent/Restrict decorations on image variables (uniform storage class) in addition to SSBO variables. coherent-image.comp now matches glslang. 199/199 maintained.","timestamp":1777449985239,"segment":35,"confidence":null,"iterationTokens":77016,"asi":{"correctness_fix":"Coherent/Restrict decorations now emitted for image variables too (uniform storage class), not just storage_buffer","delta":"199/199 maintained","hypothesis":"Extend Coherent/Restrict emission to image variables which use uniform storage class in our implementation","key_fix":"Changed condition from 'storage_buffer only' to 'storage_buffer or uniform' to cover image variables too"}}
{"run":254,"commit":"c221339","metric":199,"metrics":{},"status":"keep","description":"Add Invariant decoration (18) for invariant-qualified output variables. Fixed wrong decoration value (was 1=Stream, now 18=Invariant). 199/199 maintained.","timestamp":1777450916049,"segment":35,"confidence":null,"iterationTokens":77016,"asi":{"correctness_fix":"Emit Invariant (18) decoration for invariant-qualified output variables. Added is_invariant to Qualifier, kw_invariant handling in parser, and emission in codegen. Initial attempt used wrong decoration value (1 instead of 18) — decoration value 1 is Stream (HLSL) which requires extra operands, causing spirv-val failure.","delta":"199/199 maintained","hypothesis":"Add Invariant decoration for invariant-qualified output variables","key_fix":"Invariant = 18 in SPIR-V spec (not 1). Decoration value 1 is Stream which requires extra operands."}}
{"type":"config","name":"Continue correctness improvements for glslpp GLSL-to-SPIR-V compiler","metricName":"total_pass","metricUnit":"\"\"","bestDirection":"higher"}
{"run":255,"commit":"6309746","metric":199,"metrics":{},"status":"keep","description":"Baseline: 199/199 spirv-val conformance confirmed stable","timestamp":1777451414711,"segment":36,"confidence":null,"iterationTokens":262,"asi":{"hypothesis":"Baseline verification"}}
{"run":256,"commit":"5ac5d05","metric":199,"metrics":{},"status":"keep","description":"Use UniformConstant storage class for sampler/image variables instead of Uniform. Matches SPIR-V spec where opaque types use UniformConstant. 199/199 maintained.","timestamp":1777451823968,"segment":36,"confidence":null,"iterationTokens":4639,"asi":{"correctness_fix":"Image and sampler variables now use UniformConstant storage class (SPIR-V spec) instead of Uniform. Uniform is for UBO/SSBO block variables, UniformConstant is for opaque types (samplers, images).","delta":"199/199 maintained","hypothesis":"Use UniformConstant storage class for sampler/image uniform declarations instead of Uniform","key_fix":"In semantic.zig, uniform_decl now checks ty.isSampler() to decide storage class: uniform_constant for samplers/images, uniform for other uniform types."}}
{"run":258,"commit":"d9e2b7f","metric":199,"metrics":{},"status":"keep","description":"Fix for-loop with empty init/condition/update: parser now always emits 4 children (init, condition, update, body). Fixes 'for (; k < 20; k++)' generating wrong condition. 199/199 maintained.","timestamp":1777456335373,"segment":36,"confidence":null,"iterationTokens":4639,"asi":{"correctness_fix":"Fixed for-loop with empty init: 'for (; k < 20; k++)' now correctly generates SLessThan condition instead of using variable value as branch condition. The parser now always emits 4 children (init/condition/update/body) using empty expr_stmt as placeholder for missing parts. Semantic pass checks for empty children to skip missing parts.","delta":"199/199 maintained","hypothesis":"Fix for-loop code generation when init is empty — parser always emits 4 children, semantic checks for empty placeholders","key_fix":"parseFor always appends 4 children using empty expr_stmt for missing init/condition/update. Semantic uses 'has_init/has_cond/has_update' flags to detect real vs placeholder children."}}
{"run":259,"commit":"8ef11e3","metric":199,"metrics":{},"status":"keep","description":"Add comma-separated variable declarations (int i=1, j=4) via multi_decl AST tag. Variables declared in same statement stay in same scope. Combined with for-loop fix, complex for-loops now work. 199/199 maintained.","timestamp":1777456726423,"segment":36,"confidence":null,"iterationTokens":4639,"asi":{"correctness_fix":"Added comma-separated variable declarations (int i = 1, j = 4;) using new multi_decl AST tag. Unlike block, multi_decl doesn't push/pop scope, so variables remain visible to subsequent statements. Combined with for-loop empty init fix, for-loop-init.frag now generates 90 instructions (was 22).","delta":"199/199 maintained","hypothesis":"Add comma-separated declarations with multi_decl tag that doesn't create a new scope","key_fix":"1) parseLocalVarDecl now handles comma-separated declarations, returning multi_decl node for multiple or single var_decl for one. 2) multi_decl in semantic processes children without pushScope/popScope. 3) This, combined with the for-loop fix, allows complex for-loops like 'for (int i = 1, j = 4; i < 30; i++, j += 4)' to work correctly."}}
{"type":"config","name":"Continue correctness improvements for glslpp compiler","metricName":"total_pass","metricUnit":"","bestDirection":"higher"}
{"run":260,"commit":"7a2e5e0","metric":199,"metrics":{},"status":"keep","description":"Baseline: 199/199 spirv-val conformance confirmed stable","timestamp":1777457074537,"segment":37,"confidence":null,"iterationTokens":83,"asi":{"hypothesis":"Baseline verification"}}
{"run":261,"commit":"74ca351","metric":199,"metrics":{},"status":"keep","description":"Add comma operator for for-loop condition/update. Fix uint post-increment (was using float constant). Add error recovery for for-loop update. 199/199 maintained.","timestamp":1777460378932,"segment":37,"confidence":null,"iterationTokens":83,"asi":{"fix_2":"uint post-increment used float constant instead of int constant. Fixed getConstInt vs getConstFloat check to include .uint type","fix_3":"For-loop update with comma_op (bare expression) needs error recovery to ensure merge label is always emitted","hypothesis":"Add comma operator (,) support for for-loop condition and update expressions","impact":"torture-loop.comp and array-lut-no-loop-variable.frag now compile correctly with comma expressions. torture-loop.comp had a pre-existing uint increment bug exposed by comma expression parsing"}}
{"run":262,"commit":"1e47b7d","metric":199,"metrics":{},"status":"keep","description":"Implement OpSwitch with case labels, SelectionMerge, break support, and fall-through. Fix if_stmt to handle break inside if-then/else blocks (avoid double branch). Add evalConstInt for switch case values. 199/199 maintained.","timestamp":1777462804971,"segment":37,"confidence":null,"iterationTokens":6731,"asi":{"codegen":"Added switch_inst IR tag, OpSwitch (251) opcode in spirv.zig, OpSwitch emission in codegen.zig","correctness":"switch-unreachable-break.frag fixed by checking lastInstructionIsBranch() in if_stmt handler to avoid double branch emission","evalConstInt":"Added helper to evaluate integer literal expressions for switch case values. Currently handles int_literal, uint_literal, and group nodes","fall_through":"Cases without break fall through to next case label. Cases with break branch to merge label. Default case handled.","hypothesis":"Implement proper OpSwitch with case labels, SelectionMerge, break support, and fall-through","if_stmt_fix":"Changed if_stmt to use lastInstructionIsBranch() instead of lastInstructionIsReturn() when deciding to emit branch to merge. This prevents double branch after break inside if-then/else blocks","parser_change":"Case value expression now stored as first child of case block node. Semantic handler skips it when emitting body statements."}}
{"run":263,"commit":"b1aa15c","metric":199,"metrics":{},"status":"keep","description":"Fix uint literal parsing: strip 'u'/'U' suffix before parseInt. Fixes switch case values for uint cases (was always 0). 199/199 maintained.","timestamp":1777463140493,"segment":37,"confidence":null,"iterationTokens":3093,"asi":{"bug":"Parser's parseInt for uint literals like '0u'/'1u' failed silently because std.fmt.parseInt can't handle 'u' suffix. All uint literals had value 0 in AST.","fix":"Strip 'u'/'U' suffix before parseInt. Now switch case values for uint cases are correct (e.g., ENUM_0=0u, ENUM_1=1u now produce 0 and 1).","hypothesis":"Fix uint literal parsing by stripping 'u' suffix before parseInt"}}
{"run":264,"commit":"0bce479","metric":199,"metrics":{},"status":"keep","description":"Implement OpKill for GLSL discard statements. Was silently ignored before. OpKill is now treated as a terminator instruction. 199/199 maintained.","timestamp":1777463594220,"segment":37,"confidence":null,"iterationTokens":3093,"asi":{"before":"discard_stmt was silently ignored - no SPIR-V instruction emitted. Fragment shaders with discard would continue executing after the discard statement.","hypothesis":"Implement OpKill for discard statements","impact":"Fragment shaders using discard now properly terminate the invocation. OpKill is treated as a terminator instruction like return, preventing dead code after discard from executing."}}
{"run":265,"commit":"55e7e8c","metric":199,"metrics":{},"status":"keep","description":"Fix texelFetch Lod image operand mask: use bit 1 (value 2=Lod) instead of bit 0 (value 1=Bias). Also add Lod operand to texelFetch when lod argument present. 199/199 maintained.","timestamp":1777465124738,"segment":37,"confidence":null,"iterationTokens":3093,"asi":{"fix_1":"texelFetch now correctly emits Lod image operand (bit 1 = value 2) instead of Bias (bit 0 = value 1)","hypothesis":"Fix texelFetch Lod image operand mask value","note":"ConstOffset for textureLodOffset/texelFetchOffset requires OpConstantComposite - deferred. Currently offsets are dropped for those functions.","regression_avoided":"2 shaders (complex-expression-in-access-chain.frag, texel-fetch-offset.frag) failed with wrong Bias operand"}}
{"run":266,"commit":"151021e","metric":199,"metrics":{},"status":"keep","description":"Fix SSA variable handling in for-loops (un-SSA all scopes before loop header). Fix if-else dead code suppression (save/restore has_returned). for-loop-init.frag now 10/10 stores. 199/199 maintained.","timestamp":1777466992609,"segment":37,"confidence":null,"iterationTokens":3093,"asi":{"fix_1":"unssaAllScopes: Force un-SSA all SSA variables in all scopes before for-loop header evaluation. This ensures loop conditions see variable loads, not constant init values.","fix_2":"if_stmt has_returned save/restore: When if-body returns, has_returned was being set, causing else-body and post-if code to be skipped. Now we save/restore has_returned so that if-return doesn't suppress else-body or post-if code.","hypothesis":"Fix SSA variable handling in for-loops and if-else dead code suppression","impact":"for-loop-init.frag now produces 10/10 stores (was 6/10). if-else with return in then-body no longer suppresses else-body or subsequent code."}}
{"run":267,"commit":"37f40ab","metric":199,"metrics":{},"status":"keep","description":"Un-SSA all scopes before while/do-while loop evaluation. Fixes while(k<5){k++} using constant instead of variable. 199/199 maintained.","timestamp":1777467548505,"segment":37,"confidence":null,"iterationTokens":3093,"asi":{"hypothesis":"Un-SSA all scopes before while/do-while loop evaluation","impact":"While and do-while loops with SSA variables in parent scopes now correctly use variable loads instead of constant init values in conditions."}}
{"type":"config","name":"Continue correctness improvements for glslpp compiler","metricName":"total_pass","metricUnit":"","bestDirection":"higher"}
{"run":268,"commit":"4dd869f","metric":199,"metrics":{},"status":"keep","description":"Baseline: 199/199 spirv-val conformance confirmed stable","timestamp":1777468190780,"segment":38,"confidence":null,"iterationTokens":3093,"asi":{"hypothesis":"Baseline verification"}}
{"run":269,"commit":"f16e637","metric":199,"metrics":{},"status":"keep","description":"Add coarse/fine derivative functions (dFdxCoarse, dFdyCoarse, fwidthCoarse, dFdxFine, dFdyFine, fwidthFine) with DerivativeControl capability. Fix capability value: DerivativeControl=51 (was incorrectly 28). 199/199 maintained.","timestamp":1777471771976,"segment":38,"confidence":null,"iterationTokens":9237,"asi":{"capabilities_fixed":"Many SPIR-V capability values in spirv.zig were wrong — spirv-dis uses different numbering. DerivativeControl = 51 (was 28=UniformBufferArrayDynamicIndexing). Need to audit other capability values.","hypothesis":"Add dFdxCoarse/dFdyCoarse/fwidthCoarse/dFdxFine/dFdyFine/fwidthFine derivative functions with DerivativeControl capability","new_functions":"6 new derivative functions registered as built-ins. semantic.zig dispatches them via 'which' literal (0-5 for derivative, 0-2 for fwidth). codegen.zig maps to correct SPIR-V opcodes."}}
{"run":270,"commit":"f753c85","metric":199,"metrics":{},"status":"keep","description":"Fix SPIR-V capability enum values: sampled_image_array_dynamic_indexing=29 (was 2), image_cube_array=34 (was 3), sample_rate_shading=35 (was 5), int64=11 (was 34). Verified all other values match spirv-dis. 199/199 maintained.","timestamp":1777472244988,"segment":38,"confidence":null,"iterationTokens":9237,"asi":{"fixed_caps":"Corrected 4 capability values: sampled_image_array_dynamic_indexing=29 (was 2), image_cube_array=34 (was 3), sample_rate_shading=35 (was 5), int64=11 (was 34). Verified all other values match spirv-dis.","hypothesis":"Fix wrong SPIR-V capability enum values that don't match spirv-dis/spirv-val","note":"These wrong values didn't cause test failures because the affected capabilities (ImageCubeArray, SampleRateShading, Int64, etc.) were rarely or never used in the 199 test shaders."}}
{"run":271,"commit":"900e23f","metric":199,"metrics":{},"status":"keep","description":"Add textureQueryLod support (OpImageQueryLod). Passes sampled image (not extracted image) to OpImageQueryLod. Returns vec2. 199/199 maintained.","timestamp":1777473795849,"segment":38,"confidence":null,"iterationTokens":9237,"asi":{"fix":"OpImageQueryLod requires a SampledImage operand, not a bare image. Pass the sampler2d directly instead of extracting the image.","opcode":"ImageQueryLod = 105 (not 87 which is ImageSampleImplicitLod, not 198 which is BitwiseXor)"}}
{"type":"config","name":"Continue correctness improvements for glslpp compiler","metricName":"total_pass","metricUnit":"","bestDirection":"higher"}
{"run":272,"commit":"31112a9","metric":199,"metrics":{},"status":"keep","description":"Baseline: 199/199 spirv-val conformance confirmed stable","timestamp":1777474444949,"segment":39,"confidence":null,"iterationTokens":9237,"asi":{"hypothesis":"Baseline verification"}}
{"type":"config","name":"Array constructor + typesCompatible fix","metricName":"pass_count","metricUnit":"/199","bestDirection":"higher"}
{"run":273,"commit":"a034b7b","metric":199,"metrics":{},"status":"keep","description":"Baseline: array constructor + typesCompatible fixes — 199/199 still passes","timestamp":1777476156447,"segment":40,"confidence":null,"iterationTokens":223,"asi":{"hypothesis":"Array constructor (float[](...)) support and typesCompatible fix for array types"}}
