{"type":"config","name":"Maximize GLSL-to-SPIR-V conformance pass rate","metricName":"total_pass","metricUnit":"","bestDirection":"higher"}
{"run":1,"commit":"9088390","metric":2,"metrics":{"total_compile_error":101,"total_fail":15,"total_hang":79,"total_crash":0,"ref_valid":197,"total_tested":197},"status":"keep","description":"BASELINE: 2 passes out of 197 valid test files (glslangValidator reference). Script now uses glslangValidator to classify files as VALID/INVALID/SKIP, and only tests our compiler against VALID files. Fixed false-positive PASS detection (summary line \"PASS: 0\" was matching grep). Real breakdown: 2 pass, 101 compile_error, 15 spirv-val fail, 79 hangs, 0 crashes.","timestamp":1776972471762,"segment":0,"confidence":null,"iterationTokens":17339,"asi":{"hypothesis":"Establish true baseline with glslangValidator reference filtering","baseline_pass":2,"ref_valid":197,"ref_invalid":136,"ref_skip":20,"breakdown":"2 pass, 101 compile_error, 15 spirv_val_fail, 79 hangs","key_findings":["struct-varying.legacy.frag appears as PASS but has double-free memory corruption - GPA prints error but exits 0","PASS detection was broken: grep matched 'PASS: 0' in summary line, giving ~214 false positives before fix","glslangValidator classification is cached in .zig-cache/ref_classification.txt","Ghostty .glsl files need -S frag/vert flag for glslangValidator classification","common.glsl is include-only, not standalone - added to skip list","Hangs are biggest category (79/197 = 40%), parser infinite loops on unexpected constructs"],"next_action_hint":"Fix hangs first (biggest bang for buck), then compile errors, then spirv-val failures. Phase 1: stability."}}
{"run":2,"commit":"8c42e18","metric":7,"metrics":{"ref_valid":197,"total_compile_error":159,"total_crash":5,"total_fail":26,"total_hang":0,"total_tested":197},"status":"keep","description":"Fix parser hang: synchronize() now consumes r_brace. 79 hangs → 0, 2→7 passes. Root cause: r_brace was a sync point but wasn't consumed, so parseTopLevel() kept failing on the same token forever.","timestamp":1776972966076,"segment":0,"confidence":null,"iterationTokens":17339,"asi":{"breakdown":"7 pass, 159 compile_error, 26 spirv_val_fail, 0 hang, 5 crash out of 197","delta":"+5 pass, +58 compile_error (from hangs converted), -79 hangs, +11 spirv_val_fail, +5 crash","fix":"synchronize() in parser.zig now consumes r_brace instead of returning without advancing. Root cause: parseTopLevel() failed on r_brace, synchronize() saw r_brace and returned without consuming it -> infinite loop","hypothesis":"Fix parser synchronize() r_brace handling to prevent infinite loops","next_action_hint":"Fix 5 crashes (memory corruption), then tackle compile errors"}}
{"run":3,"commit":"ef9207e","metric":9,"metrics":{"ref_valid":197,"total_compile_error":159,"total_crash":0,"total_fail":29,"total_hang":0,"total_tested":197},"status":"keep","description":"Fix struct member double-free: duplicate members in TypeDef. 5 crashes → 0, 7→9 passes.","timestamp":1776973265519,"segment":0,"confidence":3.5,"iterationTokens":17339,"asi":{"breakdown":"9 pass, 159 compile_error, 29 spirv_val_fail, 0 hang, 0 crash","delta":"+2 pass (struct-varying + 1 more), -5 crash, +3 spirv_val_fail","fix":"semantic.zig: duplicate struct members slice in TypeDef instead of sharing with AST. Fixes double-free when both freeTree() and module.deinit() free the same slice.","hypothesis":"Fix double-free by duplicating struct members in semantic collectTopLevel","next_action_hint":"Tackle compile errors - biggest category at 159/197. Look at common patterns causing compile errors."}}
{"run":4,"commit":"6d9adfa","metric":13,"metrics":{"ref_valid":197,"total_compile_error":159,"total_crash":0,"total_fail":25,"total_hang":0,"total_tested":197},"status":"keep","description":"Fix OpEntryPoint interface variables + skip preprocessor directives. 9→13 passes, spirv-val fails 29→25.","timestamp":1776973801358,"segment":0,"confidence":3.6666666666666665,"iterationTokens":17339,"asi":{"breakdown":"13 pass, 159 compile_error, 25 spirv_val_fail, 0 hang, 0 crash","delta":"+4 pass, -4 spirv_val_fail","fix1":"parser.zig: skip pp_version/pp_define/etc tokens at top level, consume version number and profile","fix2":"codegen.zig: add Input/Output global variable IDs to OpEntryPoint operands per SPIR-V spec","hypothesis":"Fix OpEntryPoint interface variables + skip preprocessor directives in parser","next_action_hint":"Continue reducing compile errors. 159/197 still failing. Check common patterns."}}
{"run":5,"commit":"1745f4c","metric":13,"metrics":{"ref_valid":197,"total_compile_error":156,"total_crash":0,"total_fail":28,"total_hang":0,"total_tested":197},"status":"keep","description":"Add uniform_block handling, gl_Position builtin, precision keyword. 13 passes (unchanged), 3 files moved from compile_error to spirv-val fail.","timestamp":1776974071515,"segment":0,"confidence":2.75,"iterationTokens":17339,"asi":{"breakdown":"13 pass, 156 compile_error, 28 spirv_val_fail, 0 hang, 0 crash","changes":"Added uniform_block semantic handling, gl_Position builtin, precision keyword in lexer, skip precision in parser","delta":"same pass, -3 compile_error (moved to spirv_val_fail), +3 spirv_val_fail","hypothesis":"Add uniform_block support, gl_Position builtin, precision keyword handling","next_action_hint":"Uniform blocks produce SPIR-V but fail spirv-val - need Block decoration + member offsets. Focus on spirv-val failures next - many are OpEntryPoint fixed, check remaining ones."}}
{"run":6,"commit":"6fa87d2","metric":13,"metrics":{"ref_valid":197,"total_compile_error":156,"total_crash":0,"total_fail":28,"total_hang":0,"total_tested":197},"status":"keep","description":"RESUME: Re-establish baseline at 13 passes after context limit.","timestamp":1776974333998,"segment":0,"confidence":5.5,"iterationTokens":28606,"asi":{"hypothesis":"Re-establish baseline after context resume","breakdown":"13 pass, 156 compile_error, 28 spirv_val_fail, 0 hang, 0 crash","next_action":"Fix top-level var_decl Function storage class (causes 8 spirv-val failures), then fix sampler2D type encoding, then tackle compile errors"}}
{"run":7,"commit":"87df2a1","metric":18,"metrics":{"ref_valid":197,"total_compile_error":156,"total_crash":0,"total_fail":23,"total_hang":0,"total_tested":197},"status":"keep","description":"Fix top-level var_decl storage class (Private not Function) + fix sampler2D OpTypeSampledImage word count. 13→18 passes.","timestamp":1776987147188,"segment":0,"confidence":4,"iterationTokens":2997,"asi":{"breakdown":"18 pass, 156 compile_error, 23 spirv_val_fail, 0 hang, 0 crash","delta":"+5 pass, -5 spirv_val_fail","fix1":"ir.zig: add private storage class (6). semantic.zig: top-level var_decl uses Private instead of Function storage class","fix2":"codegen.zig: fix OpTypeSampledImage word count 4→3, fix multisampled flag 1→0 for regular 2D textures","hypothesis":"Fix top-level var_decl storage class + sampler type encoding"}}
{"run":8,"commit":"a0197c1","metric":21,"metrics":{"ref_valid":197,"total_compile_error":156,"total_crash":0,"total_fail":20,"total_hang":0,"total_tested":197},"status":"keep","description":"Fix scalar-to-vector splat, GLSL builtin return type inference, float detection for vectors. 18→21 passes.","timestamp":1776987727792,"segment":0,"confidence":4.222222222222222,"iterationTokens":2997,"asi":{"breakdown":"21 pass, 156 compile_error, 20 spirv_val_fail, 0 hang, 0 crash","delta":"+3 pass, -3 spirv_val_fail","fix1":"semantic.zig: scalar-to-vector splat in type_constructor (vec4(1.0) now emits 4 operands)","fix2":"semantic.zig: GLSL builtin return type inferred from first arg (round(vec4)→vec4)","fix3":"semantic.zig: is_float checks include vectors/matrices for binary_op, compound_assign, unary_op"}}
{"run":9,"commit":"c66beaa","metric":21,"metrics":{"ref_valid":197,"total_compile_error":155,"total_crash":0,"total_fail":21,"total_hang":0,"total_tested":197},"status":"keep","description":"Add buffer/SSBO keywords, more GL builtins, texture function handling. 21 passes (unchanged).","timestamp":1776988769262,"segment":0,"confidence":3.8,"iterationTokens":2997,"asi":{"breakdown":"21 pass, 155 compile_error, 21 spirv_val_fail, 0 hang, 0 crash","delta":"same pass, -1 compile_error, +1 spirv_val_fail","changes":"Added texture/buffer/readonly/writeonly/coherent/restrict keywords and handling. Added gl_Layer/gl_ViewportIndex/gl_VertexID/gl_InstanceID builtins.","issue":"Texture functions added but files using them still fail for other reasons. Need to trace actual failure point per file.","next_action_hint":"Add error tracing to identify which pipeline stage fails per file. Focus on top-20 most impactful compile errors."}}
{"run":10,"commit":"94ff4f1","metric":21,"metrics":{"ref_valid":197,"total_compile_error":155,"total_crash":0,"total_fail":21,"total_hang":0,"total_tested":197},"status":"keep","description":"Add stage detection from file extension in runner. 21 passes (unchanged but infrastructure improvement).","timestamp":1776988983927,"segment":0,"confidence":3.4545454545454546,"iterationTokens":2997,"asi":{"breakdown":"21 pass, 155 compile_error, 21 spirv_val_fail","delta":"no change","changes":"runner.zig now detects stage from file extension (.vert→vertex, .comp→compute, else→fragment)","next_action_hint":"Need deeper investigation. Modify compileToSPIRV to report which stage fails (lex/parse/semantic/codegen). Then fix the highest-frequency failure reason."}}
{"run":11,"commit":"7039993","metric":21,"metrics":{"ref_valid":197,"total_compile_error":132,"total_crash":0,"total_fail":44,"total_hang":0,"total_tested":197},"status":"keep","description":"Declare uniform block members as accessible symbols + relax promoteTypes. 155→132 compile errors, 23 files now produce SPIR-V output.","timestamp":1776989357522,"segment":0,"confidence":3.1666666666666665,"iterationTokens":2997,"asi":{"breakdown":"21 pass, 132 compile_error, 44 spirv_val_fail, 0 hang, 0 crash","delta":"same pass, -23 compile_error, +23 spirv_val_fail (moved from error to producing SPIR-V)","fix1":"semantic.zig: uniform_block members now declared as directly accessible symbols","fix2":"semantic.zig: promoteTypes relaxed - handles mat*vec, vec*scalar, falls back to left type","key_insight":"All compile errors are in semantic stage. Relaxed type promotion + uniform block member access unblocks 23 files.","next_action_hint":"The 44 spirv-val failures are close to passes. Many will be OpEntryPoint (now fixed) or undefined IDs from uniform block member access chains not being properly emitted."}}
{"run":12,"commit":"5a9d2eb","metric":22,"metrics":{"ref_valid":197,"total_compile_error":132,"total_crash":0,"total_fail":43,"total_hang":0,"total_tested":197},"status":"keep","description":"Register GL builtins as proper SPIR-V globals. 21→22 passes.","timestamp":1776991120073,"segment":0,"confidence":3.6363636363636362,"iterationTokens":2997,"asi":{"breakdown":"22 pass, 132 compile_error, 43 spirv_val_fail","delta":"+1 pass, -1 spirv_val_fail","fix":"Register GL builtins (gl_Position, gl_FragCoord, gl_FragColor, gl_Layer, gl_ViewportIndex, gl_VertexID, gl_InstanceID) as proper globals with Input/Output storage class, not just symbols. This ensures OpVariable is emitted for them and IDs are defined.","next_action_hint":"22 passes. 132 compile errors remain. The OpIMul %void bug for mat*vec still exists - basic.vert still shows this despite having correct types in semantic analysis. Need to trace why the binary_op gets wrong tag."}}
{"run":13,"commit":"1f5e4f0","metric":22,"metrics":{"ref_valid":197,"total_compile_error":132,"total_crash":0,"total_fail":43,"total_hang":0,"total_tested":197},"status":"keep","description":"Stable at 22 passes after cleanup. Found parser AST issue: binary_op nesting for uMVP expression.","timestamp":1776992629264,"segment":0,"confidence":5,"iterationTokens":2997,"asi":{"breakdown":"22 pass, 132 compile_error, 43 spirv_val_fail, 0 hang, 0 crash","delta":"stable at 22 from last keep","findings":"Debugging basic.vert showed the parser produces a nested binary_op where uMVP's expression analysis returns void. The left child of the outer binary_op is itself a binary_op node, which doesn't match expected AST for 'uMVP * aVertex'. More investigation needed into parser AST structure for assignment expressions. The block_member access chain + storage class fix infrastructure is in place.","next_action_hint":"Dump the AST for basic.vert to understand why uMVP ends up inside nested binary_op. The parser might produce unexpected AST for 'gl_Position = uMVP * aVertex'. Focus on a different area while this is investigated."}}
{"run":14,"commit":"483e72f","metric":22,"metrics":{"ref_valid":197,"total_compile_error":132,"total_crash":0,"total_fail":43,"total_hang":0,"total_tested":197},"status":"keep","description":"Handle in/out interface blocks with proper storage class. 22 passes (unchanged).","timestamp":1776993132093,"segment":0,"confidence":8,"iterationTokens":2997,"asi":{"breakdown":"22 pass, 132 compile_error, 43 spirv_val_fail","delta":"stable","changes":"Parser handles in/out blocks, semantic uses Input/Output storage class based on qualifier","next_action_hint":"Need to investigate why compile errors are so persistent. Maybe add a diagnostic mode to the runner that prints which semantic error occurs. Consider implementing the #include preprocessor to unblock Ghostty shaders."}}
{"run":15,"commit":"28a0b30","metric":24,"metrics":{"ref_valid":197,"total_compile_error":132,"total_crash":0,"total_fail":41,"total_hang":0,"total_tested":197},"status":"keep","description":"Fix critical parser evaluation-order bug. 22→24 passes.","timestamp":1776996591601,"segment":0,"confidence":7.333333333333333,"iterationTokens":2997,"asi":{"breakdown":"24 pass, 132 compile_error, 41 spirv_val_fail, 0 hang, 0 crash","delta":"+2 pass, -2 spirv_val_fail","findings":"Zig 0.15.2 evaluation order issue: 'left = .{ .data = .{ .children = dupeNodes(&.{left, right}) } }' causes left to be read AFTER the assignment corrupts it. makeBinaryOp() helper fixes this by capturing operands in separate const bindings before constructing the node. This affected ALL binary operators in the parser, meaning ALL expressions with 2+ operands were potentially corrupted. This explains the void-type cascade in UBO member access.","hypothesis":"Fix evaluation-order bug in parser binary op creation that corrupts AST nodes","next_action_hint":"The makeBinaryOp fix affects ALL binary expressions. Many spirv-val failures (41) and compile errors (132) may now have different root causes since the AST is correct. Re-examine remaining failures."}}
{"run":16,"commit":"2a1e9c9","metric":25,"metrics":{"ref_valid":197,"total_compile_error":132,"total_crash":0,"total_fail":40,"total_hang":0,"total_tested":197},"status":"keep","description":"Add mat*vec SPIR-V ops + Uniform in OpEntryPoint. 24→25 passes.","timestamp":1776998224915,"segment":0,"confidence":7.666666666666667,"iterationTokens":6760,"asi":{"breakdown":"25 pass, 132 compile_error, 40 spirv_val_fail","delta":"+1 pass, -1 spirv_val_fail","findings":"Uniform storage class globals must also be listed in OpEntryPoint interface list. Also added MatrixTimesVector/VectorTimesMatrix/MatrixTimesMatrix for proper mat*vec multiplication.","hypothesis":"Add mat*vec ops and Uniform storage class to OpEntryPoint interface list","next_action_hint":"Check remaining 10 FMul errors (some might now be fixed by mat_vec ops). Then tackle 'block must end with branch' (5 files) and 'Result Type int or float vector' (4 files)."}}
{"run":17,"commit":"6ca5d19","metric":27,"metrics":{"ref_valid":197,"total_compile_error":132,"total_crash":0,"total_fail":38,"total_hang":0,"total_tested":197},"status":"keep","description":"Handle vec*scalar and scalar*vec multiplication. 25→27 passes.","timestamp":1776999210714,"segment":0,"confidence":8.333333333333334,"iterationTokens":6760,"asi":{"breakdown":"27 pass, 132 compile_error, 38 spirv_val_fail","delta":"+2 pass, -2 spirv_val_fail","findings":"scalar*vec and vec*scalar must use OpVectorTimesScalar (not FMul). For scalar*vec, operands must be swapped so vector is first. Also handles compound_assign mul_assign case.","hypothesis":"Handle vec*scalar and scalar*vec multiplication correctly","next_action_hint":"Continue reducing spirv-val failures: 5 'block must end with branch', 4 'Result Type int or float vector'. Also start looking at compile errors more systematically."}}
{"run":19,"commit":"afe1f19","metric":38,"metrics":{"ref_valid":197,"total_compile_error":115,"total_crash":0,"total_fail":44,"total_hang":0,"total_tested":197},"status":"keep","description":"Add #extension support + fix block comments. 29→38 passes.","timestamp":1777006196674,"segment":0,"confidence":9,"iterationTokens":8405,"asi":{"breakdown":"38 pass, 115 compile_error, 44 spirv_val_fail","delta":"+9 pass, -17 compile_error","findings":"51 of 132 compile errors were lex failures! Two root causes: (1) #extension directive not recognized by lexer → InvalidToken error. (2) Block comment parser used nesting (GLSL doesn't nest block comments). Fixing both recovered 51 lex failures, though 34 moved to other error categories (parse/semantic). Adding pp_extension token + directive map entry fixed the #extension issue. Removing nesting from parseBlockComment fixed the comment issue. Also added diagnostic output to categorize errors by stage (lex_failed vs semantic_failed).","hypothesis":"Fix lexer failures: #extension and block comment nesting","next_action_hint":"Re-categorize remaining 115 compile errors. Many lex failures may now be parse or semantic errors. Also check the 8 new spirv-val failures."}}
{"run":20,"commit":"bddf455","metric":38,"metrics":{"ref_valid":197,"total_compile_error":115,"total_crash":0,"total_fail":44,"total_hang":0,"total_tested":197},"status":"keep","description":"Add compute builtins + local_size + BuiltIn decorations. 38 passes (unchanged).","timestamp":1777008535465,"segment":0,"confidence":7.2,"iterationTokens":1149,"asi":{"breakdown":"38 pass, 115 compile_error, 44 spirv_val_fail","delta":"stable at 38","findings":"Added compute shader builtins and LocalSize support, but files using them still fail at semantic for other reasons (missing atomicAdd, buffer block member access, etc.). The new BuiltIn decoration emission was needed but gl_Layer/gl_ViewportIndex broke things by requiring Geometry capability. Had to disable those. The diagnostics show all 115 remaining compile errors are semantic_failed.","hypothesis":"Add compute builtins and local_size_x layout parsing","next_action_hint":"Focus on reducing the 115 semantic errors. Need to understand what specific semantic features are missing. Try adding a function that returns specific error messages from semantic analysis."}}
{"run":21,"commit":"920cef2","metric":38,"metrics":{"total_compile_error":115,"total_crash":0,"total_fail":44,"total_hang":0,"ref_valid":197,"total_tested":197},"status":"keep","description":"Add vector-to-vector conversion. 38 pass, fixes 2 spirv-val Constituents errors.","timestamp":1777013448981,"segment":0,"confidence":6,"iterationTokens":1149,"asi":{"delta":"38 pass (unchanged)","findings":"Constituents error fixed - vec4(ivec4) uses ConvertSToF now","hypothesis":"Fix vec4(ivec4) splat","next_action_hint":"Focus on interface variable listing errors"}}
{"run":22,"commit":"12b0d3d","metric":45,"metrics":{"total_compile_error":116,"total_crash":0,"total_fail":36,"total_hang":0,"ref_valid":197,"total_tested":197},"status":"keep","description":"Fix uniform block parsing + access chain constant indices. 38→45 passes (+7).","timestamp":1777017418241,"segment":0,"confidence":6.615384615384615,"iterationTokens":1149,"asi":{"delta":"+7 passes (38→45)","findings":"Two critical fixes: (1) uniform block parsing was broken because tryType() consumed the block name before the { could be detected. Fixed by checking for blocks before tryType(). (2) OpAccessChain requires index operands to be OpConstant IDs, not raw literals. Fixed by using emitIntConstant(). The old synchronize() workaround for uniform blocks accidentally worked but produced wrong storage class. Proper block parsing + access chains is the correct path.","hypothesis":"Fix uniform block parsing and access chain codegen","next_action_hint":"Categorize remaining 36 spirv-val failures and 116 compile errors. The 48 empty-ctx semantic failures likely need specific unhandled AST node types."}}
{"run":23,"commit":"d10a74a","metric":53,"metrics":{"total_compile_error":116,"total_crash":0,"total_fail":28,"total_hang":0,"ref_valid":197,"total_tested":197},"status":"keep","description":"List ALL globals in OpEntryPoint (SPIR-V 1.4+). 45→53 passes (+8).","timestamp":1777018346119,"segment":0,"confidence":7.285714285714286,"iterationTokens":1149,"asi":{"delta":"+8 passes (45→53)","findings":"SPIR-V 1.4+ requires ALL global variables used by entry point to be listed in OpEntryPoint interface list. Previously only Input/Output/Uniform were listed. Private globals were missing.","hypothesis":"List all globals in OpEntryPoint for SPIR-V 1.4+ compliance","next_action_hint":"28 spirv-val failures remain. Top categories: 'block must end with branch' (3), 'Operand requires previous definition' (5), type mismatches, various. Also 116 compile errors to address."}}
