{"run":327,"commit":"bc822d7","metric":0,"metrics":{},"status":"keep","description":"Float64 capability for double tensors → 199/199 pass, 0 mismatches, 0 failures","timestamp":1777652167249,"segment":65,"confidence":3,"asi":{"hypothesis":"Add Float64 capability (value 10) for double tensor types, propagate through tensor_arm payload in typeUsesFloat64","key_fix":"Float64 capability value was 10 (not 6). Also needed to add .tensor_arm => |ta| self.typeUsesFloat64(ta.element.*) to recursively check tensor element types.","result":"199/199 spirv-val pass, 0 total_fail, 0 real_output_mismatches. PERFECT SCORE!"}}
{"type":"config","name":"Phase 4: SPIR-V Output Size Optimization","metricName":"total_bound","metricUnit":"","bestDirection":"lower"}
{"run":328,"commit":"1dc2789","metric":10881,"metrics":{},"status":"keep","description":"BASELINE: Phase 4 total_bound = 10881 across 199 shaders. 199/199 spirv-val, 0 mismatches, 0 failures.","timestamp":1777652755781,"segment":66,"confidence":null,"asi":{"baseline":"10881 total bound across 199 shaders","constraints":"0 mismatches, 199/199 spirv-val, 0 failures","phase":"Phase 4: SPIR-V output size optimization","note":"Previous Phase 1 sessions reduced from ~10033 to ~9783 bound, but new tensor/QCOM/ray-query features added back. Need to find optimization opportunities."}}
{"run":329,"commit":"1dc2789","metric":10881,"metrics":{},"status":"discard","description":"constant_composite dedup + ID compaction attempt → 10881 bound (unchanged), 199/199 pass","timestamp":1777655682060,"segment":66,"confidence":null,"asi":{"attempted":"constant_composite dedup in codegen (works, reduces binary size) + ID compaction (too risky, reverted)","codegen_dedup":"Works — prevents emitting duplicate OpConstantComposite instructions. But bound stays same because IDs are pre-allocated in semantic analysis.","id_compaction":"Attempted but reverted — would require full opcode table for correct ID position identification. Simple approaches break the binary.","bound":"10881 unchanged. Binary is slightly smaller but bound metric doesn't capture this.","next":"ID compaction is the right approach but needs proper opcode table. Alternative: dedup at semantic level before ID allocation. Or track a different metric (binary size instead of bound)."}}
{"run":330,"commit":"1dc2789","metric":10834,"metrics":{},"status":"discard","description":"Load caching → 10834 bound (-0.4%) but MASSIVE regression: 198/199 fail. Reverted.","timestamp":1777656994703,"segment":66,"confidence":null,"asi":{"attempted":"Load caching within basic blocks — reuse OpLoad results when same ptr is loaded twice without intervening stores","result":"MASSIVE regression: 198/199 shaders fail. The constant_alias approach breaks because subsequent instructions reference the original result_id which now points to a different type/value.","root_cause":"Load caching via constant_alias is unsafe. The aliasing changes the result_id mapping globally, affecting all references. It's not just about eliminating the OpLoad instruction — the result_id is used by other instructions that expect it to have specific properties.","bound_impact":"10881 → 10834 (-0.4%) on passing shaders, but too many regressions","next":"Load caching is too aggressive without proper alias analysis. Consider simpler optimizations: avoid emitting OpLoad for SSA variables (stored once, loaded once)."}}
{"run":331,"commit":"6cb1b25","metric":10881,"metrics":{},"status":"keep","description":"Phase 4 exploration: tried 3 optimization approaches, all insufficient or too risky. Baseline 10881 stable.","timestamp":1777657367950,"segment":66,"confidence":null,"asi":{"hypothesis":"Phase 4 optimization: tried constant_composite dedup, ID compaction, load caching — all insufficient or too risky","status":"Phase 4 is challenging. Bound metric requires preventing ID allocation, not just skipping instruction emission. Semantic-level dedup and ID compaction are the right approaches but both are complex.","best_attempt":"Load caching achieved 10834 (-0.4%) but caused massive regression","baseline":"10881 total bound, 199/199 pass, 0 mismatches"}}
{"run":332,"commit":"3f14155","metric":10572,"metrics":{},"status":"keep","description":"Semantic-level constant composite dedup → 10572 bound (-309, -2.8%), 199/199 pass, 0 mismatches","timestamp":1777659027613,"segment":66,"confidence":null,"asi":{"hypothesis":"Semantic-level constant composite dedup: check cache before creating constant_composite instructions. Use getConstInt/getConstFloat for element constants and constCompositeKey for composite cache key. When duplicate found, return existing result_id without allocating new IDs.","key_changes":"1) Added const_composite_cache HashMap(u64,u32) to Analyzer. 2) Added constCompositeKey helper. 3) Modified 4 direct constant_composite creation sites to check cache first. 4) Modified tryUpgradeToConstantComposite to cache results. 5) Use getConstInt/getConstFloat instead of allocId+append for element constants.","result":"10881 → 10572 bound (-309, -2.8%). 199/199 spirv-val, 0 mismatches. The dedup prevents allocating IDs for duplicate composites like ivec2(1,5) appearing 16x in atomic.comp.","safety":"Uses getConstInt/getConstFloat which handle dedup of element constants. Cache key is hash of (type_enum, operand_ids). Returns existing result_id on cache hit — callers use returned id for subsequent references."}}
{"run":333,"commit":"3aa9775","metric":10355,"metrics":{},"status":"keep","description":"AccessChain caching within basic blocks → 10355 bound (-526, -4.8%), 199/199 pass, 0 mismatches","timestamp":1777661256805,"segment":66,"confidence":22.382978723404257,"asi":{"hypothesis":"AccessChain caching within basic blocks: AccessChains are pure pointer arithmetic, so same (base, indices) always produces same pointer. Cache within each basic block (cleared at label boundaries to respect SPIR-V dominance rules). Combined with semantic-level constant composite dedup from previous run.","key_changes":"1) Added access_chain_cache HashMap to Analyzer. 2) emitAccessChainCached helper computes key from (base_id, operands) and returns cached result_id on hit. 3) Cache cleared at emitLabel (block boundaries) and analyzeFunction (function boundaries) to respect dominance. 4) Replaced 7 direct AccessChain creation sites with cached version.","result":"10881 → 10355 bound (-526, -4.8%). Combined with const composite dedup: 10881 → 10572 → 10355. 199/199 spirv-val, 0 mismatches.","dominance_fix":"Initial version without cache clearing caused dominance violations (ID defined in block A used in block B). Fix: clear cache at each emitLabel call, which marks basic block boundaries."}}
{"run":334,"commit":"a4d80cc","metric":10187,"metrics":{},"status":"keep","description":"Load caching within basic blocks → 10187 bound (-694 total from baseline), 199/199 pass","timestamp":1777663071543,"segment":66,"confidence":14.76595744680851,"asi":{"hypothesis":"Load caching within basic blocks: reuse OpLoad results when same pointer is loaded multiple times. Cache invalidated at: block boundaries (emitLabel), function boundaries (analyzeFunction), and before every store instruction. This is safe because loads within a basic block without intervening stores produce the same value.","key_changes":"1) Added load_cache HashMap(u32, u32) mapping ptr_id -> loaded_value_id. 2) emitLoadCached helper checks cache before emitting load. 3) Cache cleared at emitLabel, analyzeFunction, and before every store. 4) Replaced all 20 load emission sites with emitLoadCached. 5) Combined with AccessChain caching and constant composite dedup.","result":"10881 → 10187 bound (-694, -6.4%). Combined with all optimizations: 10881 → 10572 → 10355 → 10187. 199/199 spirv-val, 0 mismatches.","pitfalls":"1) Must clear load_cache at function boundaries (cross-function caching caused dominance violations). 2) Must clear at block boundaries. 3) Must clear before stores. 4) The emitLoadCached function body must use raw load, not recursive call (regex accidentally replaced it)."}}
{"run":335,"commit":"8099743","metric":10175,"metrics":{},"status":"keep","description":"Pure op CSE for composite_extract → 10175 bound (-706 total from baseline), 199/199 pass","timestamp":1777664243734,"segment":66,"confidence":3.966292134831461,"asi":{"hypothesis":"Pure operation CSE (Common Subexpression Elimination) within basic blocks. Cache results of pure ops like OpCompositeExtract by (type, tag, operands). Deduplicate identical extract operations within the same block.","result":"10187 → 10175 (-12 IDs). Modest improvement — composite_extract dedup doesn't save many IDs because most shaders don't have repeated identical extracts. The main savings come from ground.vert where OpCompositeExtract %float %227 0 was repeated 3 times.","combined_optimizations":"All 4 optimizations together: 10881 → 10175 (-706 IDs, -6.5%). 199/199 spirv-val, 0 mismatches.","next":"Consider extending pure_op cache to transpose, vector_shuffle, arithmetic ops. Or try a different approach like dead code elimination or type dedup."}}
{"run":336,"commit":"7662e93","metric":10037,"metrics":{},"status":"keep","description":"Targeted store invalidation → 10037 bound (-844 total from baseline, -7.8%), 199/199 pass","timestamp":1777678428772,"segment":66,"confidence":2.7313915857605178,"asi":{"hypothesis":"Targeted store invalidation: instead of clearing the entire load_cache on every store, only remove the specific stored-to pointer from the cache. Stores to output variables don't affect loads from uniform/input pointers, so those cached loads survive across output stores. Pure op cache is NOT cleared on stores (pure ops don't depend on memory).","key_changes":"1) emitStore: replace clearRetainingCapacity() with remove(ptr_id). 2) All 13 inline store sites: same change — _ = self.load_cache.remove(ptr_id). 3) pure_op_cache only cleared at emitLabel and analyzeFunction (block/function boundaries).","result":"10175 → 10037 bound (-138 IDs, -1.3%). Combined total: 10881 → 10037 (-844 IDs, -7.8%). 199/199 spirv-val, 0 mismatches.","safety":"Only invalidates cache for the specific stored-to pointer. Other cached loads remain valid. Block/function boundaries still fully clear all caches."}}
{"run":337,"commit":"dac11b6","metric":10009,"metrics":{},"status":"keep","description":"Vector shuffle dedup via emitPureOp → 10009 bound (-872 total from baseline, -8.0%), 199/199 pass","timestamp":1777680355641,"segment":66,"confidence":2.213197969543147,"asi":{"hypothesis":"Convert vector_shuffle emission sites to use emitPureOp for dedup within basic blocks. Vector shuffle is a pure operation - same inputs always produce same output. Combined with targeted store invalidation from previous commit.","key_changes":"1) Converted all 5 vector_shuffle emission sites to use emitPureOp. 2) Moved allocId after type computation in swizzle write handler. 3) emitPureOp deduplicates by (tag, type, operands) key.","result":"10037 → 10009 bound (-28 IDs). Combined total: 10881 → 10009 (-872 IDs, -8.0%). 199/199 spirv-val, 0 mismatches.","note":"Transpose dedup was also attempted but doesn't reduce bound because result_id is pre-allocated in the function call handler. Would need to check cache before allocId."}}
{"run":338,"commit":"1052262","metric":9997,"metrics":{},"status":"keep","description":"ImageTexelPointer dedup via emitPureOp → 9997 bound (-884 total, -8.1%), 199/199 pass","timestamp":1777680597743,"segment":66,"confidence":2.554913294797688,"asi":{"hypothesis":"Convert image_texel_pointer to emitPureOp for dedup. ImageTexelPointer is pure (same image + coord = same pointer).","result":"10009 -> 9997 bound (-12 IDs). Combined: 10881 -> 9997 (-884 IDs, -8.1%). 199/199 spirv-val, 0 mismatches.","combined_optimizations":"1) Constant composite dedup (-309), 2) AccessChain caching (-217), 3) Load caching (-168), 4) Targeted store invalidation (-138), 5) Pure op CSE: composite_extract (-12), vector_shuffle (-28), image_texel_pointer (-12)"}}
{"run":339,"commit":"479cdd0","metric":9961,"metrics":{},"status":"keep","description":"Cross-block load caching for global pointers → 9961 bound (-920 total, -8.5%), 199/199 pass","timestamp":1777682011356,"segment":66,"confidence":3.2,"asi":{"hypothesis":"Cross-block load caching for global pointers. Input/Uniform/Output variable loads can be cached across block boundaries because their values don't change within a shader invocation. Only cache from the entry block (which dominates all blocks) to avoid dominance violations.","key_changes":"1) Added global_load_cache HashMap (persists across blocks, cleared at function boundaries). 2) Added global_ptr_ids set tracking Input/Uniform/Output variable IDs and their AccessChain results. 3) Added in_entry_block flag — only cache in global_load_cache from the entry block. 4) Modified emitLoadCached to check/populate global_load_cache for global pointers.","result":"9997 -> 9961 bound (-36 IDs). Combined: 10881 -> 9961 (-920 IDs, -8.5%). 199/199 spirv-val, 0 mismatches.","pitfalls":"1) Must only cache from entry block — caching from conditional blocks causes dominance violations (ID defined in one branch doesn't dominate the merge block). 2) global_ptr_ids includes AccessChain results into globals, but AccessChain cache is cleared at labels so ptr_ids change per block — only global variable IDs are consistent."}}
{"run":340,"commit":"49364dc","metric":9961,"metrics":{},"status":"keep","description":"Transpose pre-check in GLSL builtin handler (correct but no bound reduction), 199/199 pass","timestamp":1777683408794,"segment":66,"confidence":4.070796460176991,"asi":{"hypothesis":"Transpose pre-check before allocId in GLSL builtin handler. Check pure_op_cache before allocating result_id for transpose.","result":"9961 → 9961 (unchanged). The transpose dedup works correctly (8→4 OpTranspose in transpose.legacy.vert), but the saved IDs are in the middle of the ID range, not at the top. The bound is determined by the max ID, so eliminating intermediate IDs doesn't help.","insight":"Pre-allocation pure op cache checks only reduce bound when the saved IDs are at the TOP of the allocation range. For transpose, the duplicates are interspersed with other allocations, so eliminating them doesn't change the max ID.","dead_code_stats":"49 dead constants, 42 dead loads, 43 dead function calls, 22 dead bitcasts, 12 dead vars across all shaders. These represent wasted allocation but don't reduce bound without ID compaction.","future_directions":"1) ID compaction pass at codegen level (remap IDs to eliminate gaps). 2) Dead code prevention at semantic level (skip unused sub-expressions). 3) More cross-block load caching with dominance analysis."}}
{"run":341,"commit":"0588dad","metric":9953,"metrics":{},"status":"keep","description":"Scalar splat constant composite cache check → 9953 bound (-8, -0.08%), 199/199 pass","timestamp":1777686263416,"segment":66,"confidence":4.218181818181818,"asi":{"hypothesis":"Check const_composite_cache before allocating splat_id in scalar-to-vector splat operations. The splat code was calling allocId() then tryUpgradeToConstantComposite() which populates the cache but never checks it.","result":"9961 → 9953 (-8 IDs, -0.08%). Found 11 duplicate OpConstantComposite instructions across all shaders. Fixed 3 splat sites (left scalar, right scalar, compound assignment splat) to check cache before allocation.","remaining_composites":"11 duplicate OpConstantComposite remain (4 in defer-parens, 1 in ground.frag/vert, 2 in lut-promotion, 1 in ocean.vert, 1 in partial-write-preserve, 1 in separate-sampler-texture, 1 in separate-sampler-texture-array). These might be from unmodified splat sites (runtime values) or other composite creation paths.","false_alarm":"The earlier '1025 waste IDs' analysis was WRONG - it used symbolic disassembly IDs instead of raw numeric IDs. Actual waste is only 49 IDs across all shaders."}}
{"run":342,"commit":"6f6c43a","metric":9951,"metrics":{},"status":"keep","description":"General composite_construct cache check → 9951 bound (-2), 199/199 pass. Reverted struct constructor cache (type hash collision).","timestamp":1777687637112,"segment":66,"confidence":4.345794392523365,"asi":{"hypothesis":"Extend constant composite dedup to more code paths: 1) scalar splat in binary ops (already saved -8), 2) general composite_construct fallback for array constructors, 3) struct constructor path (REVERTED due to type collision)","result":"9953 → 9951 (-2 IDs). Fixed duplicate OpConstantComposite in lut-promotion.frag (2 duplicates → 0) by adding cache check in general composite_construct fallback. Attempted struct constructor cache check but REVERTED: constCompositeKey uses @intFromEnum(ty) which doesn't distinguish different named types with same tag, causing OpStore type mismatch.","key_findings":"1) constCompositeKey hash collision for named types — @intFromEnum(.named) returns same value for all named types regardless of name. Would need to hash the type name string too. 2) The general composite_construct fallback (line ~5000) handles array constructors with all-constant args — adding cache check there catches cross-block duplicates. 3) Remaining 1 duplicate in partial-write-preserve.frag is a cross-FUNCTION struct constant that can't be fixed without better hashing.","total_progress":"10881 → 9951 (-930 IDs, -8.5%), all 9 optimizations combined."}}
{"run":343,"commit":"0b77b02","metric":9950,"metrics":{},"status":"keep","description":"Fix constCompositeKey for named types + struct constructor cache → 9950 bound (-1), 199/199 pass, 0 composite duplicates","timestamp":1777687869721,"segment":66,"confidence":6.045454545454546,"asi":{"hypothesis":"Fix constCompositeKey hash collision for named types by including type name string and array size/base in the hash. Re-enable struct constructor cache check.","result":"9951 → 9950 (-1 ID). The struct constructor cache check now works correctly because constCompositeKey distinguishes different named types. Previously B(10.0, 40.0) and C(10.0, 40.0) had the same hash key.","remaining_duplicates":"0 OpConstantComposite duplicates across all 199 shaders!","total_progress":"10881 → 9950 (-931 IDs, -8.5%), 199/199 pass"}}
{"run":344,"commit":"6a70c63","metric":9935,"metrics":{},"status":"keep","description":"Global AccessChain cache from entry block → 9935 bound (-15), 199/199 pass","timestamp":1777688290712,"segment":66,"confidence":9.27450980392157,"asi":{"hypothesis":"Add global_access_chain_cache that persists AccessChain results from entry block across all blocks in a function. Same pattern as global_load_cache: only populated from entry block (which dominates all blocks), cleared at function boundaries. AccessChains are pure pointer arithmetic - same base + indices always produces the same pointer value.","result":"9950 → 9935 (-15 IDs). The global AccessChain cache prevents duplicate AccessChain computations across blocks for pointers first computed in the entry block.","total_progress":"10881 → 9935 (-946 IDs, -8.7%), 199/199 pass, 0 mismatches"}}
{"run":345,"commit":"45280b8","metric":9894,"metrics":{},"status":"keep","description":"Struct layout dedup in codegen → 9894 bound (-41), 199/199 pass, 0 struct type duplicates","timestamp":1777688934216,"segment":66,"confidence":9.096774193548388,"asi":{"hypothesis":"Add emitted_struct_layouts cache in codegen keyed by member type IDs. Struct types with the same layout (same member types in same order) are deduplicated regardless of name.","result":"9935 → 9894 (-41 IDs). Eliminated all 28 OpTypeStruct duplicates across all 199 shaders. Also saves downstream pointer type IDs and decoration instructions.","remaining_duplicates":"0 OpTypeStruct, 0 OpConstantComposite duplicates. Remaining: 155 OpLoad, 44 OpFunctionParameter, 18 OpBitcast, 11 OpAccessChain.","total_progress":"10881 → 9894 (-987 IDs, -9.1%), 199/199 pass"}}
{"run":346,"commit":"2acbf36","metric":9877,"metrics":{},"status":"keep","description":"Convert conversion sites to emitPureOp + bitcast pre-check → 9877 bound (-17), 199/199 pass, 14 fewer bitcast dups","timestamp":1777690838902,"segment":66,"confidence":8.730434782608695,"asi":{"hypothesis":"Convert conversion emission sites (convert_iti, convert_uti, convert_itof, etc.) to use emitPureOp for dedup. These pure operations (bitcasts and conversions) can be cached within basic blocks. Also add bitcast pre-check in GLSL builtin handler.","result":"9894 → 9877 (-17 IDs). Eliminated 14 of 18 duplicate OpBitcast instructions. Key learning: sites that use a pre-allocated result_id from an outer scope MUST continue using that result_id — converting to emitPureOp wastes the pre-allocated ID and causes regression (+9 IDs). Only convert sites that allocate their own ID.","remaining_duplicates":"4 OpBitcast, 0 OpTypeStruct, 0 OpConstantComposite. Remaining bitcasts are cross-block or in handlers with pre-allocated result_ids.","total_progress":"10881 → 9877 (-1004 IDs, -9.2%), 199/199 pass"}}
{"run":347,"commit":"ef03bb8","metric":9868,"metrics":{},"status":"keep","description":"Unary op emitPureOp → 9868 bound (-9), 199/199 pass, 0 SNegate duplicates","timestamp":1777691721334,"segment":66,"confidence":8.62127659574468,"asi":{"hypothesis":"Convert unary op handler (neg, fneg, logical_not, bit_not) to use emitPureOp for dedup. These are all pure operations.","result":"9877 → 9868 (-9 IDs). Eliminated all 5 OpSNegate duplicates. The unary handler allocated its own result_id, so converting to emitPureOp doesn't waste any IDs.","remaining_duplicates":"OpSNegate: 0 (was 5), OpBitcast: 4 (was 18), total 522 (was 545)","total_progress":"10881 → 9868 (-1013 IDs, -9.3%), 199/199 pass"}}
