{"run":48,"commit":"924ddfe","metric":67,"metrics":{"total_compile_error":105,"total_crash":0,"total_fail":25,"total_hang":0,"ref_valid":197,"total_tested":197},"status":"keep","description":"Fix promoteTypes for matrix*scalar + add mat_scalar_mul/scalar_mat_mul. 66→67","timestamp":1777054768139,"segment":0,"confidence":6.5,"iterationTokens":13666,"asi":{"delta":"+1 pass (66→67)","findings":"promoteTypes(mat4, float) returned .float due to early 'a==.float or b==.float' check. Must check matrix/scalar promotion BEFORE the generic float fallback. OpMatrixTimesScalar (opcode 143) handles mat*scalar.","hypothesis":"Fix promoteTypes matrix*scalar + add mat_scalar_mul","next_action_hint":"Check remaining 25 spirv-val failures. layout-component.desktop.frag has same FAdd issue. transpose.legacy.vert might now pass."}}
{"run":49,"commit":"1f45981","metric":67,"metrics":{"total_compile_error":105,"total_crash":0,"total_fail":25,"total_hang":0,"ref_valid":197,"total_tested":197},"status":"keep","description":"Scalar-to-vector splat in binary_op for add/sub/div. Infrastructure.","timestamp":1777055912259,"segment":0,"confidence":6.5,"iterationTokens":13666,"asi":{"delta":"67 passes (unchanged)","findings":"Added scalar-to-vector splat in binary_op for add/sub/div ops. layout-component.desktop.frag now passes but was already counted. No regression. The splat uses OpCompositeConstruct with N copies of the scalar ID.","hypothesis":"Add scalar-to-vector splat for add/sub","next_action_hint":"Look at outer-product.comp VectorTimesScalar type mismatch. Fix pls.frag VectorTimesScalar type issue. Fix mix.frag FMix type issue. These are concrete spirv-val failures."}}
{"run":50,"commit":"7184db4","metric":68,"metrics":{"total_compile_error":105,"total_crash":0,"total_fail":24,"total_hang":0,"ref_valid":197,"total_tested":197},"status":"keep","description":"Fix outerProduct result type direction. 67→68 passes (+1)","timestamp":1777056131507,"segment":0,"confidence":6.285714285714286,"iterationTokens":13666,"asi":{"delta":"+1 pass (67→68)","findings":"outerProduct result type was backwards. outerProduct(vecN, vecM) produces a matrix with N rows and M columns = matMxN in GLSL (M cols of vecN). Had to swap a_rows/b_rows in type selection. Also affects pls.frag which had same VectorTimesScalar type mismatch.","hypothesis":"Fix outerProduct result type direction","next_action_hint":"Fix remaining 24 spirv-val failures. Key categories: phantom IDs (4), block-must-end-with-branch (4), execution model mismatch (2), FMix operand types, ext_inst word count, OpTypePointer in wrong section, duplicate IDs."}}
{"run":51,"commit":"abc3194","metric":69,"metrics":{"total_compile_error":105,"total_crash":0,"total_fail":23,"total_hang":0,"ref_valid":197,"total_tested":197},"status":"keep","description":"Handle boolean mix() via OpSelect instead of FMix. 68→69","timestamp":1777057248450,"segment":0,"confidence":6.090909090909091,"iterationTokens":13666,"asi":{"delta":"+1 pass (68→69)","findings":"mix(x, y, bvec4) must use OpSelect instead of GLSL.std.450 FMix. OpSelect operand order: (condition, true, false). Added isBoolVector() to ast.Type.","hypothesis":"Handle boolean mix via OpSelect","next_action_hint":"Fix remaining 23 spirv-val failures. Top candidates: FMix word count (4 files), phantom IDs (6), block-must-end-with-branch (4), pls.frag VectorTimesScalar, matrix-conversion."}}
{"run":52,"commit":"7f15e5b","metric":70,"metrics":{"total_compile_error":105,"total_crash":0,"total_fail":22,"total_hang":0,"ref_valid":197,"total_tested":197},"status":"keep","description":"Fix scalar*vector: use fmul after splatting, not scalar_vec_mul. 69→70","timestamp":1777057564369,"segment":0,"confidence":6.181818181818182,"iterationTokens":13666,"asi":{"delta":"+1 pass (69→70)","findings":"After splatting scalar to vector, must use regular fmul instead of special vec_scalar_mul/scalar_vec_mul ops. The special ops expect raw scalar IDs, but after splat both operands are vectors. Added did_splat flag.","hypothesis":"Fix scalar*vector after splat","next_action_hint":"22 spirv-val failures remain. Key ones: phantom IDs, block-must-end-with-branch, execution model mismatch, ext_inst word count, matrix-conversion, image-size type error."}}
{"run":53,"commit":"0aabdad","metric":70,"metrics":{"total_compile_error":104,"total_crash":0,"total_fail":23,"total_hang":0,"ref_valid":197,"total_tested":197},"status":"keep","description":"Add imageLoad/imageStore + fix ImageQuerySize opcode. Infrastructure.","timestamp":1777058283025,"segment":0,"confidence":6.181818181818182,"iterationTokens":13666,"asi":{"delta":"70 passes (unchanged)","findings":"Added imageLoad/imageStore as OpImageRead/OpImageWrite. Fixed ImageQuerySize opcode 99→100. coherent-image.comp now compiles but has phantom ID for iimage2D type (mapped to sampler2d). 105→104 compile errors, 22→23 spirv-val failures.","hypothesis":"Add imageLoad/imageStore + fix ImageQuerySize opcode","next_action_hint":"Need proper image2D/iimage2D type support. Focus on other wins: block-must-end-with-branch (4 files), phantom IDs, matrix-conversion."}}
{"run":54,"commit":"7c51e76","metric":70,"metrics":{"total_compile_error":104,"total_crash":0,"total_fail":23,"total_hang":0,"ref_valid":197,"total_tested":197},"status":"keep","description":"Dead code elimination after return + implicit return tracking. Infra.","timestamp":1777058951053,"segment":0,"confidence":6.181818181818182,"iterationTokens":13666,"asi":{"delta":"70 passes (unchanged)","findings":"Dead code elimination and implicit return tracking added but didn't change pass count. Link files (link.multiBlocks*.vert) are link-time files without main() — can't be fixed without linker support. These should probably be filtered from tests.","hypothesis":"Dead code elimination after return","next_action_hint":"Focus on compile errors. 104 remaining — many are UndeclaredIdentifier. Check what identifiers are missing."}}
{"run":55,"commit":"3803964","metric":71,"metrics":{"total_compile_error":103,"total_crash":0,"total_fail":23,"total_hang":0,"ref_valid":197,"total_tested":197},"status":"keep","description":"Add gl_FrontFacing builtin + fix BuiltIn enum values. 70→71","timestamp":1777060701624,"segment":0,"confidence":6.2727272727272725,"iterationTokens":13666,"asi":{"delta":"+1 pass (70→71)","findings":"gl_FrontFacing was missing. BuiltIn.front_facing was 19 (SamplePosition!) instead of 17 (FrontFacing). gl_FragColor was using the same enum value 17, causing Zig enum conflict. Removed frag_color alias, added separate FrontFacing handling. gl_FragColor no longer gets BuiltIn decoration (deprecated).","hypothesis":"Add gl_FrontFacing builtin","next_action_hint":"103 compile errors remain. Check common missing builtins/identifiers. Consider adding more GL builtins like gl_PointCoord, gl_PointSize, gl_FragDepth."}}
{"run":56,"commit":"829e6e7","metric":71,"metrics":{"total_compile_error":103,"total_fail":23,"total_hang":0,"total_crash":0,"ref_valid":197,"total_tested":197},"status":"keep","description":"Resume autoresearch session — baseline check","timestamp":1777069076668,"segment":0,"confidence":6,"iterationTokens":13666,"asi":{"hypothesis":"Resume session, verify baseline"}}
{"type":"config","name":"GLSL-to-SPIR-V conformance optimization","metricName":"total_pass","metricUnit":"","bestDirection":"higher"}
{"run":57,"commit":"1bfb11b","metric":71,"metrics":{"total_compile_error":103,"total_fail":23,"total_hang":0,"total_crash":0,"ref_valid":197,"total_tested":197},"status":"keep","description":"Baseline: 71 passes","timestamp":1777070462114,"segment":1,"confidence":null,"iterationTokens":85,"asi":{"hypothesis":"Establish baseline for session"}}
{"run":58,"commit":"29b5bf3","metric":71,"metrics":{"total_compile_error":103,"total_fail":23,"total_hang":0,"total_crash":0,"ref_valid":197,"total_tested":197},"status":"keep","description":"Add textureSize builtin + fix classification cache. 71 passes.","timestamp":1777072567046,"segment":1,"confidence":null,"iterationTokens":85,"asi":{"description":"Add textureSize builtin","delta":"71 passes (unchanged)","findings":"Classification cache was corrupted (only 5 valid files). Had to manually rebuild it using simple for loop instead of find -print0 + process substitution. The find -print0 approach is unreliable on Windows Git Bash.","hypothesis":"Add textureSize builtin support","infrastructure_note":"Must periodically clear .zig-cache/ref_classification.txt and rebuild","next_action_hint":"Focus on the 103 compile errors. Most are UndeclaredIdentifier in func_call/assign_op. Need to identify which specific identifiers are missing."}}
{"run":59,"commit":"6cc781d","metric":71,"metrics":{"total_compile_error":103,"total_fail":23,"total_hang":0,"total_crash":0,"ref_valid":197,"total_tested":197},"status":"keep","description":"Add image2d type + sampler variants + error context. 71 passes.","timestamp":1777075136099,"segment":1,"confidence":null,"iterationTokens":85,"asi":{"delta":"71 passes (unchanged)","findings":"Added image2d type and many sampler variants. None moved the needle. The image-size.frag spirv-val failure is due to garbled binary from forward-referenced type IDs, not the image2d type itself. The error context improvement now shows actual identifier names in error messages, which will help future debugging.","hypothesis":"Add image2d type + sampler variants","next_action_hint":"Focus on reducing the 103 compile errors. The error context improvement shows specific failing identifiers. Check what the most impactful missing features are."}}
{"run":60,"commit":"96a14ba","metric":72,"metrics":{"total_compile_error":103,"total_fail":22,"total_hang":0,"total_crash":0,"ref_valid":197,"total_tested":197},"status":"keep","description":"Fix GLSL.std.450 instruction numbers (verified against spirv-tools). 72 passes.","timestamp":1777079097836,"segment":1,"confidence":null,"iterationTokens":85,"asi":{"hypothesis":"Fix GLSL.std.450 instruction numbers to match spirv-tools","next_action_hint":"Fix the remaining 22 spirv-val failures. Categories: phantom IDs, block-must-end-with-branch, execution model mismatch. Also look at the 48 assign_op compile errors.","delta":"+1 pass (71->72), -1 spirv-val (23->22)","root_cause":"GLSL.std.450 instruction numbers were wrong. Used spirv-as to generate reference binaries and extract correct instruction numbers. All geometric functions were off by 2 from our values. Pack/unpack numbers had packSnorm2x16 and packUnorm4x8 swapped."}}
{"run":61,"commit":"224f9d0","metric":73,"metrics":{"total_compile_error":103,"total_fail":21,"total_hang":0,"total_crash":0,"ref_valid":197,"total_tested":197},"status":"keep","description":"Add iimage2D/uimage2D/image3D/imageCube/image2DArray keywords. 73 passes.","timestamp":1777080263163,"segment":1,"confidence":null,"iterationTokens":85,"asi":{"delta":"+1 pass (72->73), -1 spirv-val (22->21)","hypothesis":"Add missing image type keywords to fix phantom IDs","root_cause":"iimage2D etc. were parsed as named types. ensureType(.named) returned allocated ID without emitting instruction when type not registered. Adding keywords to lexer/parser fixes this."}}
{"run":62,"commit":"9dff81b","metric":76,"metrics":{"total_compile_error":103,"total_fail":18,"total_hang":0,"total_crash":0,"ref_valid":197,"total_tested":197},"status":"keep","description":"Fix for-loop control flow: body->continue branch + reorder LoopMerge. 76 passes.","timestamp":1777081281512,"segment":1,"confidence":10,"iterationTokens":85,"asi":{"delta":"+3 passes (73->76), -3 spirv-val (21->18)","hypothesis":"Fix for-loop control flow structure","root_cause":"Two bugs: 1) For loop body missing OpBranch to continue block. 2) OpLoopMerge must immediately precede OpBranch/OpBranchConditional but was emitted before condition evaluation."}}
{"run":63,"commit":"94ee9dc","metric":76,"metrics":{"total_compile_error":103,"total_fail":18,"total_hang":0,"total_crash":0,"ref_valid":197,"total_tested":197},"status":"keep","description":"Add imageBuffer/image2DMS/texture2D/sampler keywords. 76 passes (infra).","timestamp":1777081819022,"segment":1,"confidence":5,"iterationTokens":85,"asi":{"delta":"76 passes (unchanged)","hypothesis":"Add missing type keywords to fix phantom IDs","next_action_hint":"The phantom ID fixes didn't improve pass count because files have other errors. Focus on the 'Branch must appear in a block' errors (2 files) or the frexp-modf decode error."}}
{"run":64,"commit":"7602654","metric":78,"metrics":{"total_compile_error":103,"total_fail":16,"total_hang":0,"total_crash":0,"ref_valid":197,"total_tested":197},"status":"keep","description":"Fix frexp/modf: use non-struct instructions with pointer arg. 78 passes.","timestamp":1777082345165,"segment":1,"confidence":4.666666666666667,"iterationTokens":85,"asi":{"delta":"+2 passes (76->78), -2 spirv-val (18->16)","hypothesis":"Fix frexp/modf to use non-struct GLSL.std.450 instructions with pointer args","root_cause":"frexp used FrexpStruct (52) with 1 arg but returned scalar type instead of struct type. Fixed by using Frexp (51) with pointer arg from analyzeLValue."}}
{"run":65,"commit":"868cd05","metric":78,"metrics":{"total_compile_error":103,"total_fail":16,"total_hang":0,"total_crash":0,"ref_valid":197,"total_tested":197},"status":"keep","description":"Fix if/else branch after return + implicit return check. 78 passes (infra).","timestamp":1777082822762,"segment":1,"confidence":3.5,"iterationTokens":85,"asi":{"delta":"78 passes (unchanged)","hypothesis":"Fix if/else branch after return + implicit return check","findings":"Fixed two structural issues: 1) OpBranch after OpReturn in if/else body. 2) Implicit return based on last instruction not all. Files like selection-block-dominator.frag now have correct control flow but still fail on type conversion issues (vec4(int) without int->float conversion).","next_action_hint":"Focus on int->float conversion in type constructors. vec4(v) where v is int should convert to float first."}}
{"run":65,"commit":"7764577","metric":79,"metrics":{"total_compile_error":103,"total_fail":15,"total_hang":0,"total_crash":0,"ref_valid":197,"total_tested":197},"status":"keep","description":"Fix int-to-float conversion in vec type constructor splat. 78→79 (+1).","timestamp":1777085511794,"segment":1,"confidence":2.2857142857142856,"iterationTokens":9410,"asi":{"hypothesis":"Fix int-to-float conversion in type constructor splat path","delta":"+1 pass (78->79), -1 spirv-val (16->15)","root_cause":"vec4(int_val) was splatting the raw int without converting to float first. Now converts int->float before splat.","file_fixed":"selection-block-dominator.frag","next_action_hint":"Fix matrix-conversion.flatten.frag (mat3(mat4) conversion). Fix phantom IDs. Fix OpReturn non-void in switch-nested."}}
{"run":66,"commit":"b2f38d8","metric":80,"metrics":{"total_compile_error":103,"total_crash":0,"total_fail":14,"total_hang":0,"ref_valid":197,"total_tested":197},"status":"keep","description":"Add OpUnreachable for unreachable merge points in if/else. 79→80 passes (+1).","timestamp":1777086515891,"segment":1,"confidence":3,"iterationTokens":17384,"asi":{"delta":"+1 pass (79->80), -1 spirv-val (15->14)","files_fixed":"switch-nested.legacy.vert (was using OpReturn instead of OpReturnValue/OpUnreachable for non-void function)","hypothesis":"Emit OpUnreachable when all branches of if/else return, instead of adding OpReturn at function level","implementation":"Added OpUnreachable to IR/codegen/spirv. When both branches of if/else return, emit unreachable_inst at merge label. Updated lastInstructionIsReturn and dead code elimination to recognize unreachable_inst. Also for non-void functions with unreachable implicit return, use OpUnreachable instead of OpReturn.","next_action_hint":"Focus on remaining 14 spirv-val failures. Also look at hoisted-temporary-use-continue-block-as-value.frag (FAdd type mismatch) and texture_buffer.vert (vector type issue)."}}
{"run":67,"commit":"1a7b06e","metric":81,"metrics":{"total_compile_error":103,"total_crash":0,"total_fail":13,"total_hang":0,"ref_valid":197,"total_tested":197},"status":"keep","description":"Add float-to-vector splat in compound_assign. 80→81 passes (+1).","timestamp":1777087045631,"segment":1,"confidence":2.857142857142857,"iterationTokens":9935,"asi":{"delta":"+1 pass (80->81), -1 spirv-val (14->13)","files_fixed":"hoisted-temporary-use-continue-block-as-value.frag - compound_assign vec4 += float now splats float to vec4 before FAdd","hypothesis":"Splat float scalar to vector in compound_assign handler","next_action_hint":"Focus on remaining 13 spirv-val failures. Top targets: image-size (2 files, wrong Result Type for OpImageQuerySize), matrix-conversion, texture_buffer, phantom IDs."}}
{"run":68,"commit":"22e425f","metric":83,"metrics":{"total_compile_error":103,"total_crash":0,"total_fail":11,"total_hang":0,"ref_valid":197,"total_tested":197},"status":"keep","description":"Fix ImageQuery capability (50, not 22) + vector type conversion in composite constructors. 81→83 (+2).","timestamp":1777089088104,"segment":1,"confidence":3,"iterationTokens":862,"asi":{"delta":"+2 passes (81->83), -2 spirv-val (13->11)","files_fixed":"image-size.frag, image-size.no-qualifier-deduction.frag","hypothesis":"Fix ImageQuery capability value (was 22, should be 50) + convert vector component types in composite constructors","root_cause":"Two bugs: 1) ImageQuery capability was 22 (Int16!) instead of 50. Used spirv-dis to empirically verify correct value. 2) Multi-arg type constructors like vec4(ivec2, ivec2) didn't convert component types before CompositeConstruct.","next_action_hint":"Focus on remaining 11 spirv-val failures and 103 compile errors."}}
{"run":69,"commit":"402a7a7","metric":83,"metrics":{"total_compile_error":103,"total_crash":0,"total_fail":11,"total_hang":0,"ref_valid":197,"total_tested":197},"status":"keep","description":"Infrastructure: isnan/isinf builtins, vector type conversions, swizzle investigation. 83 passes (unchanged).","timestamp":1777094331644,"segment":1,"confidence":3,"iterationTokens":18773,"asi":{"delta":"83 passes (unchanged)","findings":"Several attempted fixes didn't improve pass count: 1) Lexer '.' tokenization fix (dot operator vs double_literal) causes massive regression (83→56) because .5 number literals rely on '.' being classified as double_literal. The real fix needs to distinguish '.' followed by digits (number) vs '.' followed by letters (operator). 2) Member_access vector swizzle handling (v.x, v.xy) also regressed because the parser currently doesn't create proper member_access for swizzles - the '.' is consumed as double_literal so 'v.xy' becomes 'v' then '.xy' (number) then the next token. 3) isnan/isinf builtins added as infrastructure but files using them have other issues (fp64 etc). 4) Vector type conversion (ivec2(uvec2), etc.) added as infrastructure. 5) preEmitPointerTypes approach for struct-flatten-stores exposed a deeper bug (undefined function IDs for type constructors). 6) The swizzle access problem is the single biggest blocker for compile errors but requires a careful lexer fix that doesn't break .5 literals.","hypothesis":"Infrastructure improvements + investigation of swizzle handling","next_action_hint":"The '.' lexer fix is critical but risky. Need to fix tryParseNumber to only consume '.' as a number start if followed by a DIGIT. Then fix the member_access handler for vectors. This is the single biggest compile error blocker. Also: the 11 spirv-val failures are hard — phantom IDs from named types, execution model issues, etc."}}
{"run":70,"commit":"008cf8e","metric":83,"metrics":{"total_compile_error":103,"total_crash":0,"total_fail":11,"total_hang":0,"ref_valid":197,"total_tested":197},"status":"keep","description":"Investigation: lexer '.' fix + swizzle handling. Found parser evaluation-order bug in parsePostfix .dot case. 83 passes (unchanged).","timestamp":1777095636686,"segment":1,"confidence":2.4,"iterationTokens":1872,"asi":{"delta":"83 passes (unchanged)","findings":"CRITICAL FINDING: The lexer '.' tokenization fix has a deeper problem. When '.' is correctly tokenized as .dot, the parser creates member_access nodes. But there's a BUG where the parser creates TWO member_access nodes for a single swizzle like 'v.y': first with children=1 (correct), then with children=0 (broken). The second one causes SemanticFailed. This is likely the evaluation-order bug in the dupeNodes call inside the .dot case of parsePostfix. The fix is NOT just the lexer — it needs the parser evaluation-order fix too. This is the same class of bug fixed earlier for binary_op (commit 28a0b30). The parsePostfix .dot case uses 'try self.dupeNodes(&.{expr})' which may have the same issue. Need to use a makeMemberAccess helper like makeBinaryOp.","hypothesis":"Investigate lexer + parser + semantic swizzle handling","next_action_hint":"Fix the parsePostfix .dot case evaluation-order bug (same pattern as binary_op). Then re-apply the lexer fix + proper swizzle handling. This triple fix (lexer + parser + semantic) should work together without regressions."}}
