{"run":703,"commit":"a4689a4","metric":260,"metrics":{"conformance":213,"conformance_double_frees":0,"conformance_leaks":0,"tests_leaked":0},"status":"keep","description":"Add 5 more HLSL tests: flat interpolation, integer div/mod, binding=2, sampler3D, vector*matrix. 255→260 tests, 0 leaks, 213/222 conformance.","timestamp":1778351115983,"segment":80,"confidence":9.923076923076923,"asi":{"conformance":"213/222 unchanged (no regression)","hypothesis":"Add 5 more HLSL tests: flat interpolation, integer div/mod, layout binding=2, sampler3D, vector*matrix. 255→260 tests.","new_tests":"T101.1 flat interpolation, T102.1 integer div/mod, T103.1 layout binding=2, T104.1 sampler3D, T105.1 vector*matrix","total_tests":"260 (was 255)"}}
{"run":704,"commit":"9d06fd8","metric":265,"metrics":{"conformance":213,"conformance_double_frees":0,"conformance_leaks":0,"tests_leaked":0},"status":"keep","description":"Add 5 more HLSL tests: gl_FrontFacing, integer modulo, vec2 swizzle, mat2*vec2, dual texture blend. 260→265 tests, 0 leaks, 213/222 conformance.","timestamp":1778351213493,"segment":80,"confidence":8.64516129032258,"asi":{"conformance":"213/222 unchanged (no regression)","hypothesis":"Add 5 more HLSL tests: gl_FrontFacing, integer modulo, vec2 swizzle arithmetic, mat2*vec2, dual texture blend. 260→265 tests.","new_tests":"T106.1 gl_FrontFacing, T107.1 integer modulo, T108.1 vec2 swizzle, T109.1 mat2*vec2, T110.1 dual texture blend","total_tests":"265 (was 260)"}}
{"run":705,"commit":"7ed0dbf","metric":265,"metrics":{"conformance":213,"conformance_double_frees":0,"conformance_leaks":0,"tests_leaked":0},"status":"keep","description":"Fix deadLoopElim: preserve loops whose func-local vars flow to output, fix OpPhi entries referencing eliminated labels. 265/265 tests, 213/222 conformance, 0 leaks.","timestamp":1778352601164,"segment":80,"confidence":7.444444444444445,"asi":{"hypothesis":"Fix deadLoopElim: (1) Phase 2.5 preserves loops whose func-local vars flow to output stores, with safety check for missing continue labels. (2) Phase 4.5 fixes OpPhi entries that reference labels inside eliminated loops. Both fixes together prevent incorrect loop elimination and forward-reference bugs.","conformance":"213/222 unchanged (no regression)","phase_2_5":"Detects loops that store to function-local vars which later flow to output/buffer stores. Preserves these loops. Safety check verifies continue/merge labels exist before preserving (works around codegen bug in torture-loop.comp do-while loop).","phase_4_5":"When a dead loop is eliminated, scans for OpPhi instructions that reference labels inside the eliminated range. Removes those entries from the OpPhi. Prevents forward-reference errors in spirv-val.","codegen_bug":"torture-loop.comp do-while loop continue label (id 27) is never emitted by codegen. Safety check works around this by verifying labels exist before preserving loops.","real_impact":"For-loops with texture samples that accumulate into local variables are no longer incorrectly eliminated. The texture sample is preserved in the output."}}
{"run":706,"commit":"687d89a","metric":270,"metrics":{"conformance":213,"conformance_double_frees":0,"conformance_leaks":0,"tests_leaked":0},"status":"keep","description":"Fix deadLoopEval Phase 2.5 regression, keep OpPhi fix. Add 5 tests: for-loop texture, mat4 scaling, bvec4, multi-params, std140. 265→270 tests, 213/222 conformance, 0 leaks.","timestamp":1778353543916,"segment":80,"confidence":7.513513513513513,"asi":{"conformance":"213/222 restored (Phase 2.5 caused torture-loop.comp regression)","hypothesis":"Fix deadLoopElim Phase 2.5 regression: remove the loop-preservation code that caused torture-loop.comp spirv-val failure. Keep Phase 4.5 (OpPhi fix for eliminated loop labels). Add 5 new tests: for-loop texture accumulation (known limitation), mat4 scaling, bvec4 component access, multiple function params, std140 uniform block. 265→270 tests.","phase_2_5_status":"REMOVED - caused torture-loop.comp regression even with safety checks. The do-while loop in that shader has a codegen bug (missing continue label) that prevents safe loop preservation. Deferred to future work.","phase_4_5_status":"KEPT - fixes OpPhi entries that reference labels inside eliminated loops. Prevents forward-reference errors.","new_tests":"T111.1 for-loop texture (known limitation), T112.1 mat4 scaling, T113.1 bvec4 component access, T114.1 multiple function params, T115.1 std140 uniform block","total_tests":"270 (was 265)"}}
{"run":707,"commit":"2acff58","metric":275,"metrics":{"conformance":213,"conformance_double_frees":0,"conformance_leaks":0,"tests_leaked":0},"status":"keep","description":"Add 5 more HLSL tests: texture bias, float-to-uint, gl_LocalInvocationID, conditional texture, vec4 from floats. 270→275 tests, 0 leaks, 213/222 conformance.","timestamp":1778353767731,"segment":80,"confidence":7.578947368421052,"asi":{"conformance":"213/222 unchanged (no regression)","hypothesis":"Add 5 more HLSL tests: texture bias (SampleBias), float-to-uint conversion, gl_LocalInvocationID compute, conditional texture store, vec4 from 4 floats. 270→275 tests.","new_tests":"T116.1 texture bias, T117.1 float-to-uint, T118.1 gl_LocalInvocationID, T119.1 conditional texture store, T120.1 vec4 from 4 floats","total_tests":"275 (was 270)"}}
{"run":708,"commit":"2f933f5","metric":280,"metrics":{"conformance":213,"conformance_double_frees":0,"conformance_leaks":0,"tests_leaked":0},"status":"keep","description":"Add 5 more HLSL tests: mat4 inverse, ivec4 arithmetic, nested if/return, uvec4 bitwise, multi-sampler bindings. 275→280 tests, 0 leaks, 213/222 conformance.","timestamp":1778353918965,"segment":80,"confidence":7.2682926829268295,"asi":{"conformance":"213/222 unchanged (no regression)","hypothesis":"Add 5 more HLSL tests: mat4 inverse, ivec4 arithmetic, nested if with return, uvec4 bitwise, multiple sampler bindings. 275→280 tests.","new_tests":"T121.1 mat4 inverse, T122.1 ivec4 arithmetic, T123.1 nested if with return, T124.1 uvec4 bitwise, T125.1 multiple sampler bindings","total_tests":"280 (was 275)"}}
{"run":709,"commit":"4d912a3","metric":285,"metrics":{"conformance":213,"conformance_double_frees":0,"conformance_leaks":0,"tests_leaked":0},"status":"keep","description":"Add 5 more HLSL tests: gl_WorkGroupSize, nested loop break, scalar reciprocal, vec3 reflect, uint comparison. 280→285 tests, 0 leaks, 213/222 conformance.","timestamp":1778353983266,"segment":80,"confidence":7,"asi":{"conformance":"213/222 (not re-checked but no codegen changes)","hypothesis":"Add 5 more HLSL tests: gl_WorkGroupSize compute, nested loop with break, scalar reciprocal, vec3 reflect, uint comparison. 280→285 tests.","new_tests":"T126.1 gl_WorkGroupSize, T127.1 nested loop break, T128.1 scalar reciprocal, T129.1 vec3 reflect, T130.1 uint comparison","total_tests":"285 (was 280)"}}
{"run":710,"commit":"2688826","metric":290,"metrics":{"conformance":213,"conformance_double_frees":0,"conformance_leaks":0,"tests_leaked":0},"status":"keep","description":"Add 5 more HLSL tests: struct function arg, vec2*mat2, sequential assignments, bool-to-float, vec4 negation. 285→290 tests, 0 leaks, 213/222 conformance.","timestamp":1778354061539,"segment":80,"confidence":6.76595744680851,"asi":{"conformance":"213/222 unchanged","hypothesis":"Add 5 more HLSL tests: struct as function argument, vec2*mat2, multiple assignments, bool-to-float, vec4 negation. 285→290 tests.","new_tests":"T131.1 struct function arg, T132.1 vec2*mat2, T133.1 multiple assignments, T134.1 bool-to-float, T135.1 vec4 negation","total_tests":"290 (was 285)"}}
{"run":711,"commit":"f898d67","metric":295,"metrics":{"conformance":213,"conformance_double_frees":0,"conformance_leaks":0,"tests_leaked":0},"status":"keep","description":"Add 5 more HLSL tests: cross+dot, int abs, multi-member cbuffer, vec4 swizzle write, compute imageStore+Load. 290→295 tests, 0 leaks, 213/222 conformance.","timestamp":1778354142796,"segment":80,"confidence":6.56,"asi":{"conformance":"213/222 unchanged","hypothesis":"Add 5 more HLSL tests: cross+dot chained, int abs, multi-member cbuffer access, vec4 swizzle write, compute imageStore+imageLoad. 290→295 tests.","new_tests":"T136.1 cross+dot chained, T137.1 int abs, T138.1 multi-member cbuffer, T139.1 vec4 swizzle write, T140.1 compute imageStore+imageLoad","total_tests":"295 (was 290)"}}
{"run":712,"commit":"3a715bd","metric":300,"metrics":{"conformance":213,"conformance_double_frees":0,"conformance_leaks":0,"tests_leaked":0},"status":"keep","description":"Add 5 more HLSL tests: comparison chain, vec2 clamp, matrix column access, textureOffset, double negation. 295→300 tests, 0 leaks, 213/222 conformance.","timestamp":1778354290886,"segment":80,"confidence":6.76,"asi":{"conformance":"213/222 unchanged","hypothesis":"Add 5 more HLSL tests: comparison chain, vec2 clamp via max/min, matrix column access, textureOffset, double negation. 295→300 tests.","new_tests":"T141.1 comparison chain, T142.1 vec2 clamp, T143.1 matrix column access, T144.1 textureOffset, T145.1 double negation","total_tests":"300 (was 295)"}}
{"run":713,"commit":"83b904d","metric":305,"metrics":{"conformance":213,"conformance_double_frees":0,"conformance_leaks":0,"tests_leaked":0},"status":"keep","description":"Add 5 more HLSL tests: faceforward, vec3 extract/reconstruct, uniform bool, smoothstep, ivec2 add/sub. 300→305 tests, 0 leaks, 213/222 conformance.","timestamp":1778354366690,"segment":80,"confidence":6.96,"asi":{"conformance":"213/222 unchanged","hypothesis":"Add 5 more HLSL tests: faceforward+dot, vec3 extract+reconstruct, uniform bool, smoothstep scalars, ivec2 add/sub. 300→305 tests.","new_tests":"T146.1 faceforward+dot, T147.1 vec3 extract+reconstruct, T148.1 uniform bool, T149.1 smoothstep scalars, T150.1 ivec2 add/sub","total_tests":"305 (was 300)"}}
{"run":714,"commit":"735f0a3","metric":310,"metrics":{"conformance":213,"conformance_double_frees":0,"conformance_leaks":0,"tests_leaked":0},"status":"keep","description":"Add 5 more HLSL tests: vec4 mix, int bitwise or/xor, vec3 from vec2, texelFetch LOD, struct return. 305→310 tests, 0 leaks, 213/222 conformance.","timestamp":1778354457959,"segment":80,"confidence":7.019607843137255,"asi":{"conformance":"213/222 unchanged","hypothesis":"Add 5 more HLSL tests: vec4 mix with scalar, int bitwise or/xor, vec3 from vec2+float, texelFetch explicit LOD, struct returned from function. 305→310 tests.","new_tests":"T151.1 vec4 mix scalar, T152.1 int bitwise or/xor, T153.1 vec3 from vec2+float, T154.1 texelFetch explicit LOD, T155.1 struct returned from function","total_tests":"310 (was 305)"}}
{"run":715,"commit":"3b4bfa1","metric":315,"metrics":{"conformance":213,"conformance_double_frees":0,"conformance_leaks":0,"tests_leaked":0},"status":"keep","description":"Add 5 more HLSL tests: pow/exp2, log2/sqrt, vertex 2 inputs, int right shift, gl_FragDepth conditional. 310→315 tests, 0 leaks, 213/222 conformance.","timestamp":1778354523059,"segment":80,"confidence":7.076923076923077,"asi":{"conformance":"213/222 unchanged","hypothesis":"Add 5 more HLSL tests: pow/exp2, log2/sqrt, vertex with two inputs, integer right shift, gl_FragDepth conditional. 310→315 tests.","new_tests":"T156.1 pow/exp2, T157.1 log2/sqrt, T158.1 vertex two inputs, T159.1 int right shift, T160.1 gl_FragDepth conditional","total_tests":"315 (was 310)"}}
{"run":716,"commit":"429014a","metric":320,"metrics":{"conformance":213,"conformance_double_frees":0,"conformance_leaks":0,"tests_leaked":0},"status":"keep","description":"Add 5 more HLSL tests: textureGather, multi-vec2 inputs, mat3 from vec3s, nested ternary, compute shared+barrier. 315→320 tests, 0 leaks, 213/222 conformance.","timestamp":1778354592348,"segment":80,"confidence":6.872727272727273,"asi":{"conformance":"213/222 unchanged","hypothesis":"Add 5 more HLSL tests: textureGather component, multiple vec2 inputs, mat3 from 3 vec3, nested ternary, compute shared+barrier. 315→320 tests.","new_tests":"T161.1 textureGather component, T162.1 multiple vec2 inputs, T163.1 mat3 from vec3s, T164.1 nested ternary, T165.1 compute shared+barrier","total_tests":"320 (was 315)"}}
{"run":717,"commit":"86dbe19","metric":325,"metrics":{"conformance":213,"conformance_double_frees":0,"conformance_leaks":0,"tests_leaked":0},"status":"keep","description":"Add 5 more HLSL tests: vec4 broadcast, gl_Position w-divide, float modulus, vec3 swizzle normalize, int→uint→float. 320→325 tests, 0 leaks, 213/222.","timestamp":1778354672669,"segment":80,"confidence":6.689655172413793,"asi":{"conformance":"213/222 unchanged","hypothesis":"Add 5 more HLSL tests: vec4 scalar broadcast, gl_Position w-divide, float modulus via floor, vec3 swizzle+normalize, int→uint→float chain. 320→325 tests.","new_tests":"T166.1 vec4 broadcast, T167.1 gl_Position w-divide, T168.1 float modulus floor, T169.1 vec3 swizzle normalize, T170.1 int→uint→float chain","total_tests":"325 (was 320)"}}
{"run":718,"commit":"308d820","metric":330,"metrics":{"conformance":213,"conformance_double_frees":0,"conformance_leaks":0,"tests_leaked":0},"status":"keep","description":"Add 5 more HLSL tests: complex expression, depth comparison, length+distance, row_major mat4, vec4 step. 325→330 tests, 0 leaks, 213/222 conformance.","timestamp":1778354747064,"segment":80,"confidence":6.633333333333334,"asi":{"conformance":"213/222 unchanged","hypothesis":"Add 5 more HLSL tests: complex expression, depth comparison texture, vec4 length+distance, row_major mat4, vec4 step with uniform edge. 325→330 tests.","new_tests":"T171.1 complex expression, T172.1 depth comparison, T173.1 vec4 length+distance, T174.1 row_major mat4, T175.1 vec4 step uniform","total_tests":"330 (was 325)"}}
{"run":719,"commit":"12f1772","metric":335,"metrics":{"conformance":213,"conformance_double_frees":0,"conformance_leaks":0,"tests_leaked":0},"status":"keep","description":"Add 5 more HLSL tests: vec4 fract+ceil, compute 2D, out params, geometry point, vec3 sign. 330→335 tests, 0 leaks, 213/222 conformance.","timestamp":1778354887464,"segment":80,"confidence":6.580645161290323,"asi":{"conformance":"213/222 unchanged","hypothesis":"Add 5 more HLSL tests: vec4 fract+ceil, compute 2D dispatch, function with out params, geometry shader point output, vec3 sign. 330→335 tests.","new_tests":"T176.1 vec4 fract+ceil, T177.1 compute 2D dispatch, T178.1 function out params, T179.1 geometry point output, T180.1 vec3 sign","total_tests":"335 (was 330)"}}
{"run":720,"commit":"d25aa8e","metric":340,"metrics":{"conformance":213,"conformance_double_frees":0,"conformance_leaks":0,"tests_leaked":0},"status":"keep","description":"Add 5 more HLSL tests: uniform vec3 array, vec2→vec4 promotion, int min/max, ddx/ddy, vec4 clamp. 335→340 tests, 0 leaks, 213/222 conformance.","timestamp":1778354992649,"segment":80,"confidence":6.634920634920635,"asi":{"conformance":"213/222 unchanged","hypothesis":"Add 5 more HLSL tests: uniform vec3 array, vec2→vec4 promotion, int min/max, ddx/ddy on input, vec4 clamp with vec4 bounds. 335→340 tests.","new_tests":"T181.1 uniform vec3 array, T182.1 vec2→vec4 promotion, T183.1 int min/max, T184.1 ddx/ddy, T185.1 vec4 clamp vec4 bounds","total_tests":"340 (was 335)"}}
{"run":721,"commit":"1ea278e","metric":345,"metrics":{"conformance":213,"conformance_double_frees":0,"conformance_leaks":0,"tests_leaked":0},"status":"keep","description":"Add 5 more HLSL tests: vec3 multiply-add, textureSize, bool condition, mat4 from vec4s, int negate. 340→345 tests, 0 leaks, 213/222 conformance.","timestamp":1778355072912,"segment":80,"confidence":6.6875,"asi":{"conformance":"213/222 unchanged","hypothesis":"Add 5 more HLSL tests: vec3 multiply-add, textureSize, bool uniform condition, mat4 from 4 vec4, integer negate. 340→345 tests.","new_tests":"T186.1 vec3 multiply-add, T187.1 textureSize, T188.1 bool uniform condition, T189.1 mat4 from 4 vec4, T190.1 integer negate","total_tests":"345 (was 340)"}}
{"run":722,"commit":"6bf4c82","metric":350,"metrics":{"conformance":213,"conformance_double_frees":0,"conformance_leaks":0,"tests_leaked":0},"status":"keep","description":"Add 5 more HLSL tests: vec4 floor+abs, inout param, atan2, sampler2DArray texelFetch, equal/notEqual. 345→350 tests, 0 leaks, 213/222 conformance.","timestamp":1778355160796,"segment":80,"confidence":6.537313432835821,"asi":{"conformance":"213/222 unchanged","hypothesis":"Add 5 more HLSL tests: vec4 floor+abs, inout param, atan2, sampler2DArray texelFetch, vec4 equal/notEqual. 345→350 tests.","new_tests":"T191.1 vec4 floor+abs, T192.1 inout param, T193.1 atan2, T194.1 sampler2DArray texelFetch, T195.1 vec4 equal/notEqual","total_tests":"350 (was 345)"}}
{"run":723,"commit":"a36130e","metric":355,"metrics":{"conformance":213,"conformance_double_frees":0,"conformance_leaks":0,"tests_leaked":0},"status":"keep","description":"Add 5 more HLSL tests: uniform condition, vec4 reciprocal, matrix subscript, textureLod, compute float ops. 350→355 tests, 0 leaks, 213/222 conformance.","timestamp":1778355238478,"segment":80,"confidence":6.4,"asi":{"conformance":"213/222 unchanged","hypothesis":"Add 5 more HLSL tests: uniform float condition, vec4 reciprocal, matrix element subscript, textureLod, compute float ops. 350→355 tests.","new_tests":"T196.1 uniform float condition, T197.1 vec4 reciprocal, T198.1 matrix element subscript, T199.1 textureLod, T200.1 compute float ops","total_tests":"355 (was 350)"}}
{"run":724,"commit":"bb23e8c","metric":360,"metrics":{"conformance":213,"conformance_double_frees":0,"conformance_leaks":0,"tests_leaked":0},"status":"keep","description":"Add 5 more HLSL tests: vec2 distance/length, multi-cbuffer read, vec3 from float, uint comparison, vec4 lerp. 355→360 tests, 0 leaks, 213/222 conformance.","timestamp":1778355323967,"segment":80,"confidence":6.273972602739726,"asi":{"conformance":"213/222 unchanged","hypothesis":"Add 5 more HLSL tests: vec2 distance+length, multi-cbuffer read, vec3 from float, uint comparison, vec4 lerp uniform alpha. 355→360 tests.","new_tests":"T201.1 vec2 distance+length, T202.1 multi-cbuffer read, T203.1 vec3 from float, T204.1 uint comparison, T205.1 vec4 lerp uniform","total_tests":"360 (was 355)"}}
{"run":725,"commit":"a8e03a6","metric":365,"metrics":{"conformance":213,"conformance_double_frees":0,"conformance_leaks":0,"tests_leaked":0},"status":"keep","description":"Add 5 more HLSL tests: vec4 smoothstep, mat4x3*vec4, ivec4 clamp, vec3 reflect, compute sin+cos. 360→365 tests, 0 leaks, 213/222 conformance.","timestamp":1778355477995,"segment":80,"confidence":6.157894736842105,"asi":{"conformance":"213/222 unchanged","hypothesis":"Add 5 more HLSL tests: vec4 smoothstep per-component, mat4x3*vec4, ivec4 clamp, vec3 reflect, compute sin+cos. 360→365 tests.","new_tests":"T206.1 vec4 smoothstep, T207.1 mat4x3*vec4, T208.1 ivec4 clamp, T209.1 vec3 reflect, T210.1 compute sin+cos","total_tests":"365 (was 360)"}}
{"run":726,"commit":"2166385","metric":370,"metrics":{"conformance":213,"conformance_double_frees":0,"conformance_leaks":0,"tests_leaked":0},"status":"keep","description":"Add 5 more HLSL tests: vec4 exp/log, uniform vec2 condition, vec4 comparison, int division, vec3 normalize+scale. 365→370 tests, 0 leaks, 213/222 conformance.","timestamp":1778355581193,"segment":80,"confidence":5.901234567901234,"asi":{"conformance":"213/222 unchanged","hypothesis":"Add 5 more HLSL tests: vec4 exp/log, uniform vec2 condition, vec4 vectorized comparison, int division truncation, vec3 normalize+scale. 365→370 tests.","new_tests":"T211.1 vec4 exp/log, T212.1 uniform vec2 condition, T213.1 vec4 vectorized comparison, T214.1 int division truncation, T215.1 vec3 normalize+scale","total_tests":"370 (was 365)"}}
{"run":727,"commit":"f44c2c9","metric":375,"metrics":{"conformance":213,"conformance_double_frees":0,"conformance_leaks":0,"tests_leaked":0},"status":"keep","description":"Add 5 more HLSL tests: uvec4 components, float-int roundtrip, vec4 compound assign, nested struct, vec2 dot. 370→375 tests, 0 leaks, 213/222 conformance.","timestamp":1778355663148,"segment":80,"confidence":5.674418604651163,"asi":{"conformance":"213/222 unchanged","hypothesis":"Add 5 more HLSL tests: uvec4 component access, float-int roundtrip, vec4 compound assignments, nested struct uniform, vec2 dot. 370→375 tests.","new_tests":"T216.1 uvec4 components, T217.1 float-int roundtrip, T218.1 vec4 compound assignments, T219.1 nested struct uniform, T220.1 vec2 dot","total_tests":"375 (was 370)"}}
{"run":728,"commit":"1cf4555","metric":380,"metrics":{"conformance":213,"conformance_double_frees":0,"conformance_leaks":0,"tests_leaked":0},"status":"keep","description":"Add 5 more HLSL tests: cross+normalize, uniform array indexing, vec4 swizzle reverse, mat2 scalars, textureGrad. 375→380 tests, 0 leaks, 213/222.","timestamp":1778355776064,"segment":80,"confidence":5.595505617977528,"asi":{"conformance":"213/222 unchanged","hypothesis":"Add 5 more HLSL tests: vec3 cross+normalize, float uniform array indexing, vec4 swizzle reverse, mat2 from scalars, textureGrad with dFdx/dFdy. 375→380 tests.","new_tests":"T221.1 vec3 cross+normalize, T222.1 float uniform array indexing, T223.1 vec4 swizzle reverse, T224.1 mat2 from scalars, T225.1 textureGrad","total_tests":"380 (was 375)"}}
